author,author_flair_text,created_utc,distiguished,edited,id,is_original_content,is_self,name,num_comments,over_18,permalink,score,selftext,subreddit,title,upvote_ratio,url
Serious_Dot_4532,,1691594191,,False,15mi6ny,False,True,t3_15mi6ny,12,False,/r/VancouverIsland/comments/15mi6ny/does_anyone_know_which_island_this_is/,14,"Tried posting this in the Gulf Islands subreddit but it's restricted. Back in about 2001 I went on a school trip to one of the islands between the mainland and Vancouver Island. I can't remember if we had to take an additional private charter boat or if the BC ferry dropped us off directly. From memory, it there weren't many houses or towns, but it was more of a wildlife preserve with camping. I thought the island name started with a M, but Mayne nor Moresby fit the map from the photo.

Picture is one I have of the information board by the campground: https://imgur.com/b5UzyP4

Anyone have any idea which island it is?",VancouverIsland,Does anyone know which island this is?,0.9,https://www.reddit.com/r/VancouverIsland/comments/15mi6ny/does_anyone_know_which_island_this_is/
Feral_KaTT,,1689489462,,False,150yvfd,False,False,t3_150yvfd,1,False,/r/VancouverIsland/comments/150yvfd/drought_conditions_in_the_fog_zone_of_tofino_is/,19,,VancouverIsland,Drought conditions in the fog zone of Tofino is having impacts. Stage 3 Water restrictions are implemented. Town meeting for residents called. Drought conditions across Island with exception of CRD.,0.92,https://i.redd.it/tgkdpyykv9cb1.jpg
Feral_KaTT,,1686205369,,1686263977.0,1441b9q,False,True,t3_1441b9q,103,False,/r/VancouverIsland/comments/1441b9q/please_do_not_come_to_west_coast_stay_on_east/,246,"
Check with insurance companies before transversing the alternate route. Many do not cover 'off highway'. ● Rental vehicles and rental RVs are not allowed off highway and voids your insurance and some companies levy charges if they are aware of it going off road.● There have been accidents, rollovers, reports of it taking 7 hours at times, and numerous tire punctures. ●There are lots of good Samaritan stories also. ● IF something major happens on the road, we are cut off except air and boat. ●As of Wednesday, large vehicles and transport trucks were not allowed to travel that road. It cut off supplies coming in.. and fresh food and fish are going out. ● Please stay on the East side",VancouverIsland,Please do not come to West coast. Stay on East side of Island. The Shelves are bare in many of the grocery stores in Alberni. The Coast has even less food hubs. Gas shortages/restrictions are a very real probability. Our supply chains are cut off.,0.88,https://www.reddit.com/r/VancouverIsland/comments/1441b9q/please_do_not_come_to_west_coast_stay_on_east/
Girlygabenpepe,,1675177763,,False,10q1f89,False,True,t3_10q1f89,4,False,/r/VancouverIsland/comments/10q1f89/rv_camping/,1,"We are planning a trip to Vancouver Island this summer and wanted to rent an RV. Camp sites in Canada in general often don't mention if there are length restrictions to their campsites (or at least we haven't been able to find them). Is there any problems we could run into with a 31 or 32 foot long vehicle on the island? Or anything else we should consider in advance of booking our vehicle? I'd be thankful for any information as to how accessible the island is for travelling like that in general (we would book it on the mainland and move on to the USA in it later)  and if somebody has any helpful information regarding camp sites on Vancouver Island (or how to find out more about them). Thanks for reading, best wishes, a very nervous tourist :-)",VancouverIsland,RV camping,0.55,https://www.reddit.com/r/VancouverIsland/comments/10q1f89/rv_camping/
animationismypassion,,1649648208,,False,u0yi63,False,True,t3_u0yi63,11,False,/r/VancouverIsland/comments/u0yi63/looking_for_friends_in_nanaimo/,24,"Hi!  


My partner and I (I'm 25 and he's 33) have been living in Nanaimo for the last 6 months. And between Covid-19 restrictions and the both of us working from home, it's been challenging trying to meet people and make friends here. Does anyone know of some good ways to make friends in Nanaimo?   


Or if there's anyone on this thread that would like to meet, some of our interests include: Going on hikes, walking our dog (and dogs in general), board games, coffee, videogames, movies, music, drawing, animation, plants etc. We're also gay, so if you're LGBTQ then that's a plus :)   


Any help is really appreciated!",VancouverIsland,Looking for friends in Nanaimo,0.9,https://www.reddit.com/r/VancouverIsland/comments/u0yi63/looking_for_friends_in_nanaimo/
MrJoKeR604,,1643868110,,False,sjbmws,False,True,t3_sjbmws,142,False,/r/VancouverIsland/comments/sjbmws/freedumb_convoy/,96,"Apparently, these people with nothing better to do on Saturday except annoy us with their honking, plan to do this every Saturday until ""Trudeau resigns or lifts all restrictions"". Which doesn't even make sense because that really isn't how any of that works.

Are we really going to have to put up with this every Saturday? they start at 6:45 am in Campbell River and work their way south.",VancouverIsland,"""Freedumb convoy""",0.75,https://www.reddit.com/r/VancouverIsland/comments/sjbmws/freedumb_convoy/
gipsydanger1701,,1641680321,,False,rzbnjw,False,True,t3_rzbnjw,23,False,/r/VancouverIsland/comments/rzbnjw/any_suggestions_on_hiring_a_chef/,3,"Hi, we’re going to Vancouver island next month with my family and my partners family to our vacation property, we want everyone to relax and enjoy themselves and due to COVID we won’t be able to go to any restaurants together. (Based on current restrictions). So we were thinking of a chef, we would want to supply the food. Does anyone have any ideas on costs or even recommendations. Thanks so much.",VancouverIsland,Any suggestions on hiring a chef?,0.59,https://www.reddit.com/r/VancouverIsland/comments/rzbnjw/any_suggestions_on_hiring_a_chef/
RavenOfNod,,1630708356,,False,phfe6h,False,False,t3_phfe6h,3,False,/r/VancouverIsland/comments/phfe6h/campfire_ban_being_lifted_in_central_coast_region/,14,,VancouverIsland,"Campfire ban being lifted in Central Coast region - but make sure to check local restrictions. (E.g. ban is still in effect on Quadra Island, and likely more places)",0.94,/r/britishcolumbia/comments/phfdvn/campfire_ban_being_lifted_in_central_coast_region/
travisco_nabisco,,1629156751,,False,p5rwhj,False,True,t3_p5rwhj,7,False,/r/VancouverIsland/comments/p5rwhj/how_low_of_a_ride_is_needed_to_see_muir_creek/,5,I'm wanting to take my kid out to see the fossils on Saturday and am not sure how low of a ride is needed to access them.  Low ride is around 8 am with high tide around 4 pm. If we got there around 9 would that leave us a few hours to explore before the tides restrict access?,VancouverIsland,How low of a ride is needed to see Muir Creek Beach fossils,0.73,https://www.reddit.com/r/VancouverIsland/comments/p5rwhj/how_low_of_a_ride_is_needed_to_see_muir_creek/
breakfastpistachio,,1626508835,,1626509838.0,om02h2,False,True,t3_om02h2,12,False,/r/VancouverIsland/comments/om02h2/suggestions_which_community_to_live_in_this_winter/,4,"Hey y’all. I’m thinking about staying on the island this winter. 
I’m moving from northern Canada to get a break from our harsh and dark winters, and I’ve never lived near the ocean so it’s my absolute biggest priority to smell the ocean when I wake up in the morning.

I’m in my 30s and will also be needing to work, so some place with jobs in hospitality, tourism, and the like, although I’m very adaptable in almost any business sector. Not looking for a career job here. 

Hopes and dreams:
- Somewhere with some sun, within walking distance to the ocean.
- dog-friendly housing (I know it’s a big ask)
- good dive bars! I need a hole-in-the-wall pub with happy hour draft and live music where I can go be my boisterous self. Gold miners, loggers and sailors are my bread and butter. Yknow, somewhere you might not bring your grandparents if they were visiting town. 
- size of the town doesn’t matter but “cute” or “quirky” would be nice. 
- walking, running trails
- fresh seafood. Like, right off the boat. From a small business. Drooooool.
- somewhere I can meet fellow young entrepreneurs/professionals
- as little snow as freaking possible. 
- nearby rainforest


I feel like I must mention Covid: now I know it’s an island and it may be interesting to move into a new community, but I’m double-vaxxed and reside in a very remote northern town, so I’m aware of the etiquette and will take my precautions to keep people safe and respect the community. With that said, what life like with restrictions there? Anything specific I should know?",VancouverIsland,Suggestions? Which community to live in this winter?,0.61,https://www.reddit.com/r/VancouverIsland/comments/om02h2/suggestions_which_community_to_live_in_this_winter/
FamilyTravelTime,,1626490153,,1626498125.0,olvwt9,False,True,t3_olvwt9,5,False,/r/VancouverIsland/comments/olvwt9/best_place_on_the_island_for_clam_digging_razor/,1,"Thanks for all the heads up about red tide. 
Yes I have already gotten the license and I do check the map and restrictions before going. I was just more curious on what spots have the best success?",VancouverIsland,"Best place on the island for clam digging (razor clam, geoducks, scallops) ?",0.56,https://www.reddit.com/r/VancouverIsland/comments/olvwt9/best_place_on_the_island_for_clam_digging_razor/
VanIsle8688,,1621978740,,False,nl0qn8,False,True,t3_nl0qn8,4,False,/r/VancouverIsland/comments/nl0qn8/peace_arch_park_from_vancouver_island/,0,"Have any islanders visited Peace Arch Park in White Rock/Blaine since the travel restrictions came into effect? Has having an island address on your ID caused any trouble when being checked by RCMP? I had plans to see an American friend in the park in June, but now that the inter-zone travel restrictions have been extended I'm worried about being turned away at the park, but I haven't been able to find any posts from people living outside of the lower mainland",VancouverIsland,Peace Arch Park from Vancouver Island,0.5,https://www.reddit.com/r/VancouverIsland/comments/nl0qn8/peace_arch_park_from_vancouver_island/
Bankruptcytothehedge,,1621976140,,False,nkzs61,False,True,t3_nkzs61,8,False,/r/VancouverIsland/comments/nkzs61/target_shooting_nanaimo_area/,1,Does anyone know any good crownland shooting spots around Nanaimo or day use gun range? Gun clubs aren't an option because I won't be staying long just going over to stay with a friend for a week once restrictions are loosened. Thank you very much!,VancouverIsland,Target Shooting Nanaimo Area,0.57,https://www.reddit.com/r/VancouverIsland/comments/nkzs61/target_shooting_nanaimo_area/
AMadcapLass,,1619461819,,False,mz4fu1,False,False,t3_mz4fu1,29,False,/r/VancouverIsland/comments/mz4fu1/cancellations_abound_on_vancouver_island_as/,43,,VancouverIsland,Cancellations abound on Vancouver Island as travel restrictions take effect.,0.96,https://www.cheknews.ca/cancellations-abound-as-new-travel-restrictions-take-effect-773366/
vanisle_kahuna,,1619359806,,False,my91q4,False,True,t3_my91q4,8,False,/r/VancouverIsland/comments/my91q4/ferry_checks/,0,Has anyone tried to travel from Vancouver to Victoria since they put the new restrictions in place? Are there authorities fining people on the ferry or asking questions? Any insight into this is greatly appreciated. [New BC travel restrictions](https://dailyhive.com/vancouver/bc-travel-restrictions),VancouverIsland,Ferry Checks,0.3,https://www.reddit.com/r/VancouverIsland/comments/my91q4/ferry_checks/
AMadcapLass,,1617549017,,False,mjy0pk,False,False,t3_mjy0pk,4,False,/r/VancouverIsland/comments/mjy0pk/website_launches_to_help_southern_vancouver/,61,,VancouverIsland,"Website launches to help Southern Vancouver Island residents find patios, support local restaurants amid restrictions.",0.95,https://www.cheknews.ca/website-launches-to-help-victoria-residents-find-open-restaurant-patios-amid-lockdown-758896/
TheRealKeshoZeto,,1614805096,,False,lx464p,False,False,t3_lx464p,10,False,/r/VancouverIsland/comments/lx464p/poster_popping_up_on_vancouver_island_falsely/,45,,VancouverIsland,Poster popping up on Vancouver Island falsely claims COVID restrictions are over,0.94,/r/britishcolumbia/comments/lx45c0/poster_popping_up_on_vancouver_island_falsely/
rahul_vancouver,,1614548433,,False,lura4z,False,False,t3_lura4z,4,False,/r/VancouverIsland/comments/lura4z/thinking_to_go_camping_on_vancouver_island_this/,3,,VancouverIsland,Thinking to go camping on Vancouver Island this summer if everything's better and we don't have the COVID restrictions like now. Can someone guide me on which of these campgrounds are a better bet?,0.67,https://icycanada.com/7-best-campgrounds-vancouver-island/
branden-branden,,1614499601,,1614537101.0,luakze,False,True,t3_luakze,9,False,/r/VancouverIsland/comments/luakze/looking_for_suggestions_for_cabin_rentals_more/,0,"Would love a hot tub as well... But I don't want to be to picky.

Inb4 Covid restrictions and such. I'm thinking about the future end of the year or so.",VancouverIsland,Looking for suggestions for cabin rentals. More Mid to North Island or on a smaller Island like Quadra or Hornby.,0.45,https://www.reddit.com/r/VancouverIsland/comments/luakze/looking_for_suggestions_for_cabin_rentals_more/
breezyfasheeezy,,1606976446,,False,k5rx8z,False,True,t3_k5rx8z,5,False,/r/VancouverIsland/comments/k5rx8z/food_delivery_options_near_victoria/,9,"ISO recommendations-

I am living in the US and looking to buy a gift for a friend and her family living in Victoria, BC. I was thinking something along the lines of a food delivery service gift card or CSA subscription, but have no clue what is readily available (and worthwhile) on the island. Is door dash pretty extensive? The family has some dietary restrictions but if possible, would love to support a local biz. Google wasn’t very helpful. Thanks for any ideas.",VancouverIsland,Food delivery options near Victoria,0.92,https://www.reddit.com/r/VancouverIsland/comments/k5rx8z/food_delivery_options_near_victoria/
VanIslandExplorer,,1603217137,,False,jev05l,False,False,t3_jev05l,2,False,/r/VancouverIsland/comments/jev05l/independent_candidate_brings_frustration_with/,0,,VancouverIsland,"Independent candidate brings frustration with government corruption, COVID restrictions to Parksville-Qualicum race - Oceanside News",0.36,https://oceansidenews.ca/2020/10/16/independent-candidate-brings-frustration-with-government-corruption-covid-restrictions-to-parksville-qualicum-race/
isle_say,,1592075484,,False,h8dmsn,False,False,t3_h8dmsn,18,False,/r/VancouverIsland/comments/h8dmsn/this_week_bc_ferries_decided_to_tighten/,50,,VancouverIsland,This week BC ferries decided to tighten restrictions on the number of passengers allowed on the ferry even though all drivers and vehicle passengers must remain in their vehicles.,0.91,https://i.redd.it/uimfku6u7q451.jpg
garbbagebear,,1544980035,,False,a6qp0n,False,True,t3_a6qp0n,51,False,/r/VancouverIsland/comments/a6qp0n/need_recommendations_for_vancouver_island_food/,9,"I recently finished ""The Master Cleanse"" which consisted of 18 days of restricted eating. I developed a deep appreciation for food by the end of it and have now embarked on a food tour based on Vancouver Island that will showcase publicly accessible food locations that are locally owned. 

I live in Parksville and have hit a few locations thus far. I do not have any experience in blogging or vlogging, but I find it fun to promote entrepreneurs in this industry. I'm very willing to travel all over the main island and smaller, remote islands. Anywhere that will accept a wondering food forager really, so I am looking for your recommendations.

Please recommend your favourites, your most abstract, the most remote and unique locations, culturally diverse eateries and I will do my best to honour them. I am not looking for corporate chains, unless they are Vancouver Island based, such as Tacofino.

Entries so far:

Parksville - Bread & Honey

Cumberland - Riders Pizza

Parksville - Realm Food Co.

Tofino - Wolf & Fog

Tofino - Tacofino

Tofino - Wickanninish 

Ucluelet - Blue Room

Parksville - Sams Sush

Parksville - Bangkok Thai

Nanaimo - Smokin George's

Parksville - White Elephant

Parksville - Rawthentic

&#x200B;

I run a woodworking business in Parksville, so I can only travel so often which reflects the destinations so far. I am making a hit list and hope to gain some more references from you guys!

&#x200B;

Thank you for any recommendations! I'll start a vlog or something one day I'm sure as it develops. Cheers!

&#x200B;

&#x200B;

&#x200B;",VancouverIsland,Need recommendations for Vancouver Island Food Tour.,0.81,https://www.reddit.com/r/VancouverIsland/comments/a6qp0n/need_recommendations_for_vancouver_island_food/
andthenthecactussaid,,1544846426,,1544847318.0,a6c3fk,False,True,t3_a6c3fk,16,False,/r/VancouverIsland/comments/a6c3fk/9_people_with_different_dietary_needs_on_their/,14,"Heck I just had to share this with someone so it's you guys tonight.

Friends are coming to Tofino for someone's birthday.  Their first two ferries to the Island were cancelled because of the storm.  So they're 5 hours late.  Cancelled dinner reservations.  Wondered if they were going to make it at all.

I'm already here so I say fuck it, I'm checking in to the airBnB, and impromptu making dinner for us all.

Realize that all 9 people have different dietary restrictions.  Half are vegetarian. They're the easy ones.  Three people are both GF and dairy free.  One doesn't eat dairy, gluten, processed anything, nightshade plants, or mushrooms.  Another one doesn't eat pork or farmed salmon (that's fine, I would never make farmed salmon).  One is avoiding soy (which is in everything).  Two don't eat corn.  One is avoiding all fruits with pits.  One is vegan ""and avoiding legumes right now"".  They're all like ""don't worry, we can make our own food when we get there.""  Haha yeah right.  I got this.

I'm under a little bit of influence already and got the music and the full kitchen going.  Figuring out this crazy electric smartoven and 6 different courses.  Hahaha I love all these fuckers so much.  They're gonna eat so good.",VancouverIsland,"9 people with different dietary needs on their way over for a birthday weekend, dinner reservations cancelled, I'm making dinner",1.0,https://www.reddit.com/r/VancouverIsland/comments/a6c3fk/9_people_with_different_dietary_needs_on_their/
AMadcapLass,,1686195501,,False,143y6lo,False,False,t3_143y6lo,0,False,/r/VancouverIsland/comments/143y6lo/campfire_ban_in_effect_for_vancouver_island/,13,,VancouverIsland,Campfire ban in effect for Vancouver Island starting June 8.,0.85,https://www.cheknews.ca/campfire-ban-in-effect-for-vancouver-island-starting-june-8-1155303/
truecanoebc,,1675745722,,False,10vt36z,False,False,t3_10vt36z,4,False,/r/VancouverIsland/comments/10vt36z/several_methods_of_making_a_campfire_on_the_beach/,6,,VancouverIsland,Several methods of making a campfire on the beach,0.69,https://www.youtube.com/watch?v=uHHm4J46i_U
AMadcapLass,,1631376253,,False,pma246,False,False,t3_pma246,0,False,/r/VancouverIsland/comments/pma246/campfire_bans_now_lifted_for_most_of_bc_with/,13,,VancouverIsland,"Campfire bans now lifted for most of B.C., with southern Vancouver Island the lone exception.",0.93,https://www.cbc.ca/news/canada/british-columbia/campfire-ban-lifted-bc-1.6171589
AMadcapLass,,1624991964,,False,oaefdr,False,False,t3_oaefdr,4,False,/r/VancouverIsland/comments/oaefdr/campfires_to_be_banned_across_bc_beginning_this/,52,,VancouverIsland,Campfires to be banned across B.C. beginning this week,0.98,https://www.cbc.ca/news/canada/british-columbia/camfire-ban-bc-1.6083875?__vfz=medium%3Dsharebar
VanIslandExplorer,,1597332001,,False,i91saw,False,False,t3_i91saw,2,False,/r/VancouverIsland/comments/i91saw/alpine_environments_threatened_by_increased/,14,,VancouverIsland,Alpine environments threatened by increased number of campfires,0.8,https://midislandindependent.ca/2020/08/13/alpine-environments-threatened-by-increased-number-of-campfires/
richEC,,1639527036,,False,rglaj1,False,False,t3_rglaj1,0,False,/r/VancouverIsland/comments/rglaj1/fatal_2018_crash_on_malahat_nets_driver_1year/,1,,VancouverIsland,"Fatal 2018 crash on Malahat nets driver 1-year driving prohibition, $1,000 fine",1.0,https://www.vancouverislandfreedaily.com/news/fatal-2018-crash-on-malahat-nets-driver-1-year-driving-prohibition-1000-fine/
_hay_tyler,,1605731572,,False,jwns17,False,False,t3_jwns17,3,False,/r/VancouverIsland/comments/jwns17/nonessential_travel_prohibited_in_bc_finish_line/,64,,VancouverIsland,"Non-essential travel prohibited in B.C. — finish line in sight, says Horgan",0.98,https://www.oceansidenews.ca/2020/11/18/non-essential-travel-prohibited-in-b-c-finish-line-in-sight-says-horgan/
Tommy_Tandem,,1557799435,,False,bocobs,False,True,t3_bocobs,11,False,/r/VancouverIsland/comments/bocobs/beach_camping/,3,"I’m having a friend from the east coast visit in June and I really want to pitch a tent on a beach in Tofino, or near Tofino.  Looking for a beach with not a huge hike in, maybe a few km... any suggestions?

Yeah, I get that it’s prohibited, so are a lot of other things. Looking for positive constructive replies only..",VancouverIsland,Beach camping?,0.71,https://www.reddit.com/r/VancouverIsland/comments/bocobs/beach_camping/
CohibaVancouver,,1435940612,,False,3c09cq,False,True,t3_3c09cq,2,False,/r/VancouverIsland/comments/3c09cq/looking_for_wifi_networking_consultant_midisland/,6,"Hi,
 
I live in Vancouver, but I'm involved in the management of a small rustic beachfront resort in the Comox Valley (20 cabins over a couple of acres).

We're trying to track down a consultant / vendor who can help us upgrade our WiFi network at the resort.

During the summer season the WiFi at the resort pretty much comes to its knees - While RF coverage is good, with 20 cottages each with multiple phones, tablets and laptops, the system that's currently in place cannot keep up in the summer. I suspect the ADSL pipe from Telus isn't big enough, and that likely the router(s) can't handle all the network address translation that's required with 100+ connected devices.

(Shaw does not service the area and Satellite is cost-prohibitive.)

We'd like to implement ""Captive Portal"" technology on our system that limits the total number of connections, similar to what you might see at a coffee shop or small hotel, where the first thing a user trying to connect sees is a login web pages.

By limiting the number of connections on our Telus link we should perform much better.

Since we have 20 cottages, it feels like limiting to 20 guest connections would be reasonable, e.g. -

- A mechanism where the resort managers give each cottage a code when they check in; each code is good for one device.

- A mechanism where the guests pick their cottage from a drop-down list and they get one connection.

...or whatever else a vendor might think would work to keep the number of connections down?

Our customers are 'regulars' who will be fine with one connection if it means that one connection works reasonably well.

For example: http://imgur.com/WQuWKT4

We're looking for a vendor / consultant who has some experience in this area who could come down to the resort, take a look at what's been installed to date and see how it might be upgraded, then quote on providing the system upgrades & ongoing support.

So far I've drawn a blank - Companies that won't or can't do it, or who don't return emails.

*** When I post this request most of the responses are technology solutions - That's great and I appreciate the suggestions, but what I need is a vendor recommendation.  If you don't know of a company or consultant who can specifically help then we're still at square one. ***

Thanks in advance for any suggestions.
",VancouverIsland,Looking for WiFi / Networking Consultant - Mid-Island,0.88,https://www.reddit.com/r/VancouverIsland/comments/3c09cq/looking_for_wifi_networking_consultant_midisland/
