author,author_flair_text,created_utc,distiguished,edited,id,is_original_content,is_self,name,num_comments,over_18,permalink,score,selftext,subreddit,title,upvote_ratio,url
Kiarah_21,,1626650977,,1626653687.0,on21qp,False,True,t3_on21qp,4,False,/r/VancouverIsland/comments/on21qp/meet_people/,3,"Hey everybody, my boyfriend and I just moved to Victoria and we’re trying to find some new friends! Add me on snap, kiarah_21 or insta ki.ar.ah.

I’m F 18, my partner is 20. He’s really into biking and cars, I enjoy anything outdoors really. Fishing, hunting, camping. 4/20 friendly is a bonus 🍃 as we both smoke. 
Also enjoy just hanging around the house and being lazy...Having some drinks and watching movies or around the fire or something 😁

Lets hang out!",VancouverIsland,Meet People,0.64,https://www.reddit.com/r/VancouverIsland/comments/on21qp/meet_people/
emslo,,1623986800,,False,o2fhei,False,False,t3_o2fhei,7,False,/r/VancouverIsland/comments/o2fhei/update_on_the_whiskey_creek_gas_station_fire/,42,,VancouverIsland,Update on the Whiskey Creek gas station fire,0.96,https://v.redd.it/x6lcbhad0y571
OddCanadian,,1618955799,,False,mv1het,False,False,t3_mv1het,3,False,/r/VancouverIsland/comments/mv1het/firefighters_helicopters_battling_humancaused/,31,,VancouverIsland,"Firefighters, helicopters battling human-caused forest fire on Vancouver Island",0.97,https://www.iheartradio.ca/cfax-1070/news/firefighters-helicopters-battling-human-caused-forest-fire-on-vancouver-island-1.15035742
Far-Tackle-230,,1611035588,,False,l0dj2f,False,False,t3_l0dj2f,5,False,/r/VancouverIsland/comments/l0dj2f/evening_fire_and_sunset_at_beautiful_french_beach/,52,,VancouverIsland,Evening fire and sunset at beautiful French Beach,0.9,https://www.reddit.com/gallery/l0dj2f
Primary_Sequins,,1609462174,,False,ko1tur,False,False,t3_ko1tur,3,False,/r/VancouverIsland/comments/ko1tur/at_least_eight_injured_others_displaced_as_fire/,33,,VancouverIsland,"At least eight injured, others displaced as fire guts Duncan apartment units.",0.95,https://www.cowichanvalleycitizen.com/news/apartment-fire-on-lewis-street/
Primary_Sequins,,1606267882,,False,k0ievw,False,False,t3_k0ievw,6,False,/r/VancouverIsland/comments/k0ievw/new_38million_fire_hall_considered_for_crofton/,30,,VancouverIsland,New $3.8-million fire hall considered for Crofton,0.96,https://www.chemainusvalleycourier.ca/home/new-3-8-million-fire-hall-considered-for-crofton/?fbclid=IwAR0I0e8Z6BlzgQjt0iL1egLoj3RwtszitSkvuB3y9ADsMtKEoigFapLaTsE
yaxyakalagalis,,1600888787,,False,iygy0o,False,False,t3_iygy0o,20,False,/r/VancouverIsland/comments/iygy0o/man_20_injured_after_being_set_on_fire_while/,46,,VancouverIsland,"Man, 20, injured after being set on fire while sleeping under Campbell River bridge",0.92,https://www.northislandgazette.com/news/man-20-injured-after-being-set-on-fire-while-sleeping-under-campbell-river-bridge
parentofagod,,1599940932,,False,irjmwe,False,True,t3_irjmwe,10,False,/r/VancouverIsland/comments/irjmwe/this_smoke_is_killing_me/,0,"Hello Islanders,

I wanted to get this off my chest as I am alone while my daughter naps and would like to share with others who are dealing with this post-apocalyptic world. I've been leaving my windows closed to prevent the smoke from getting in as the air quality is (surprise) extremely poor. Unfortunately, the stagnant, smokey air in my house just set off the fire alarms, even though I  have two large fans on the main floor and three upstairs all running. I don't know if this has happened to other people, or they are going to have it happen to them, but it seems like a lose-lose situation in my household. 

Thanks U.S.

Lots of Love,
Me",VancouverIsland,This Smoke is Killing Me,0.37,https://www.reddit.com/r/VancouverIsland/comments/irjmwe/this_smoke_is_killing_me/
KarlJohanson,,1599851638,,False,iqx6l6,False,False,t3_iqx6l6,0,False,/r/VancouverIsland/comments/iqx6l6/aftermath_of_the_carey_rd_fire_saanich_bc/,8,,VancouverIsland,"Aftermath of the Carey Rd Fire. Saanich, BC.",0.91,https://www.youtube.com/watch?v=2q_5un7EpLE
KarlJohanson,,1599763378,,False,iq9ftz,False,False,t3_iq9ftz,1,False,/r/VancouverIsland/comments/iq9ftz/another_view_of_the_fire_on_carey_rd_warren/,7,,VancouverIsland,"Another view of the Fire on Carey Rd & Warren Avenue, Saanich BC. Sept 10, 2020, 12:45 AM.",0.89,https://www.youtube.com/watch?v=Iwqt_3cxP3U
KarlJohanson,,1599741544,,False,iq2hy9,False,False,t3_iq2hy9,3,False,/r/VancouverIsland/comments/iq2hy9/fire_on_carey_warren_saanich_victoria_bc_sept_10/,25,,VancouverIsland,Fire on Carey & Warren Saanich Victoria BC Sept 10 12:45 AM,0.85,https://www.youtube.com/watch?v=PHNbFwM9Jwg
EcoTraverse,,1597719538,,1597720909.0,ibsz0b,False,True,t3_ibsz0b,16,False,/r/VancouverIsland/comments/ibsz0b/psa_if_you_enjoy_strathcona_provincial_park/,73,"&#x200B;

https://preview.redd.it/kahkxk31doh51.jpg?width=4032&format=pjpg&auto=webp&s=cb9554db4315cb84e55641190004efe7c738ae85

On Vancouver Island we are so lucky to have Strathcona Provincial Park up island to provide us with beautiful hikes, climbs and backcountry camping.

Understandably, with the closure of borders and other recreation options, Strathcona has seen an influx of visitors. Unfortunately, some visitors are neglecting to familiarize themselves with the “rules” of the park and backcountry adventures and if it continues and progresses, Strathcona as we know it will change for the worse in many ways.

The rules of the park keep both the park/environment and visitors safe. Here are some the major ones:

1. **LEAVE NO TRACE –** Carry out what you bring in! Garbage cans are not provided and anything you leave there will have to be carried out by other visitors. Pack an extra plastic bag to put your waste in if you are creating any. Make sure you walk on designated trails or boardwalks. Don’t place your tent on a wildflower meadow. Don’t pick flowers. Don’t disturb wildlife.
2. **ABSOLUTELY NO FIRES! –** Campfires are not permitted in Strathcona Park unless there is a BCParks installed steel ring. No permanently installed steel ring, no fire!!! It is posted on every sign at the trailhead. DO NOT have them! As the majority of the park exists within the subalpine terrain, you will ruin the sensitive ecosystems. Oxygen is considerably lower up there. The plants that exist in those ecosystems grow very little each year. If you damage them with smoke and heat, or pick them to use as fire starter, they may not grow back and as more and more people have fires we will slowly lose these wonderful areas. Additionally, if you start a fire out there it will be A LONG TIME before fire rescue comes. If you need to have a fire, go anywhere else on the island!
3. **CAMPING IS NOT PERMITTED IN DAY USE AREAS** – Please camp in designated areas. These are clearly marked on the trailhead signs and within the trails. DO NOT camp right next to lakes unless there is a designated area. People have been camping right at some of the beautiful Instagram lakes and it’s really disrespectful to people who are there to enjoy the scenery and don’t get to because they’re full of tents and campers and fire remains that shouldn’t be there.
4. **DO NOT USE SINKHOLES AS TOILETS! -** Some hikes have beautiful sink holes scattered throughout. While they may appear to be natures toilet, they are part of the water system. Water flows from these sink holes to underground streams and eventually makes its way back to the lakes that are used as drinking water. Dig a hole in an appropriate area that won’t be noticed by others or bring bags and pack it out.
5. **DO NOT UNDERESTIMATE THE DIFFICULTY OF THE TRAILS –** The majority of hikes in Strathcona are up into the mountains. They are considerably more difficult than anywhere else on the island. Prepare yourself. Read trail reports on All Trails or similar sites. Pack accordingly. Don’t overestimate your abilities. There are few things as humbling as a mountain – things can go wrong quick. People post beautiful pictures on Facebook/Instagram/YouTube and others are going out unprepared and require help from other hikers and search and rescue teams. You need to be able to hold your own out there and if you can’t, don’t go.
6. **DRONES ARE NOT PERMITTED -** Drones are classified as aircraft and fall under federal jurisdiction. Drones are regulated by Transport Canada.

We are so so lucky to have such a beautiful place so close and the freedom to explore it as we please. Please keep it that way!

If it’s not respected, we will lose that freedom and BC Parks will need to begin regulating it like many other parks across the world are with permit systems and limited visits.",VancouverIsland,"PSA – If you enjoy Strathcona Provincial Park, please respect it! If you visit or plan to visit, please read this post!",0.94,https://www.reddit.com/r/VancouverIsland/comments/ibsz0b/psa_if_you_enjoy_strathcona_provincial_park/
Primary_Sequins,,1595039626,,False,ht94bu,False,False,t3_ht94bu,6,False,/r/VancouverIsland/comments/ht94bu/vancouver_island_firefighter_dies_at_scene_of/,43,,VancouverIsland,Vancouver Island firefighter dies at scene of barn fire west of Port Alberni,1.0,https://www.albernivalleynews.com/news/vancouver-island-firefighter-dies-at-scene-of-barn-fire-west-of-port-alberni/?fbclid=IwAR2vEOcDuwH3h0N1cNNzJSByLKinUCGmZf6TWlfUxB5zHoRee6dQ0gOVOCk
EhHumanDisaster,,1593664111,,False,hjqbli,False,True,t3_hjqbli,3,False,/r/VancouverIsland/comments/hjqbli/beach_fires/,1,Does someone have a map outlining the municipalities that still allow beach fires on the island?  We used to have them all the time when we were little here but now it seems like anywhere south of Comox banned them,VancouverIsland,Beach Fires?,0.6,https://www.reddit.com/r/VancouverIsland/comments/hjqbli/beach_fires/
idspispopd,,1590785437,,False,gt11j3,False,False,t3_gt11j3,0,False,/r/VancouverIsland/comments/gt11j3/province_pays_408_million_for_hotel_to_house_fire/,26,,VancouverIsland,Province pays $4.08 million for hotel to house fire victims,1.0,https://www.campbellrivermirror.com/news/province-pays-4-08-million-for-hotel-to-house-fire-victims/
judgingyouquietly,,1579791820,,False,esua7w,False,False,t3_esua7w,0,False,/r/VancouverIsland/comments/esua7w/coulsonowned_water_bomber_crashes_while_fighting/,3,,VancouverIsland,Coulson-owned water bomber crashes while fighting Australian fires,1.0,https://www.9news.com.au/national/firefighting-plane-may-have-crashed-in-nsw-south/dae5f69d-c400-46ce-83a3-940558a02892
kspeed81,,1577079604,,False,eegavm,False,False,t3_eegavm,2,False,/r/VancouverIsland/comments/eegavm/sky_fire_from_my_deck_tonight/,39,,VancouverIsland,Sky fire from my deck tonight,0.97,https://i.redd.it/25anck5ulb641.jpg
Mike_MikeCAN,,1567481875,,False,cyzjmu,False,True,t3_cyzjmu,17,False,/r/VancouverIsland/comments/cyzjmu/haunted_mansion_urban_legend/,2,"I recall going to Vancouver island for a holiday and there was a site out of victoria, a little ways away from the butterfly gardens and out of victoria where there was a supposed haunted mansion that was abandoned before it burnt down due to a fire, can anybody clarify if that’s true?",VancouverIsland,Haunted mansion urban legend,0.63,https://www.reddit.com/r/VancouverIsland/comments/cyzjmu/haunted_mansion_urban_legend/
idspispopd,,1563172354,,False,cddysm,False,False,t3_cddysm,1,False,/r/VancouverIsland/comments/cddysm/changing_climate_vanishing_old_growth_bring/,15,,VancouverIsland,"Changing Climate, Vanishing Old Growth Bring Increase Fire Risk for Coastal Forests",0.89,https://thetyee.ca/News/2019/07/15/Increase-Fire-Risk-Coastal-Forests/
VIslanderthrowaway,,1558376704,,False,bqz9pt,False,True,t3_bqz9pt,3,False,/r/VancouverIsland/comments/bqz9pt/beach/,13,I've heard that Lantzville will soon ban beach fires for good? Now the furthest place down island for a beach fire is in Courtenay/Comox area? Seems like a shame.,VancouverIsland,Beach 🔥,0.88,https://www.reddit.com/r/VancouverIsland/comments/bqz9pt/beach/
earlbonor,,1553875447,,False,b6z3ek,False,True,t3_b6z3ek,9,False,/r/VancouverIsland/comments/b6z3ek/looking_for_a_good_butcher/,4,I'm from Victoria but I am willing to travel to up island because this it might be hard to find in the city. Some friends and I are celebrating a friends birthday coming up and we wish to make him an exciting present. This present is a beer bong that is crafted out of the head of a pig's head as the funnel part and pig's throat/trachea being the tube part. Does anyone know any good butchers who'd be sympathetic to creating such an object. We'd be willing to buy the rest of meat as well as we'll be having a fire in the woods for the celebration and need campfire food anyways. Please let me know! I understands it sounds strange but where we come from this is a thing!,VancouverIsland,Looking for a good butcher,0.67,https://www.reddit.com/r/VancouverIsland/comments/b6z3ek/looking_for_a_good_butcher/
hogujak,,1545723764,,False,a9d4pq,False,True,t3_a9d4pq,20,False,/r/VancouverIsland/comments/a9d4pq/best_beach_area_to_stay_in_vancouver_island/,8,"Hi Our family (4 adults, 1 baby, 1 dog) will visit Vancouver island from April 23 to 30 next year.

We have been to Victoria, Nanaimo couple times to check out some touristy places and would like to do something different this time.

Since we have a 1yr old baby, we try not to drive too much(1~2hr should be fine) and most likely stay in the beach house and go for a walk or make a camp fire(drink beer....)

Our priorities
1. nice beach for a walk
2. place to buy some seafood nearby. We will cook our own meal
3. If possible, a few attractions nearby

Could you please recommend any beach areas so I can rent a beach front house? We will take the ferry from Vancouver.

Thank you.

",VancouverIsland,Best beach area to stay in Vancouver island,0.79,https://www.reddit.com/r/VancouverIsland/comments/a9d4pq/best_beach_area_to_stay_in_vancouver_island/
cwojjy,,1542741955,,False,9yvdzc,False,True,t3_9yvdzc,2,False,/r/VancouverIsland/comments/9yvdzc/fire_lookouts/,8,"Hey  Reddit

my boyfriend and I are looking to do a road trip around Vancouver island and check out some fire lookouts. We were only able to find 2 but heard about 12 on the island. Anyone heard or been to any on the island.

Much thanks <3",VancouverIsland,fire lookouts,0.9,https://www.reddit.com/r/VancouverIsland/comments/9yvdzc/fire_lookouts/
Lyall18,,1540631248,,False,9rsxxq,False,True,t3_9rsxxq,4,False,/r/VancouverIsland/comments/9rsxxq/fire_on_mt_arrowsmith/,4,"Just wanted to check it out with the community. I have family who live in River's edge, and Mt. Arrowsmith is visible from the front lawn. Tonight looking up at the mountain looked like there was a forest fire on the mountain, or maybe 4 red lights set up? It was very strange. Does anyone have any information on this? thank you!",VancouverIsland,Fire on Mt. Arrowsmith?,1.0,https://www.reddit.com/r/VancouverIsland/comments/9rsxxq/fire_on_mt_arrowsmith/
heydanking,,1462942522,,False,4itd4b,False,False,t3_4itd4b,0,False,/r/VancouverIsland/comments/4itd4b/qualicum_beachs_beautiful_fire_ice_street/,4,,VancouverIsland,Qualicum Beach's Beautiful Fire & Ice Street Festival! (chili and ice sculptures),0.84,https://youtu.be/mmDF9WTYxFg
toomuchpork,,1438450726,,False,3ffbut,False,True,t3_3ffbut,4,False,/r/VancouverIsland/comments/3ffbut/midisland_commuter_needing_a_cheap_car/,4,"Don't know if this will work but it couldn't hurt.

I live in Duncan and am working in Courtenay. Last night on the way home my P.O.S. car blew up and caught fire on the drive home. I am working on Tuesday morning and have scoured the usual ad sites to little or no avail. If anyone has or knows of a beater for sale cheap please let me know. 
Thx, toomuchpork.  

TL;DR: I need a cheap car!",VancouverIsland,Mid-island commuter needing a cheap car,0.84,https://www.reddit.com/r/VancouverIsland/comments/3ffbut/midisland_commuter_needing_a_cheap_car/
kooliokevin,,1437495593,,False,3e346r,False,True,t3_3e346r,4,False,/r/VancouverIsland/comments/3e346r/planning_on_taking_a_trip_here_later_next_month/,2,"In short, I'm traveling to Nanaimo with my wife and 10mo child late August. I'm just curious what the current air quality status and forest fire status is around the island?",VancouverIsland,"Planning on taking a trip here later next month, what's the forest fire / air quality status?",1.0,https://www.reddit.com/r/VancouverIsland/comments/3e346r/planning_on_taking_a_trip_here_later_next_month/
knowlesro,,1430970273,,False,354zg4,False,True,t3_354zg4,7,False,/r/VancouverIsland/comments/354zg4/camping_near_tofino/,2,"planning a trip to Tofino with 4-5 vehicles and 4-5 tents around Canada day. looking for camp site big enough and that does not have quiet time at night as we are all in our mid twenties. as for amenities just want to be able to have a fire (if ban isn't on). suggestions ? is the only option to forest road past the dump, what's that like?",VancouverIsland,camping near tofino,0.75,https://www.reddit.com/r/VancouverIsland/comments/354zg4/camping_near_tofino/
jamesflan1,,1693157291,,1693169686.0,162wgf3,False,True,t3_162wgf3,9,False,/r/VancouverIsland/comments/162wgf3/holiday_destination_recommendations/,3,"Hello, looking for advice on a last destination on a roadtrip to the island.
We have previously been to Victoria.
We are starting on a sunday in Duncan
Monday tofino (edit- next week, thanks for all the comments warning about highway and wildfire)
And we have not booked accommodation for the third day
We have heard about port albini and Comox
Which would you pick for the last day or have you any other places to stay a night in. 
We are a group of 4  21 year olds from Ireland looking for a trip something in the middle of popular towns and nice nature spots.
We will be renting a car.
Thanks",VancouverIsland,Holiday destination recommendations,0.8,https://www.reddit.com/r/VancouverIsland/comments/162wgf3/holiday_destination_recommendations/
Desperate_Kale_2055,,1692649084,,False,15xirt7,False,True,t3_15xirt7,12,False,/r/VancouverIsland/comments/15xirt7/highway_4_project_length/,0,"Hi all. Traveling from Seattle to Tofino via a stop in Whistler during the 1st weekend in September and looking to see if anyone knows how long the Highway 4 project will be going on. I’ve looked on the Cameron Bluffs Recovery Project page and don’t see any sort of estimate. 

Unfortunately, have already had to cancel half of this trip to Jasper and Banff due to wildfires and am hoping not to have to do the same with Tofino.

Thanks all and best of luck with the situation up there.",VancouverIsland,Highway 4 Project Length,0.5,https://www.reddit.com/r/VancouverIsland/comments/15xirt7/highway_4_project_length/
itchyneck420,,1692631841,,False,15xay22,False,True,t3_15xay22,6,False,/r/VancouverIsland/comments/15xay22/i_have_a_spare_bedrooms_at_my_place_in_departure/,74,,VancouverIsland,I have a spare bedrooms at my place in Departure bay Nanaimo that are available for anyone escaping the wildfires. I live about 5 mins away from the ferry terminal and can pick you up from the ferry if transportation is an issue,0.97,https://www.reddit.com/r/VancouverIsland/comments/15xay22/i_have_a_spare_bedrooms_at_my_place_in_departure/
Difficult-Finger9020,,1692337767,,False,15ubqgp,False,True,t3_15ubqgp,1,False,/r/VancouverIsland/comments/15ubqgp/keep_this_on_hand/,9,Wildfires can be reported by calling 1 800 663-5555 toll-free or *5555 on a cellphone or by downloading the BC Wildfire Service app.,VancouverIsland,Keep this on hand:,0.91,https://www.reddit.com/r/VancouverIsland/comments/15ubqgp/keep_this_on_hand/
StatisticianOk8990,,1692294090,,False,15tu9tj,False,True,t3_15tu9tj,6,False,/r/VancouverIsland/comments/15tu9tj/wildfire_strathcona/,5,We drove north on Westmin Rd (Buttle Lake) yesterday afternoon and saw smoke in one valley. I don‘t think it had been there when we drove down south in the morning. Anyone knows whether it‘s under control? Had to pass Highway 4 in the evening and was devastated by the condition of the burnt hillside.,VancouverIsland,Wildfire Strathcona,0.86,https://www.reddit.com/r/VancouverIsland/comments/15tu9tj/wildfire_strathcona/
Stuckbutfuckit,,1690930329,,False,15frhuv,False,True,t3_15frhuv,24,False,/r/VancouverIsland/comments/15frhuv/alternatives_to_cathedral_grove/,4,"Hi! My wife and I planned a road trip around exploring the island and taking our son to visit some of the most beautiful places in Canada - including Cathedral Grove.

Unfortunately the wildfires currently devastating parts of the island have resulted in road closures that, along with making life difficult for those living on the island, mean that we won’t be able to make the drive to Cathedral Grove.
However, leaving the island without taking in some of the surreal natural beauty would seem like a wasted opportunity, so I’m hoping that some of you may have some alternate suggestions that would be suitable for us to visit with our toddler?

Thank you so much in advance!",VancouverIsland,Alternatives to Cathedral Grove?,0.7,https://www.reddit.com/r/VancouverIsland/comments/15frhuv/alternatives_to_cathedral_grove/
TruckBC,,1686584828,moderator,False,147q7k2,False,True,t3_147q7k2,26,False,/r/VancouverIsland/comments/147q7k2/rvancouverisland_blackout_has_been_downgraded_to/,126,"After some requests and discussion with outside moderators I have decided that the prudent thing to do it for this community to show it's support with a greyout due to the current situation due to the wildfire related highway closure to allow sharing of information.

- Pinned Highway Closure Mega Thread will be open for discussion of only matters related to the wildfire and highway closure. https://www.reddit.com/r/VancouverIsland/comments/146h1sb/highway_4_closuredetour_mega_thread
- All new posts submitted at this time will be held for moderator approval.
- Only posts critical to any new local ""emergencies"" will be approved until June 14th.
- I have locked recent posts to the Subreddit, they will remain locked until June 14th.

This post will be open for comments for a while. 

>This subreddit has gone dark for two days starting on June 12. We share the frustrations of many other redditors regarding the changes. We have decided to join thousands of other subreddits in taking action to demonstrate our concerns are suspending normal operations to draw attention to the issue.

>We hope to return to normal operations in June 14th.

>For more information, see this thread: https://www.reddit.com/r/explainlikeimfive/comments/147b2qz/eli5_why_are_so_many_subreddits_going_dark",VancouverIsland,r/VancouverIsland Blackout has been downgraded to a greyout due to Highway 4 Closure and Detour.,0.9,https://www.reddit.com/r/VancouverIsland/comments/147q7k2/rvancouverisland_blackout_has_been_downgraded_to/
OptimalPool,,1686562048,,1686565889.0,147jpe7,False,True,t3_147jpe7,2,False,/r/VancouverIsland/comments/147jpe7/tofino_in_midjuly_should_i_be_worried/,1,"Hey folks! We're travelling to Vancouver Island in Mid-July from Ireland and the plan is to do a bit of a road-trip around the island starting in Tofino. However, after hearing about the wildfires and highway 4 currently being closed I'm a bit worried now.

The plan was to get the ferry over to Nanaimo and head straight to Tofino first. Should I rethink going to Tofino given the current situation? Is it likely that things will be under control by then? Its probably difficult to say but for those with past experiences of wildfires on the island, is this unprecedented territory?",VancouverIsland,Tofino in mid-July. Should I be worried?,0.52,https://www.reddit.com/r/VancouverIsland/comments/147jpe7/tofino_in_midjuly_should_i_be_worried/
Cariboodude,,1686524202,,False,14784an,False,False,t3_14784an,4,False,/r/VancouverIsland/comments/14784an/cameron_bluffs_wildfire_actually_254_hectares_as/,52,,VancouverIsland,Cameron Bluffs wildfire actually 254 hectares as detour convoys begin,0.96,https://www.cheknews.ca/cameron-bluffs-wildfire-actually-254-hectares-as-detour-convoys-begin-1155895/
Collapse2038,,1686430972,,False,146b0yw,False,True,t3_146b0yw,9,False,/r/VancouverIsland/comments/146b0yw/detour/,40,"The Highway 4 detour reopened as planned the evening of Friday, June 9, 2023, following the successful extraction of a vehicle from Francis Lake.

The priority for the detour route is to ensure the movement of essential goods, such as fuel and food. To support this, beginning Sunday, June 11, four piloted convoys specifically for commercial vehicles will be guided along the detour route, to and from Port Alberni. These scheduled convoys will occur daily until further notice.

The piloted departure times are as follows:

* daily at 5 a.m. leaving Lake Cowichan

* daily at 10 a.m. leaving Port Alberni

* daily at 3 p.m. leaving Lake Cowichan

* daily at 8 p.m. leaving Port Alberni

Commercial vehicles will also be permitted to travel outside of these windows, however, there will be no pilot vehicles at those times.

Other drivers will be placed behind the convoys because the priority is the movement of essential supplies, such as fuel and food.

Highway 4 remains closed at Cameron Lake Bluff due to a wildfire in the area. The next update on reopening will be provided after the weekend.

Checkpoints are in place along the detour route to provide information for travellers.",VancouverIsland,Detour 📰,0.91,https://www.reddit.com/r/VancouverIsland/comments/146b0yw/detour/
