author,author_flair_text,created_utc,distiguished,edited,id,is_original_content,is_self,name,num_comments,over_18,permalink,score,selftext,subreddit,title,upvote_ratio,url
giantL,,1686343818,,False,145gf4w,False,True,t3_145gf4w,52,False,/r/VancouverIsland/comments/145gf4w/visiting_tofino_pacific_rim_national_park_in_2/,10,"With all the wildfires going on right now, is it still a good idea to be visiting Tofino & Pacific Rim National Park on the weekend of June 24 - 25? Should we consider alternatives like staying in Victoria and checking out Port Renfrew and Sooke instead?",VancouverIsland,Visiting Tofino & Pacific Rim National Park in 2 weeks,0.73,https://www.reddit.com/r/VancouverIsland/comments/145gf4w/visiting_tofino_pacific_rim_national_park_in_2/
FableFolklore,,1686202198,,False,1440d8d,False,True,t3_1440d8d,4,False,/r/VancouverIsland/comments/1440d8d/rathtrevor_park/,2,I’m planning to camp at Rathtrevor Campground this weekend. Has the air quality been impacted there due to the port alberni wildfire? Wondering if I should still go. Thanks!,VancouverIsland,Rathtrevor Park,0.75,https://www.reddit.com/r/VancouverIsland/comments/1440d8d/rathtrevor_park/
Solarisphere,,1686183919,,False,143tydt,False,True,t3_143tydt,17,False,/r/VancouverIsland/comments/143tydt/port_albernilake_cowichan_map_route_info/,54,"As most of you are aware by now, the main highway connecting Port Alberni with the rest of the island is closed right now due to wildfires. However, there is an alternate route that follows gravel logging roads to Lake Cowichan.

Here is a [PDF map](https://drive.google.com/file/d/1MPNLX_8nTuoG8MNpWL9xyGQLWhLSJY10/view?usp=sharing) for anyone that would like to take the route and here is a [GPX file](https://drive.google.com/file/d/1uDWnZB_Ix7bK7NNk0pfOoaRliRfHnQbY/view?usp=sharing) for anyone with a GPS app on their phone. 

Some additional notes and recommendations:

* There is little or no cell service on most of the route.
* The route is unpaved and can be quite rough with deep potholes, but any 2WD car can make it through. You do not need 4WD as long as you stay on the main road.
* Make sure your spare tire is in good shape and you have a full tank of gas before you leave Port Alberni. There are no services until Lake Cowichan.
* Tell someone where you're going.
* Google Maps is generally not very good for backroads. It's missing a lot of the side roads and navigation doesn't work that well when you don't have cell service.
* [Maps.me](https://Maps.me) is a good free mapping app that shows most of the island's backroads and will let you download them for offline use. Any other mapping app that uses OpenStreetMap data will work too. I prefer Gaia GPS but you need a paid subscription to use it offline.",VancouverIsland,Port Alberni-Lake Cowichan Map & Route Info,0.95,https://www.reddit.com/r/VancouverIsland/comments/143tydt/port_albernilake_cowichan_map_route_info/
Collapse2038,,1686168546,,False,143nhs7,False,True,t3_143nhs7,38,False,/r/VancouverIsland/comments/143nhs7/highway_4_detour/,29,"Highway 4 remains closed at Cameron Lake Bluff due to wildfire affecting the area.

A detour is in place and drivers are strongly encouraged to avoid travel in the area unless essential.

The detour will route traffic from Port Alberni through to Lake Cowichan via Bamfield using forest-service and privately owned industrial roads. The gravel detour route has narrow sections, sharp curves, single-lane bridges and challenging terrain. There is no cell service, gas stations or washroom facilities on the detour route.

Regular passenger vehicles, such as cars, vans and commercial vehicles weighing less than 14,500 kilograms, can travel through the detour corridor. No over-height or over-weight vehicles will be permitted.

The detour route extends travel by four hours and includes difficult driving conditions. It is strongly encouraged to wait to travel if possible.

For drivers who must travel for essential purposes, the Province urges preparation and patience. Drivers should fuel up, bring extra supplies, food and water to be prepared for the high temperatures at this time of year, and note that conditions can change quickly. Drivers are encouraged to plan trips during daylight hours and to drive with caution.

Detour signage and traffic-control personnel will direct travellers through the detour at key decision points. Government staff and maintenance contractors will regularly patrol the detour to assist motorists if required.

Information checkpoints for travellers will be set up at Youbou Road near Lake Cowichan and at Highway 4 at Aspeden Road near Port Alberni.

A map of the detour route will be available through an Emergency Travel Information button on the DriveBC homepage to help travellers make an informed decision about using the detour route. Drivers are reminded to use caution and respect the direction of traffic-control personnel in the area.

For up-to-date information about driving conditions, visit: https://www.DriveBC.ca",VancouverIsland,Highway 4 detour,0.98,https://www.reddit.com/r/VancouverIsland/comments/143nhs7/highway_4_detour/
Collapse2038,,1686098913,,False,142yn19,False,True,t3_142yn19,56,False,/r/VancouverIsland/comments/142yn19/highway_4_closed_due_to_cameron_lake_bluff/,47,"Drivers are advised Highway 4 is closed at Cameron Lake Bluff, near Koen Road, because of wildfire in the area. Travellers are asked to avoid travel in this area.

Drivers should expect lengthy delays as no detour is currently available. Detour options are being assessed. Emergency signage and traffic-control personnel will alert travellers to the closure.

Information checkpoints for travellers are being set up at Lake Cowichan, in Coombs near the Port Alberni Visitors Centre and at Chatsworth Road to alert people to the closure.

Drivers are reminded to obey all signage and traffic-control personnel as crews respond to the changing situation.",VancouverIsland,Highway 4 closed due to Cameron Lake Bluff wildfire,0.97,https://www.reddit.com/r/VancouverIsland/comments/142yn19/highway_4_closed_due_to_cameron_lake_bluff/
FreeTibet2,,1684376509,,False,13klqc1,False,False,t3_13klqc1,0,False,/r/VancouverIsland/comments/13klqc1/wildfire_smoke_to_blanket_vancouver_island/,10,,VancouverIsland,Wildfire Smoke To Blanket Vancouver Island Starting Wednesday Afternoon,1.0,/r/VictoriaBC/comments/13kljqn/wildfire_smoke_to_blanket_vancouver_island/
thefinalhill,,1683549574,,False,13bnw2f,False,True,t3_13bnw2f,106,False,/r/VancouverIsland/comments/13bnw2f/what_do_we_do_if_we_need_to_evacuate/,57,"With wildfires getting more prevelant each year and one already in alberta I cant help but worry.  But i realized I don't know what to do in case of a wildfire evacuation on the island, how do we handle that?  Can we handle that?",VancouverIsland,What do we do if we need to evacuate?,0.8,https://www.reddit.com/r/VancouverIsland/comments/13bnw2f/what_do_we_do_if_we_need_to_evacuate/
all4dopamine,,1680748095,,1680748929.0,12d6bgz,False,True,t3_12d6bgz,28,False,/r/VancouverIsland/comments/12d6bgz/finding_a_place_to_live/,0,"My family and I are thinking about moving to VI from America. You know, so our kids don't get shot at school, as well as a few other American things we'd like to avoid. 

I've seen some posts about how hard it is to find a place to live, and I'm curious if that's true all over the island or mostly in the cities.

edit: if it's okay to make this a two-part post, how bad does the smoke from the wildfires get up there?",VancouverIsland,Finding a place to live,0.38,https://www.reddit.com/r/VancouverIsland/comments/12d6bgz/finding_a_place_to_live/
myrcenol,,1675627816,,False,10um3ak,False,True,t3_10um3ak,10,False,/r/VancouverIsland/comments/10um3ak/has_anyone_done_the_stillwater_consulting_program/,9,"Looking to do the Stillwater Consulting program in Wildfire/ Natural Resources Training. has anyone done it, had experience, think it's a good idea? Any information appreciated!",VancouverIsland,Has anyone done the Stillwater Consulting program?,0.92,https://www.reddit.com/r/VancouverIsland/comments/10um3ak/has_anyone_done_the_stillwater_consulting_program/
Primary_Sequins,,1665292985,,False,xzdeu4,False,False,t3_xzdeu4,0,False,/r/VancouverIsland/comments/xzdeu4/3_helicopters_ground_crews_fighting_wildfire/,30,,VancouverIsland,"3 helicopters, ground crews fighting wildfire south of Sahtlam in Cowichan.",0.98,https://www.comoxvalleyrecord.com/news/3-helicopters-ground-crews-fighting-wildfire-south-of-sahtlam-in-cowichan/
avikingr,,1662840589,,False,xayr8w,False,False,t3_xayr8w,5,False,/r/VancouverIsland/comments/xayr8w/the_smoke_from_the_wildfire_in_washington_is/,73,,VancouverIsland,The smoke from the wildfire in Washington is heading straight towards south to mid Island.,0.98,https://v.redd.it/y13q2t5r53n91
VanIslandExplorer,,1601922114,,False,j5os7q,False,False,t3_j5os7q,0,False,/r/VancouverIsland/comments/j5os7q/wildfire_smoke_just_the_latest_threat_to/,16,,VancouverIsland,Wildfire smoke just the latest threat to Vancouver Island birds - Oceanside News,0.92,https://oceansidenews.ca/2020/10/05/wildfire-smoke-just-the-latest-threat-to-vancouver-island-birds/
Snoo_6314,,1600462810,,False,iveh5r,False,False,t3_iveh5r,3,False,/r/VancouverIsland/comments/iveh5r/a_timelapse_of_the_wildfires_smoke_blanketing/,0,,VancouverIsland,A timelapse of the wildfires smoke blanketing Vancouver Island,0.4,https://youtu.be/q3_kzbG8iKM
bohogirl1,,1600141295,,False,it0zw4,False,False,t3_it0zw4,1,False,/r/VancouverIsland/comments/it0zw4/canada_post_suspending_mail_delivery_throughout/,44,,VancouverIsland,Canada Post suspending mail delivery throughout Vancouver Island due to wildfire smoke,0.96,https://www.cheknews.ca/canada-post-suspending-mail-delivery-throughout-vancouver-island-due-to-wildfire-smoke-700901/
et3089,,1580007702,,False,eu149z,False,True,t3_eu149z,0,False,/r/VancouverIsland/comments/eu149z/doing_a_survey_about_wildfire_smoke_wanted_to_see/,8,"hi all! hope this post is allowed! if not, feel free to delete.

i'm an environmental health student in vancouver and am conducting a research project about wildfire smoke inhalation. i wanted to expand my survey and include the opinions of people who live on the island!

the survey takes only 5 minutes to complete and all responses are anonymous. it'd be greatly appreciated!

[https://www.surveymonkey.ca/r/breathoffresh](https://www.surveymonkey.ca/r/breathoffresh)",VancouverIsland,"doing a survey about wildfire smoke, wanted to see what residents of vancouver island thought!!",0.9,https://www.reddit.com/r/VancouverIsland/comments/eu149z/doing_a_survey_about_wildfire_smoke_wanted_to_see/
idspispopd,,1578522882,,False,em05uj,False,False,t3_em05uj,2,False,/r/VancouverIsland/comments/em05uj/forestry_experts_warn_british_columbia_faces_high/,16,,VancouverIsland,Forestry Experts Warn British Columbia Faces High Risk of Massive Wildfires Due to Climate Change,0.94,https://pressprogress.ca/forestry-experts-warn-british-columbia-faces-high-risk-of-massive-wildfires-due-to-climate-change/
Beef_Lovington,,1693459028,,False,1661vo5,False,True,t3_1661vo5,21,False,/r/VancouverIsland/comments/1661vo5/abandoned_inlet_town_inquiry/,15,"Islanders, I am a Calgarian in need of assistance. Back when I was in grade 9 (2016) I took a sailing trip with school around Vancouver Island. I vividly remember going into a sort of inlet and anchoring, and in this inlet there was an abandoned mining town/post. I remember seeing a smoke stack and a bunch of concrete structures. However, we weren't allowed our phones or anything so I couldn't take photos. I also remember we weren't actually allowed to go explore the smoke stack area so I only remember seeing it poke up above the trees. I have been searching for this town's name forever now, and no luck. Closest I found was Leechtown, but that's located on a river further inland where this was located in a inlet right off the ocean. Please help as I have never been able to find it and want to someday visit it again!",VancouverIsland,Abandoned Inlet Town Inquiry,0.86,https://www.reddit.com/r/VancouverIsland/comments/1661vo5/abandoned_inlet_town_inquiry/
not_really_me_1975,,1692833365,,False,15zkm1o,False,True,t3_15zkm1o,3,False,/r/VancouverIsland/comments/15zkm1o/cow_bay_or_crofton_for_boat_launch_crabs/,1,"We’re going to take the boat out Sunday and we’re wondering which boat launch is likely to be the least busy? We’d also like to throw out a couple crab traps and are wondering if one side is better?

Thanks for any advice. Here’s hoping we don’t get smoked out!",VancouverIsland,Cow Bay or Crofton for boat launch / crabs?,0.6,https://www.reddit.com/r/VancouverIsland/comments/15zkm1o/cow_bay_or_crofton_for_boat_launch_crabs/
Lopsided-Cat586,,1691469206,,False,15l7kqd,False,True,t3_15l7kqd,56,False,/r/VancouverIsland/comments/15l7kqd/another_young_family_looking_to_relocate_to_the/,0,"I’ve browsed the ones already asked, but none seem to be looking for quite what we are looking for in terms of a place to live. 

We are from a small town in the interior (~4000 people) and love the quiet small town life. We really don’t enjoy traffic, crowds, noise etc. We currently live on an acreage and it suits us very well. Most of the traffic here is tractors or road cyclists. However my husband wants a change, and we are getting tired of the smoke all summer every summer and weeks of 35+ degrees. We have very portable jobs and own our home in a HCOL area, so are somewhat prepared for the insane housing market there.

’m only familiar with Victoria and surrounding areas, and they are stunning but way too busy for us. 

We are looking for:

- small town (or feels like it)
- not too much rain
- other young families 
- clean, not busy lake for swimming
- golf course in the general area 
- lower crime
- a chance of getting into daycare 
- hikes, biking etc that is hopefully not packed

Would be nice to have: 

- nice provincial camping within a few hours
- easier access to ferry for mainland 

Thanks so much!",VancouverIsland,"Another “young family looking to relocate to the island, where is best?” post.",0.19,https://www.reddit.com/r/VancouverIsland/comments/15l7kqd/another_young_family_looking_to_relocate_to_the/
eibbed58,,1679438324,,False,11xxfun,False,True,t3_11xxfun,5,False,/r/VancouverIsland/comments/11xxfun/is_anyone_seeing_this_in_qualicum_bay/,10,"About 2 hours ago we could see dark band of cloud/fog coming in from the Salish Sea.  It has a brownish hue to it.  It is low and now looks like smoke going past our windows.  We can see the particles in it.  Is it afternoon fog?  New to the island, never seen anything like this.",VancouverIsland,Is anyone seeing this in Qualicum Bay?,0.75,https://www.reddit.com/r/VancouverIsland/comments/11xxfun/is_anyone_seeing_this_in_qualicum_bay/
PalabraFlamenco,,1672435748,,False,zzc2tu,False,True,t3_zzc2tu,2,False,/r/VancouverIsland/comments/zzc2tu/dark_sounds_with_acclaimed_poet_and_philosopher/,16,"Dark Sounds is poets Jan Zwicky and Garth Martens alongside flamenco dancer Denise Yeo and flamenco guitarist Gareth Owen. Our focus is grief, death, and the climate crisis. Endings, disappearances, cultural cataclysm. Little deaths that pile up while, all around us, the smoke steeples the horizon. Somehow, the show is a heckuva good time.    


There are 7 tickets left for Feb 24 and for Feb 25. Get your tickets, or learn about the show, here:   


https://www.eventbrite.ca/e/dark-sounds-poetry-flamenco-ft-jan-zwicky-tickets-483923717867

https://preview.redd.it/fpinh1ngs39a1.png?width=1920&format=png&auto=webp&s=fcfb42d91055140e669670b90cfe42eb0d4059a0",VancouverIsland,Dark Sounds with acclaimed poet and philosopher Jan Zwicky,0.9,https://www.reddit.com/r/VancouverIsland/comments/zzc2tu/dark_sounds_with_acclaimed_poet_and_philosopher/
Zarkalarkdarkwingd,,1664172490,,False,xoaxyq,False,False,t3_xoaxyq,1,False,/r/VancouverIsland/comments/xoaxyq/sunset/,79,Galiano Island a lot of smoke in the air,VancouverIsland,Sunset,0.99,https://i.redd.it/z68nln1p95q91.jpg
RedSwingGlider,,1660849651,,False,wrrw34,False,True,t3_wrrw34,27,False,/r/VancouverIsland/comments/wrrw34/are_there_any_native_smoke_shops_on_the_island/,3,I prefer American cigarettes and the occasional menthol. I've heard on the mainland there are Native smoke shops that sell them. Anything similar on the island that doesn't require status? Thanks in advance.,VancouverIsland,Are there any Native smoke shops on the island that don't require status card?,0.59,https://www.reddit.com/r/VancouverIsland/comments/wrrw34/are_there_any_native_smoke_shops_on_the_island/
CorpseHash,,1653699566,,False,uzcb1d,False,True,t3_uzcb1d,24,False,/r/VancouverIsland/comments/uzcb1d/work/,4,Does anyone know where I can just exist and have a place to live? My hobbies include smoking weed and smoking weed. Are there any good communes that could set me up? I'd just kinda walk around and ask people what's up and keep going.,VancouverIsland,work,0.63,https://www.reddit.com/r/VancouverIsland/comments/uzcb1d/work/
Potato_dad_ca,,1647962157,,False,tk59x2,False,True,t3_tk59x2,48,False,/r/VancouverIsland/comments/tk59x2/any_cannabis_tourism/,15,"40 something stoner and will be doing some solo travelling to the island this spring.

Can anyone suggest some 420 friendly places to visit.

Are there any small cafes on the island where i can smoke like in Vancouver or Amsterdam?

I also enjoy music and trail walking.",VancouverIsland,Any cannabis tourism?,0.71,https://www.reddit.com/r/VancouverIsland/comments/tk59x2/any_cannabis_tourism/
ZapMePlease,,1644806051,,False,srzmw5,False,True,t3_srzmw5,37,False,/r/VancouverIsland/comments/srzmw5/the_protests_at_the_legislature_seem_to_be_waning/,85,"I currently live 2 blocks from the leg (soft g for non-Islanders).  While there were hundreds - maybe even a thousand - protesters a few weeks ago I'm seeing a dozen or so now.  And that was today - on a Sunday - when the numbers are usually higher.  The ones there now seem to be there all day and a lot of the evening.  It's more like a small group of friends who hang out and smoke, juggle and attention seek.
  
The trucks with their incessant honking have been headed off by a fairly large police presence that restrict their movements in the blocks surrounding the leg.  
  
The irony seems to be lost on these people that they are protesting minor disruptions to society by causing major disruptions to society.  SMFH   
  
Looks like it's winding down I hope",VancouverIsland,The protests at the legislature seem to be waning,0.84,https://www.reddit.com/r/VancouverIsland/comments/srzmw5/the_protests_at_the_legislature_seem_to_be_waning/
arielleh51,,1641435441,,False,rx35p8,False,True,t3_rx35p8,12,False,/r/VancouverIsland/comments/rx35p8/national_car_rental_company_wants_my_parents_or/,10,"My parents rented a vehicle to travel from the Mainland to Vancouver Island through a national rental company.  My mom took time-stamped pictures of the vehicle both at pick up (where minor scratches were documented on both sides of be vehicle) and at drop off of the vehicle (to prove that there was no damage).  

Drop-off of the vehicle occurred a day earlier and during off-hours. The keys were dropped off as advised by Enterprise. There were no problems and no damages to the car although there was no walk-around due to the fact that my parents dropped if off when the business was closed. 

3 days later, my parents received an additional approximately $250 dollars from the company.  My mom called and disputed the additional charge and was tossed back and forth between the pick-up and drop-off locations until, finally, the manager at the pick up site confirmed that the cause of the charge was a “preventative maintenance” charge from the drop off site due to cigarette smoke smell (which was actually present at pick up) and reversed the charge.  The drop off site was contacted by phone and said that was the only concern.

Now, 13 days later, my parents have received an email from their Damage Recovery division requesting my parents supply credit card and/or insurance information for damages. My mom phoned again and the claim is, apparently, for scratches documented by photos at the original pick up so not obtained during their rental.
The claim is now with the company’s dispute resolution division and we are not able to speak to the site making the claim to show them the photos and get them to drop the claim against us as they will not answer the phone.  

We *think* that the guys at the pick-up site did not document damages in writing from the previous renting party.   The drop-off site, now frustrated by having the “preventive maintenance charge” for smoking disputed, are trying to get something else to charge us with. 

This is a fraudulent claim by a national agency and my parents should not have to fork out cash (or a considerable deductible) to support this claim.

What other steps should my parents take to protect themselves?

Edited:  Spacing",VancouverIsland,National Car Rental Company Wants my Parents (or their insurance) to Pay for a New Paint Job.,0.92,https://www.reddit.com/r/VancouverIsland/comments/rx35p8/national_car_rental_company_wants_my_parents_or/
KarlJohanson,,1629172297,,False,p5w69n,False,False,t3_p5w69n,0,False,/r/VancouverIsland/comments/p5w69n/sadly_smoke_made_it_to_vancouver_island/,0,,VancouverIsland,Sadly smoke made it to Vancouver Island.,0.5,https://www.youtube.com/watch?v=gIZss8Gl0GM
heydanking,,1600501266,,False,ivo77v,False,False,t3_ivo77v,6,False,/r/VancouverIsland/comments/ivo77v/smoke_in_the_skies_of_parksville_but_still/,42,,VancouverIsland,"Smoke in the skies of Parksville, but still thankful in 2020 ... you?",0.87,https://v.redd.it/3erlsyfc62o51
kodai,,1534745828,,False,98r6zn,False,True,t3_98r6zn,11,False,/r/VancouverIsland/comments/98r6zn/hows_the_smoke/,2,"Hiya friends!!

My friend and I are planning a bike trip up Vancouver Island to Port Hardy. Just wanted to see how the smoke is affecting ya'll. We're starting 8/25 so I'm not sure how much things will change between now and then.

Thanks!",VancouverIsland,How's the smoke?,0.67,https://www.reddit.com/r/VancouverIsland/comments/98r6zn/hows_the_smoke/
Reks85,,1466102852,,False,4oey3v,False,True,t3_4oey3v,14,False,/r/VancouverIsland/comments/4oey3v/vancouver_island_straight_edgers/,10,"Hey everyone, I want to start off by saying that I think everyone should be doing whatever makes them happy, as long as it's not harming someone else. 

That being said, I was wondering if there was any kind of a straight edge scene on Vancouver Island? I'm pretty new here and it seems impossible to find people who don't smoke, do drugs or drink. Though I do drink occasionally, about once or twice a year, it's not at all something I want to be doing every weekend or while I'm doing anything else...  

Anyway, just wanted to check and see.",VancouverIsland,Vancouver Island Straight Edgers,0.86,https://www.reddit.com/r/VancouverIsland/comments/4oey3v/vancouver_island_straight_edgers/
gm_bigfoot,,1452469891,,False,40dzbb,False,True,t3_40dzbb,0,False,/r/VancouverIsland/comments/40dzbb/jordan_river_powerplant_anybody_know_any_info/,5,"Recently visited it and since the last time I had been there (2013 before moving off the island), I noticed that all the junk that filled the main section has been cleaned out. The small building leading to the plant has also been cleaned out and there were lots of empty packages of a type of firework that causes smoke. It also appears that the trail is has seen heavy activity. Does anybody know about anything going on there? I initially thought maybe a movie or something.",VancouverIsland,Jordan River Powerplant - Anybody know any info about this?,1.0,https://www.reddit.com/r/VancouverIsland/comments/40dzbb/jordan_river_powerplant_anybody_know_any_info/
SeagullSegall,,1404063356,,False,29elxl,False,False,t3_29elxl,6,False,/r/VancouverIsland/comments/29elxl/secondhand_pot_smoke_an_issueinwaiting_esquimalt/,5,,VancouverIsland,Second-hand pot smoke an issue-in-waiting: Esquimalt mayor,0.78,http://www.timescolonist.com/news/local/second-hand-pot-smoke-an-issue-in-waiting-esquimalt-mayor-1.1186192
Amerinuck,,1692460626,,False,15vjw7c,False,True,t3_15vjw7c,28,False,/r/VancouverIsland/comments/15vjw7c/driving_from_nanaimo_to_tofino_given_the_current/,2,"Hello all :) 

I will be visiting your beautiful island next week for the first time (coming from Hamilton, ON) and I'm wondering about alternative routes to Tofino (from Nanaimo), given the current conditions on Highway 4 and frequent road closures.  If we get lucky, and HWY 4 is open, we'll obviously take that, but, google maps shows two alternative routes to get there.  

&#x200B;

To the South thru Ladysmith and then west by Cowichan Lake eventually heading North to Port Alberni and reconnecting with HWY 4 (quite the detour it seems lol).  

The other option seems to be driving around Horne Lake and down into Alberni, reconnecting with HWY 4.  A much shorter option, but, it's showing 'restricted road usage' on maps for that route.  Is this road accessible for tourists driving through or is it off limits?   Is there a better option than [drivebc.ca](https://drivebc.ca) for updates on closures? I need to investigate that site further for more info, but, thought I might get some direct answers from locals on this subreddit.  


Essentially I'm looking for the shortest way to get there without being an ignorant tourist.  I want to respect the land and the laws. :) Looking forward to my visit, regardless of where the road shall take me, and, any help is appreciated.  Thank you! ",VancouverIsland,Driving from Nanaimo to Tofino given the current road closures (First time to the island),0.58,https://www.reddit.com/r/VancouverIsland/comments/15vjw7c/driving_from_nanaimo_to_tofino_given_the_current/
