author,author_flair_text,created_utc,distiguished,edited,id,is_original_content,is_self,name,num_comments,over_18,permalink,score,selftext,subreddit,title,upvote_ratio,url
McWeeeeeee,,1693773488,,False,1697m56,False,False,t3_1697m56,12,False,/r/VancouverIsland/comments/1697m56/wildfire/,10,"I don’t know much about wildfire management, but this is so close- and the ‘monitor’ status is making me so anxious. Are the communities of Campbell River, Black Creek and the Comox Valley not at risk? Watching the Kelowna fires was terrifying and demonstrated how quickly fires can grow.  Any insight into this would’ve greatly appreciated!",VancouverIsland,Wildfire,0.73,https://i.redd.it/6167n2p6q3mb1.jpg
Mid_Island_Daddy,,1693334120,,False,164qegp,False,False,t3_164qegp,3,False,/r/VancouverIsland/comments/164qegp/lightning_storm_sparks_new_fire_near_horne_lake/,14,,VancouverIsland,Lightning Storm sparks new fire near Horne Lake,0.85,https://wildfiresituation.nrs.gov.bc.ca/incidents?fireYear=2023&incidentNumber=V73021
hoisins,,1693287839,,1693352252.0,1649rme,False,True,t3_1649rme,44,False,/r/VancouverIsland/comments/1649rme/quick_sanity_check_on_a_4_night_tourist_itinerary/,9,"Hi folks, thanks for entertaining another tourism post. A family member and I are visiting Vancouver Island for the first time for four nights in September, and I would appreciate a quick sanity check on my rough plan:

My plan is to put our rental car on the ferry to Nanaimo early tuesday morning, ~~venture up perhaps only as far as Hornby Island or so~~ before heading down to Port Renfrew via BC-18 W and Pacific Marine Rd for two nights. After that we will take 14 eastwards to spend two more nights in Victoria or the Cadboro Bay area before heading back to the mainland from Swartz Bay on friday morning. I figure using both ferry routes gives us a natural way to drive through the southeastern part of the island and stop at places along the way.

Still filling in the details, and I am / will be flipping through all the super helpful prior tourist threads here. Being mindful of the unfortunate fire situation + road closures, I wanted a sanity check that this basic plan makes sense?

(Definitely avoiding trying to shoehorn in any Port Alberni or Tofino adventures -- as I understand it between tourist season, road closures, general distance, and so on, that would just be a really bad idea right now.)

**Edits:** Forgot to mention that ~~I had already bought flexible ferry tickets~~ I already have prepaid ferry reservations on bcferries.com, and I must have brain cramped on Hornby Island. For some reason I thought that was connected by bridges, not ferries. Scratching that from the itinerary per your suggestions.

Also, didn't expect to wake up this morning to so many responses; it's not always my experience on reddit, and I really appreciate it. Thank you for all the suggestions, and please keep 'em coming if you are so inclined.",VancouverIsland,Quick sanity check on a 4 night tourist itinerary?,0.66,https://www.reddit.com/r/VancouverIsland/comments/1649rme/quick_sanity_check_on_a_4_night_tourist_itinerary/
Caloran,,1692749548,,False,15yngjm,False,True,t3_15yngjm,6,False,/r/VancouverIsland/comments/15yngjm/is_now_a_good_time_to_visit/,1,"Have had my summer plans quite literally go up in flames. Would love to come visit the island for the first time but wondering if end of August - Early September would be a good time to do so?

Are visitors welcome with the travel bans and current fire situations?

If so where would be a good place to stay on the island where I could explore as much as possible in 5 or so days?",VancouverIsland,Is now a good time to visit?,0.67,https://www.reddit.com/r/VancouverIsland/comments/15yngjm/is_now_a_good_time_to_visit/
Mid_Island_Daddy,,1692540272,,False,15wcal1,False,False,t3_15wcal1,11,False,/r/VancouverIsland/comments/15wcal1/human_caused_fire_near_ucluelet_lost_shoe_creek/,25,,VancouverIsland,Human Caused Fire near Ucluelet! (Lost shoe creek),0.86,https://wildfiresituation.nrs.gov.bc.ca/incidents?fireYear=2023&incidentNumber=V72862
drewmullin,,1692503973,,False,15w0sqj,False,True,t3_15w0sqj,21,False,/r/VancouverIsland/comments/15w0sqj/stratchcona_prov_park_off_limits_right_now_if_so/,5,"Hey so we’re staying mostly on the north coast. Stratchona prov park looked beautiful but apparently fire and bad conditions? Is it still doable or just no?

And if not, can someone give me some other recs for places inland with mountains to switch it up from the north coast? Thank u!",VancouverIsland,Stratchcona prov park off limits right now? If so other recs?,0.78,https://www.reddit.com/r/VancouverIsland/comments/15w0sqj/stratchcona_prov_park_off_limits_right_now_if_so/
Wide-Rate-3507,,1692407394,,False,15v26lo,False,True,t3_15v26lo,3,False,/r/VancouverIsland/comments/15v26lo/firemen_to_the_rescue/,55,"My friend went through quite the ordeal the other day, and he gave me permission to share the story of how a quick response from the Saanich Fire Department saved a townhouse complex. Also, this is a PSA that you may want to avoid clutter in your garage during Vancouver Island's hot and dry weather, as even the slightest spark can set your flammable belongings ablaze. 

It was late when one of the neighbours began screaming outside in the courtyard, and a great wail of barking had begun as well. The smell of smoke was thick in the air by the time everyone got out to see what was going on, and it wasn't long before everyone realised the garage of one of the townhouses was on fire. No one knew what started the fire, and the SFD is still searching for the spark, but what the homeowner did know was that there was a great deal of flammable material in the garage that could quickly spread to the rest of the houses and bushes beyond. The homeowner called 911 the moment she had her phone, but the blaze was going up quick and the complex's residents weren't sure how long it would stay in the garage.

Three minutes.

Three minutes was all it took for a fleet of three engines to arrive. When each second counted, when a small fire could turn into a blaze that could burn down several homes in a matter of minutes, especially in the hot and dry weather of earlier this week, they arrived and moved quickly. Within a matter of minutes after their arrival, they had broken through the garage window, doused the flames, then lifted the door up to deal with what remained.

This is just a huge thank you to the Saanich Fire Department for their quick response, and their care for the homeowner, whose asthma and anxiety pair was taking its toll on her. We've heard countless stories about how firemen are heroes, and this is just one story to add to the pile. Also an announcement to avoid filling your dry and cluttered garage with wooden scraps and furniture",VancouverIsland,Firemen to the rescue,0.95,https://www.reddit.com/r/VancouverIsland/comments/15v26lo/firemen_to_the_rescue/
ThatsSoMetaDawg,,1692388035,,False,15uubz9,False,True,t3_15uubz9,103,False,/r/VancouverIsland/comments/15uubz9/why_dont_we_get_more_wildfires_on_the_island/,27,Serious question. It seems like Vancouver Island only ever has small cases of fires that fizzle out pretty quickly. Does it have to do with our environment? Do we have better resources to mitigate or are we just as vulnerable as the rest of the country? Genuinely curious.,VancouverIsland,Why don't we get more wildfires on the island?,0.7,https://www.reddit.com/r/VancouverIsland/comments/15uubz9/why_dont_we_get_more_wildfires_on_the_island/
Mid_Island_Daddy,,1692230503,,False,15t6mz5,False,False,t3_15t6mz5,8,False,/r/VancouverIsland/comments/15t6mz5/human_caused_wild_fire_near_port_alberni/,15,,VancouverIsland,Human Caused Wild Fire near Port Alberni,0.94,https://wildfiresituation.nrs.gov.bc.ca/incidents?fireYear=2023&incidentNumber=V72775
pseudonymmed,,1690903092,,False,15ffhzg,False,True,t3_15ffhzg,16,False,/r/VancouverIsland/comments/15ffhzg/avatar_grove_currently_closed_where_else_to_see/,3,"I have friends visiting Vic and would like to take them to see some old growth forest. Was planning to visit Avatar Grove but it's currently closed to the public, and Cathedral Grove is also closed due to the fire near there. Where else within a few hours drive of Vic could I take them to see impressive forest and big trees?",VancouverIsland,"Avatar Grove currently closed, where else to see old growth forest in South end of the island?",0.67,https://www.reddit.com/r/VancouverIsland/comments/15ffhzg/avatar_grove_currently_closed_where_else_to_see/
Effective_Rope_4466,,1690144060,,False,157pbq2,False,False,t3_157pbq2,1,False,/r/VancouverIsland/comments/157pbq2/fire_lookout_tower_cinematic_drone_footage_woss/,3,Some of the best views on the island!,VancouverIsland,Fire Lookout Tower | CINEMATIC DRONE FOOTAGE | Woss BC | 4K,0.72,https://youtu.be/77lqLm-ekVA
Feral_KaTT,,1689558119,,False,151o5p7,False,False,t3_151o5p7,4,False,/r/VancouverIsland/comments/151o5p7/fire_reported_on_alternate_route_as_cameron/,18,,VancouverIsland,Fire reported on Alternate Route as Cameron Lake/Highway 4 is closed because of High Winds.,0.92,https://i.redd.it/jqgy98gqjfcb1.jpg
OkayyEntertainer,,1686367277,,False,145p5dt,False,True,t3_145p5dt,7,False,/r/VancouverIsland/comments/145p5dt/whats_the_word_on_the_cameron_lake_fire/,3,Anyone hear anything new about that? Do they have it under control? Any plans to open the road? Is the detour to youbou going to stay open?,VancouverIsland,What’s the word on the Cameron lake fire?,0.67,https://www.reddit.com/r/VancouverIsland/comments/145p5dt/whats_the_word_on_the_cameron_lake_fire/
Recovery4Kate,,1686162946,,False,143l3gs,False,True,t3_143l3gs,42,False,/r/VancouverIsland/comments/143l3gs/in_ucluelet_live_in_nanaimo_from_sask_help/,85,"Okay, moved to Nanaimo a few months ago, decided to take a little road trip with my little dog two nights ago. I am now in Ucluelet. THE FIRES!?
I have no idea what to do, where to go, I have little money and it’s my dog and I. No family, no friends. Can someone please give me an idea of what I should do?",VancouverIsland,"In Ucluelet, live in Nanaimo, from Sask. Help?",0.94,https://www.reddit.com/r/VancouverIsland/comments/143l3gs/in_ucluelet_live_in_nanaimo_from_sask_help/
AmbivalentSamaritan,,1686151431,,1686168239.0,143g64g,False,True,t3_143g64g,69,False,/r/VancouverIsland/comments/143g64g/is_highway_4_open/,23,"I’m in Tofino, heading out for Comox. There are lots of news articles from yesterday about the highway being closed due to fires around Port Alberni, but no ‘All good, come on through’ type information.

ETA: Thanks to the people who expressed their concerns. I’m safe and not apoplectic. There are places to stay, and nothing on the schedule that can’t be canceled. You are all lovely thoughtful people.

EDIT #2. They have opened a 4 hour logging road bypass, but they advise against it. I’m staying put",VancouverIsland,Is highway 4 open?,0.83,https://www.reddit.com/r/VancouverIsland/comments/143g64g/is_highway_4_open/
Pickledginger94,,1686094695,,False,142x328,False,True,t3_142x328,10,False,/r/VancouverIsland/comments/142x328/port_alberni_fire/,7,"Just wondering how bad the current fire situation is. I’m heading out from Ontario on Friday and just want to know why I should be expecting!

Any insight is appreciated",VancouverIsland,Port Alberni fire,0.77,https://www.reddit.com/r/VancouverIsland/comments/142x328/port_alberni_fire/
HatchBuck202,,1686058897,,False,142gial,False,False,t3_142gial,34,False,/r/VancouverIsland/comments/142gial/cameron_lake_wild_fire_suspected_human_caused/,52,,VancouverIsland,Cameron Lake Wild Fire - Suspected Human Caused!,0.96,https://wildfiresituation.nrs.gov.bc.ca/incidents?fireYear=2023&incidentNumber=V70600
Refrigerator-Savings,,1685482590,,False,13w2w89,False,True,t3_13w2w89,8,False,/r/VancouverIsland/comments/13w2w89/how_are_you_guys_doing_up_there_sayward/,51,"From what I've seen, there's a sizable forest fire up there. Hope everyone who lives there or is traveling stays safe",VancouverIsland,"How are you guys doing up there, Sayward?",0.96,https://www.reddit.com/r/VancouverIsland/comments/13w2w89/how_are_you_guys_doing_up_there_sayward/
BitCrack,,1684085166,,False,13hi0bx,False,False,t3_13hi0bx,4,False,/r/VancouverIsland/comments/13hi0bx/this_is_a_response_to_a_video_from_last_night/,5,https://www.reddit.com/r/VancouverIsland/comments/13h8w0d/parksville_fire/?utm_source=share&utm_medium=android_app&utm_name=androidcss&utm_term=1&utm_content=share_button,VancouverIsland,This is a response to a video from last night (link in post),0.69,https://i.redd.it/2vutq6vthvza1.jpg
BitCrack,,1684060745,,False,13h8w0d,False,False,t3_13h8w0d,46,False,/r/VancouverIsland/comments/13h8w0d/parksville_fire/,116,,VancouverIsland,Parksville fire ,0.96,https://v.redd.it/xt718b2nzrza1
Sharp-Incident-6272,,1680823085,,False,12e1o04,False,False,t3_12e1o04,30,False,/r/VancouverIsland/comments/12e1o04/langfords_new_fire_truck_is_on_its_way_from/,279,,VancouverIsland,Langfords new fire truck is on its way from Alabama thanks to a trucker from Nanaimo,0.99,https://i.redd.it/54jldgez1esa1.jpg
jeeverz,,1680700812,,False,12ck5kp,False,False,t3_12ck5kp,0,False,/r/VancouverIsland/comments/12ck5kp/pick_yourself_up_and_keep_going_comox_valley/,26,,VancouverIsland,"'Pick yourself up and keep going': Comox Valley father, 2 sons escape trailer fire",1.0,https://vancouverisland.ctvnews.ca/video?clipId=2661477
insouciant01,,1677359689,,False,11bvy0y,False,False,t3_11bvy0y,12,False,/r/VancouverIsland/comments/11bvy0y/genoa_bay_fire/,73,,VancouverIsland,Genoa Bay Fire,0.99,https://www.reddit.com/gallery/11bvy0y
KarlJohanson,,1676794776,,False,11659jx,False,False,t3_11659jx,0,False,/r/VancouverIsland/comments/11659jx/house_fire_in_souther_vancouver_island/,3,,VancouverIsland,House fire in souther Vancouver Island.,0.67,https://www.youtube.com/watch?v=x2ciSKr1U6I&list=PLRKfDCNaz3DjestAqxEgheYEj1Oxoa93s&index=1
Primary_Sequins,,1671749829,,False,zszhdc,False,False,t3_zszhdc,17,False,/r/VancouverIsland/comments/zszhdc/shelter_restaurant_in_tofino_gutted_in_thursday/,41,,VancouverIsland,Shelter Restaurant in Tofino gutted in Thursday fire,0.95,https://www.cheknews.ca/its-destroyed-tofinos-shelter-restaurant-gutted-in-thursday-fire-1124717/
PalabraFlamenco,,1671402368,,False,zpa8fe,False,True,t3_zpa8fe,0,False,/r/VancouverIsland/comments/zpa8fe/dark_sounds_poetry_flamenco_with_jan_zwicky_garth/,2,"It's been four years since we mounted our Dark Sounds series. We're doing it again this February. Dark Sounds features acclaimed poet and philosopher Jan Zwicky, poet Garth Martens, and two of Canada's top flamenco artists, dancer Denise Yeo and guitarist Gareth Owen.

Our focus is grief, death, and the climate crisis. Endings, disappearances, cultural cataclysm. Little deaths that pile up while, all around us, the smoke steeples the horizon.

Already, over 45% of tickets are sold. We're offering limited discount tickets if you act now:

[https://www.eventbrite.ca/e/dark-sounds-poetry-flamenco-ft-jan-zwicky-tickets-483923717867](https://www.eventbrite.ca/e/dark-sounds-poetry-flamenco-ft-jan-zwicky-tickets-483923717867)

In traditional flamenco, the dancer and guitarist improvise in relationship to the singer and no two performances are the same. Here, they take their cue from the poets. Answer the force of language with their own rupturing energies. Embody something a bit like fire or wind with their precision and rhythm and silence. Here, the ugly faces we were taught to hide are loose, tied to what’s true and uncomfortable, hard to bear. Anger, despair, accusation. Our culpability. Our ferociousness. Our full sob. Our rage. Our love, too – the invocation of our attention. With no hope of rescue, this is grief that honours what we’ve lost, what we’re going to lose. In true flamenco form, we’re asked to listen, our entire being to listen, before we improvise.

https://preview.redd.it/orbw86dpfq6a1.png?width=1920&format=png&auto=webp&s=07495bc7427624ed0c0f793c348e76564db079ba",VancouverIsland,"Dark Sounds: Poetry + Flamenco (with Jan Zwicky, Garth Martens, Denise Yeo, and Gareth Owen)",0.75,https://www.reddit.com/r/VancouverIsland/comments/zpa8fe/dark_sounds_poetry_flamenco_with_jan_zwicky_garth/
Loud_Muffin_3268,,1665231374,,False,xyrbon,False,False,t3_xyrbon,33,False,/r/VancouverIsland/comments/xyrbon/i_posted_an_image_a_few_days_ago_of_helicopter/,345,,VancouverIsland,I posted an image a few days ago of helicopter pilots putting out a forest fire on Vancover Island. A firefighter who actually worked on the fire reached out to me and asked for prints for the firehall. Well.. Here they are.... Thank you boys for your service. Delivery coming soon!!!,0.99,https://v.redd.it/zjcmjoy9qks91
Loud_Muffin_3268,,1664926115,,False,xvu3nl,False,False,t3_xvu3nl,10,False,/r/VancouverIsland/comments/xvu3nl/a_photo_i_took_today_along_the_malahat_highway_of/,237,,VancouverIsland,"A photo I took today along the Malahat Highway of a helicopter pilot battling Wildfires across the bay. Crazy to see how quickly and accurately these guys put out these giant fires! Huge thanks to those in the air, saving those on the ground!",1.0,https://www.reddit.com/gallery/xvu3nl
AMadcapLass,,1664504505,,False,xrpre3,False,False,t3_xrpre3,1,False,/r/VancouverIsland/comments/xrpre3/village_of_zeballos_reinstates_fire_service_after/,30,,VancouverIsland,Village of Zeballos reinstates fire service after volunteers step up.,1.0,https://www.cbc.ca/news/canada/british-columbia/village-of-zeballos-reinstates-fire-service-after-shut-down-over-lack-of-volunteers-1.6601236
MellyBlueEyes,,1656451912,,1656452123.0,vmyh2g,False,True,t3_vmyh2g,30,False,/r/VancouverIsland/comments/vmyh2g/bank_robbery_in_victoria/,68,"This is going to be all over the news if not already. Armed robbery at a BMO on Pear St, multiple shooting victims including cops and suspects. Area currently on lockdown due to a potential explosive device.

[https://www.reddit.com/r/VictoriaBC/comments/vmul6d/what\_is\_happening\_at\_the\_bmo\_on\_pear\_street/?utm\_source=share&utm\_medium=web2x&context=3](https://www.reddit.com/r/VictoriaBC/comments/vmul6d/what_is_happening_at_the_bmo_on_pear_street/?utm_source=share&utm_medium=web2x&context=3)  


[https://www.reddit.com/r/VictoriaBC/comments/vmupc7/possible\_shots\_fired\_in\_the\_area\_of\_shelbourne\_rd/?utm\_source=share&utm\_medium=web2x&context=3](https://www.reddit.com/r/VictoriaBC/comments/vmupc7/possible_shots_fired_in_the_area_of_shelbourne_rd/?utm_source=share&utm_medium=web2x&context=3)",VancouverIsland,Bank robbery in Victoria,0.99,https://www.reddit.com/r/VancouverIsland/comments/vmyh2g/bank_robbery_in_victoria/
blurst-of-times1000,,1655240516,,False,vcdivr,False,True,t3_vcdivr,0,False,/r/VancouverIsland/comments/vcdivr/support_for_house_fire_survivor/,39,"Several weeks ago, Sarah escaped her burning suite on Timberdoodle Rd. in East Sooke with the clothes on her back. Tragically, as [reported in the news](https://www.sookenewsmirror.com/news/woman-struggles-after-losing-everything-in-east-sooke-fire/), another community member lost their life. 

Sarah has lived in East Sooke/Sooke for nearly 20 years and has been deeply involved with the community. Sarah is the co-owner and founder of small business in Sooke - [Wild Hill Botanicals](https://www.instagram.com/wildhillbotanicals/?hl=en), a small skincare company that often sold into other local businesses and at holiday markets. She has since lost all of her equipment in the fire. She led a variety of literacy projects for the Sooke region and taught yoga for many years within the community.   
Sarah has now been able to locate safe housing and is awaiting an insurance process that will inevitably take some time. If you're in a position to do so, please consider donating or [sharing this link to support ](https://gofund.me/cdd1eb73)Sarah.",VancouverIsland,Support for house fire survivor,0.98,https://www.reddit.com/r/VancouverIsland/comments/vcdivr/support_for_house_fire_survivor/
avikingr,,1653699006,,False,uzc59a,False,False,t3_uzc59a,11,False,/r/VancouverIsland/comments/uzc59a/mill_bay_mall_fire_closes_transcanada_highway/,25,,VancouverIsland,Mill Bay mall fire closes Trans-Canada Highway,0.94,https://vancouverisland.ctvnews.ca/mill-bay-mall-fire-closes-trans-canada-highway-1.5921849
Careless-Heron,,1653527398,,False,uxvzfx,False,True,t3_uxvzfx,8,False,/r/VancouverIsland/comments/uxvzfx/camping_at_china_beach_campground_in_juan_de_fuca/,3,"Noob camper here 

As the title says, I’m camping near China beach but am having trouble finding info on where I might be able to buy ice, fire wood, and other basic items. 

Do provincial campgrounds sell these items?

I know that the nearest town is rather far and need to know how much I need to bring with me. 

Thanks!",VancouverIsland,"Camping at China Beach Campground in Juan de Fuca Park- anywhere close I can buy ice, wood, etc?",0.67,https://www.reddit.com/r/VancouverIsland/comments/uxvzfx/camping_at_china_beach_campground_in_juan_de_fuca/
Primary_Sequins,,1651270157,,False,uewvr8,False,False,t3_uewvr8,12,False,/r/VancouverIsland/comments/uewvr8/man_rescued_from_apartment_fire_at_view_towers/,25,,VancouverIsland,Man rescued from apartment fire at View Towers,0.95,https://www.cheknews.ca/man-rescued-from-apartment-fire-at-view-towers-1019743/
Stoned_Ninjaa,,1650864781,,False,ubdqm8,False,False,t3_ubdqm8,6,False,/r/VancouverIsland/comments/ubdqm8/i_like_this_weather_hope_its_a_wet_summer_just/,87,,VancouverIsland,I like this weather hope its a wet summer just like spring and we might skip fire season .,0.9,https://v.redd.it/p2qmczxs2mv81
TeainaTree,,1645011446,,False,sttu2m,False,True,t3_sttu2m,12,False,/r/VancouverIsland/comments/sttu2m/best_place_to_disconnect_and_reconnect/,12,"Hello! I'm going to the island in April and trying to find a place to stay close to Victoria that is perfect for relaxing, disconnecting from this crazy world, and reconnecting with nature. Hoping to find an oceanfront cabin with hot tub and fire pit that's fairly private for 2 nights. Only me and the husband going. Any recommendations are appreciated!",VancouverIsland,Best place to disconnect and reconnect?,0.72,https://www.reddit.com/r/VancouverIsland/comments/sttu2m/best_place_to_disconnect_and_reconnect/
classy_thrifter,,1642522045,,False,s70xkx,False,False,t3_s70xkx,0,False,/r/VancouverIsland/comments/s70xkx/relaxing_fireplace_on_the_beach_burning_logs/,5,,VancouverIsland,Relaxing Fireplace on the Beach Burning Logs Crackling Fire Sounds for Stress Relief 4K UHD 60FPS,0.78,https://youtu.be/Z_hM-6ui930
terven_history,,1640233019,,False,rmmuz6,False,True,t3_rmmuz6,51,False,/r/VancouverIsland/comments/rmmuz6/my_fear_of_cougars_is_hindering_my_enjoyment_of/,28,"I used to really enjoy going on long hikes by myself. Once I even camped out on a hammock alone with no fire at a lookout on the mainland and had a pleasant time. As a child, I went camping every year so I am familiar with the basic guidelines of respecting wildlife

I didn't grow up on the Island, so I am not used to being in an area with cougars. The few times I have ventured out here, I couldn't shake the spooky feeling of being watched. Of course I have heard stories, like one of a friend's little brother being mauled. Then there are those videos of people being stalked. I have even seen one crossing the road at night and they are *fucking huge* and quite terrifying. 

I know my problem is psychological. I was hoping people might share their stories of overcoming this fear or feeling more secure.

Going with other people really isn't an option as friends are usually busy or cancel plans, ect. 

Thanks in advance people's insight :)

^*heuk* ^*heuk* ^in ^advance ^for ^jokes ^about ^horny ^older ^women.",VancouverIsland,My fear of cougars is hindering my enjoyment of nature.,0.83,https://www.reddit.com/r/VancouverIsland/comments/rmmuz6/my_fear_of_cougars_is_hindering_my_enjoyment_of/
MamaSheeba,,1635220679,,False,qfy3pa,False,False,t3_qfy3pa,2,False,/r/VancouverIsland/comments/qfy3pa/i_was_filming_the_seagulls_in_the_waves_in/,21,,VancouverIsland,"I was filming the seagulls in the waves in Esquimalt lagoon on Saturday…if you zoom in, on the horizon you can see the cargo ship that was on fire…",0.93,https://v.redd.it/646p6663xpv71
KarlJohanson,,1635042145,,False,qeiyzn,False,False,t3_qeiyzn,12,False,/r/VancouverIsland/comments/qeiyzn/zim_kingston_container_ship_fire_of_the_victoria/,10,,VancouverIsland,"Zim Kingston Container Ship Fire, of the Victoria waterfront.",0.86,https://www.youtube.com/watch?v=jKhlP3isL4I
karsut,,1632799405,,False,pwxilt,False,False,t3_pwxilt,0,False,/r/VancouverIsland/comments/pwxilt/fire_cloud_over_nanaimo/,58,,VancouverIsland,Fire Cloud over Nanaimo!,0.94,https://i.redd.it/q8tuz3wex5q71.jpg
necromundus,,1629478812,,False,p89axk,False,False,t3_p89axk,4,False,/r/VancouverIsland/comments/p89axk/a_20_hectare_forest_fire_is_burning_at_mount/,38,,VancouverIsland,"A 20 hectare forest fire is burning at Mount Benson, 4km outside of Ladysmith. Here is the live feed.",0.97,https://youtu.be/V-5ZZ2uS0Sg
AMadcapLass,,1627830864,,False,ovtwau,False,False,t3_ovtwau,5,False,/r/VancouverIsland/comments/ovtwau/fire_destroys_approximately_1000_trees_at/,39,,VancouverIsland,"Fire destroys approximately 1,000 trees at Vancouver Island Christmas tree farm.",0.9,https://www.cbc.ca/news/canada/british-columbia/tree-farm-fire-1.6122982
