display_name,name,description,public_description,subscribers
BostonWeather,t5_36gtu,"a fairly simple subreddit. all posts are fair game as long as they are related to boston/new england weather with one exception: do not post a single model run just because it shows a snowstorm! if you look at a forecast model and see a storm a week away it is better to wait. if you do decide to post models it should be a part of a collage showing the solutions from multiple models (via tropicaltidbits or pivotalweather) so people understand the wild swing that might be between the models or if they agree. you should also add what your thinking is regarding the models and what beings you to your conclusion. we don't want to spread fear and misinformation because a couple of runs of one model are juiced up. thank you! (for those that are new or still learning meteorology: if you see a storm on a model see if established meteorologists on twitter are speaking about it - posts from them and their speculation is seen as coming from a knowledgable source but if you can amend your post if they add any further insight like a storm getting stronger or weaker.) maps, forecasts, school closings for reasons other than pandemics, questions about weather, memes about the weather, etc. are allowed. follow bostonforecasts on twitter [ for biweekly weather throughout the year and snow maps. on venmo if you want to add to the coffee that keeps me awake and replying to everyone fund. **if you see a forecast model posted:** keep in mind that things like the gfs, euro, etc. outputs run multiple times a day and refine over time. even still, they aren't going to be precise and take interpretation. all this is to say: if you see a forecast model posted with huge snow totals take it with a healthy dose of salt and consult other models on sites like tropicaltidbits.com.","everything that's related to boston weather: forecasts, school closings for reasons other than pandemics, maps... you name it!",8865
BostonJobs,t5_2svnl,"*** this is a subreddit for people in the [greater boston area](/r/boston) who are looking for new employees or new employers. **please preface the title of your post with [for hire] or [hiring] tags -- if you don't, your post will be automatically removed** **please note: you will need an established reddit account to post here. new accounts will silently fail.** if the post is a direct link to an external website, please also include a comment with the basic job description. if your post isn't showing up, it was probably caught by reddit's spam filter and is now sitting in the spam queue. please [send a message to the r/bostonjobs moderators]( include a link to the post, and we will approve it as quickly as possible. *** ###job listings### [tech jobs for good]( [dice]( [indeed]( [idealist]( [flipdog]( [monster]( [linkedin]( [craigslist]( [37 signals]( [hire culture]( [simply hired]( [careerbuilder]( [stackoverflow]( *** ###staffing agencies### [hollister]( [tek systems]( [knf&t staffing resources]( [beacon hill staffing group]( [professional staffing group]( [big resourcing]( [contemporaries]( *** ###general info### [salary]( [glass door]( [companies based in massachusetts]( *** ###related subreddits### [r/jobs]( [r/work]( [r/boston]( [r/forhire]( [r/resumes](",a place to post job vacancies and jobs wanted.,4374
BostonMA,t5_2yjr2,"/r/bostonma is a community for redditors to share and enjoy high quality content related to boston, ma under thoughtful and transparent moderation. **subreddit rules:** * be civil; follow reddiquette. * posts must be related to boston or the greater boston metropolitan region.","a community for redditors to share and enjoy high quality content related to boston, ma under thoughtful and transparent moderation. under new moderation and reborn as of 1/17/2020.",3421
Dakota_Burns,t5_2zvyqs,,,799
BrookeBurns,t5_3o9b4e,brooke burns.,brooke burns.,345
HistoricalBurns,t5_36f3g,"**rules** 1: must provide at least one source 2: keep it civil; any harassment, racism, or bigotry is subject to removal at moderator's discretion 3: no posting of anyone's private info, including your own, for any reason 4: no meme posts","here, we celebrate the dry wit and clever boldness of our ancestors.",258
BiblicalBurns,t5_q50vr,"a sub for sharing burns, insults, and otherwise named clap-blacks that have a religious theme to them. though the sub is called 'biblical burns', please feel free to submit burns with any kind of religious theme. we are equal opportunity shitposters and do not discriminate against smackdowns of any religious denomination.",sick burns that even god would need ice for.,214
HeavyBurns,t5_3k3u7g,"official subreddit for heavy burns, a skyrim modder and yt content creator.","official subreddit for heavy burns, a skyrim modder and yt content creator.",92
Cache,t5_2uvhj,,intersystems cache and applications that leverage the nosql db,44
RobotCache,t5_akvtc,"robot cache will revolutionize the distribution of digital pc games by launching what we believe to be the first-ever workable decentralized video game marketplace. allowing gamers to resell their pc video games when they’re finished playing them in exchange for iron. iron will allow gamers to purchase their favorite pc video games, and also sell them to other gamers on the robot cache platform. all of this is accomplished by expertly leveraging the power, flexibility, and transparency of blockchain technology. in addition, we are pioneering a new and exciting concept dubbed “proof of gaming.” proof of gaming will allow gamers to mine cryptocurrencies using our robot cache client, for which we will reward them with iron. the robot cache client will also have a real-time tracker that allows gamers to see just how much iron they will be rewarded for their mining.","robot cache is revolutionizing the distribution of digital video games by allowing gamers to buy and then resell their pc games when they’re finished playing them. you can also enable mining through the rc client with just a click (on an opt-in basis) and be rewarded in iron, our site's virtual currency, to earn free games...essentially, while you sleep.",724
NeuraCache,t5_z2kwk,official support / feedback reddit for neuracache app ,official support & feedback reddit for the neuracache app. ,492
CacheValley,t5_33ywa,,"a subreddit for all those who live in lovely cache valley, utah.",87
CacheValleynsfw,t5_7b88dv,,seeking to build an inclusive and supportive community of diverse non-conformers in the cache valley utah/idaho area.,48
Canal_Central,t5_1wm594,reddit oficial do canal central do youtube brasil.,reddit oficial do canal central do youtube brasil.,2619
CanalAbelha,t5_2wlxxh,comunidade não oficial para os fãs do canal do abelha.,comunidade não oficial para os fãs do canal do abelha.,127
SuezCanal,t5_38idn,,suez canal has been attacked taken over by the pirates pirate_flag !attack pirate! new pirate harbor haven! ya'rr enjoying new place! pirate_flag Saudi_Arabia crossed_swords Egypt ,65
CanalWinchester,t5_2s016w,subreddit for the city of canal winchester,"official subreddit for the city of canal winchester, oh",56
CanalDistrict,t5_11yy36,,"the canal district, worcester ma",23
CanalFulton,t5_3ffgv,canal fulton is one of the only places on earth canafl fulron has the most people in canlal fulton canal fulton is the best canal fulton ever rules: ,the most beautiful place in northeast ohio. the water flows plentiful and green. try the ice cream.,39
ChristinaMilian,t5_2w43a,"christina milian [wikipedia page]( christine marie flores, better know by her stage name christina milian, is an american actress and singer.",all about christina milian! red_heart red_heart red_heart red_heart red_heart red_heart red_heart (fan community) ,13542
ChristinaApplegate,t5_2z8ky,,,4705
Christina_Lucci,t5_8c2fkx,,christina model and others girls - subreddit vids & pics ,2335
ChristinaRobinson,t5_2utqs,**welcome!** this community is dedicated to american actress [christina robinson](,community dedicated to american actress christina robinson.,1044
ChristinaOchoa,t5_3myzx,,christina ochoa,984
ChristinaMasterson,t5_2mlsr6,christina masterson is an american actress and model,christina masterson is an american actress and model,764
ChristinaWhittaker,t5_4s9nq1,,a place to discuss missing person christina whittakers case and the relentless docuseries,582
CoryCrawford,t5_8cr5fe,,anything and everything to do with cory crawford can be snarked here. ,3969
DevonCrawford,t5_yq0ys,,"devon crawford is a popular computer science youtuber. this sub is all about him, what he creates and what he does.",391
MicheaCrawford,t5_3fih0,"##rules * ^(post any and all material directly related to michea.) * ^(content preferably kept to gifs and images although youtube content and the like is allowed.) * ^(all images must be hosted on imgur or reddit.) * ^(all gifs must be hosted on imgur or gfycat.) * ^(no reposts from the top 100 of all time or the top posts from the month, unless your post is in a higher quality to the original.) * ^(no albums with more than 30 images.) * ^(limit of 5 posts per 24 hours.) * ^(not really a rule, but if you see any images of michea crawford on another sub make sure to tag this sub in the comments.) ##bio/stats * ^(full name: michea crawford) * ^(born: october 15, 1986) * ^(birthplace: quebec, canada) * ^(height: 5'8""/173cm) * ^(chest: 34""/86cm) * ^(waist: 24""/61cm) * ^(hips: 35.5""/91cm) * ^(eyes: green) * ^(hair: brown) ##michea's social media * [facebook]( * [instagram]( ##our other subs &nbsp; | &nbsp; ---|--- ^(**/r/vanessamoe**) | ^(**/r/cameronrorrison**) ^(**/r/natalieroser**) | ^(**/r/deniseschaefer**) ^(**/r/lorenarae**) | ^(**/r/julimery**) ^(**/r/sarahstephens**) |^(**/r/taylorhannum**) ^(**/r/kelly_gale**) |^(**/r/graceelizabeth**) ^(**/r/laisribeiro**) |^(**/r/marinalaswick**) ^(**/r/kyra_santoro**) |^(**/r/stephclairesmith**) ^(**/r/veronica_zoppolo**) |^(**/r/haileelautenbach**) ^(**/r/elizabethturner**) |^(**/r/celestebright**) ^(**/r/camilamorrone**) |^(**/r/vikabronova**) ^(**/r/giaradionova**) |^(**/r/dashadereviankina**) ^(**/r/natalidanish**) |^(**/r/claraalonso**) ^(**/r/gabbyepstein**) |^(**/r/michele_maturo**) ^(**/r/taylormariehill**) |^(**/r/jasmine_tookes**) ^(**/r/luizafreyesleben**) |^(**/r/jessica_clements**) ^(**/r/oliviapickren**) |^(**/r/hannaedwinson**) ^(**/r/daniellagrace**) |^(**/r/carmellarose**) ^(**/r/alissaviolet**) |^(**/r/rachelcook**) ^(**/r/kassismith**) |^(**/r/alexandriamorgan**) ^(**/r/sarahrosemcdaniel**) |^(**/r/savvytaylor**) ^(**/r/ladakravchenko**) |^(**/r/sierra_skye**) ^(**/r/yuliarose**) |^(**/r/laurenlayne**) ^(**/r/fashionmodels**) |^(**/r/triangl**)",welcome to the community dedicated to all things michea crawford.,558
CrawfordBlake,t5_11rqdu,everything you can imagine is real.,everything you can imagine is real.,450
JoanCrawford,t5_2w6p1p,"a place to discuss, appreciate, and question the woman, the star persona, the career, and the eccentricities of lucille lesueur aka joan crawford.","a place to discuss the woman, the star persona, the career, and the eccentricities of lucille lesueur aka joan crawford.",391
ClareCrawford,t5_3nfxdn,the beautiful clare crawford. see more of her on instagram ,the beautiful clare crawford. see more of her on instagram ,269
KamieCrawford,t5_6u657o,,dedicated to the underrated kamie crawford ,187
Dawson,t5_2qk2h,"the dawson college subreddit! a place for past, present, and potential future students of dawson to interact with each other. ask questions, post about events, and discuss anything else that is relevant to our community. please be sure to read the rules before submitting a post.","the dawson college subreddit! a place for past, present, and potential future students of dawson to interact with each other. ask questions, post about events, and discuss anything else that is relevant to our community.",1382
ShaneDawson,t5_2u0qw,"-the (un)official **shane dawson** subreddit- this is not a fan or hate sub this sub is for any and all discussions surrounding shane dawson. please try to keep the discussions civil between everyone. everyone is entitled to their opinion. if you strongly disagree with their opinion, please share your thoughts in a civil manner without attacking each other. thank you. **rules** please report any rule breakers. rule breaking posts will be removed **without notice**. **1.) be civil** no overly foul language directed at one another or the people we are here to discuss. no targeted harassment of fellow users. we will not tolerate hate speech. please do not downvote others for having a differing opinion than you **2.) no gatekeeping** **3.) no reposts** if content has been posted recently we will remove duplicates at our discretion. if you are reposting someone's original content, be sure to give credit to the op. **4.) posts must be of quality** keep minor video discussions contained to the individual video threads. posts must have descriptive titles, and for video links op should make a short parent comment to spark discussion. low effort posts may be removed. **5.) no self promotion.** except for for in mod-designated self promotion posts. **6.) no body/mental health/sexuality shaming.** any of these will not be tolerated and your post/comment will be removed. repeated offences will be temp banned followed by permanently banned if it continues again. **7.) no trolling/baiting.** do not post purely to troll or bait other subscribers.","for discussion surrounding youtuber shane dawson; the good, the bad, the ugly, & the neutral.",59979
RosarioDawson,t5_2w10l,------------------------------------------------------------- ###[rules]( ---------------------------------------------------------------,a subreddit for fans of rosario dawson.,17277
JeanDawson,t5_27nn5n,more @ jeandawson.com ,a subreddit about up-and-coming artist jean dawson,3167
MorganDawson,t5_4j8k8z,.,.,431
DawsonCity,t5_83yixi,,"a subreddit for dawson city, yukon, canada. tr’ondëk hwëch’in territory. share your pictures, experiences, or questions here!",109
FortWorth,t5_2rsbl,"funky town, panther city, hell's half acre...call it what you will. news, happenings, and discussions related to tarrant county. **relevant reddits** [r/coronavirustx]( cities: * [r/dallas]( * [r/arlington]( * [r/benbrook]( * [r/irving]( * [r/keller]( * [r/mansfieldtx]( * [r/burleson]( colleges: * [/r/utarlington]( * [r/tcu]( * [r/tccstudentsconnect]( interests: * [r/dfwmusic]( * [r/dfwfilmmakers]( * [/r/dfwgaymers]( * [/r/geekdfw]( * [/r/dfwpets]( * [/r/dfwbeer]( * [/r/texaspolitics]( extras: * [reddit fort worth facebook group]( * [reddit mid-cities facebook group] ( * [r/dfwjobs]( * [r/dfwclassifieds]( * [r/dfwmarketplace]( **fort worth events calendars** * [fortlive]( for local shows happening. * [fort worth weekly]( for calendar of events. * [west 7th events]( * [near southside events]( * [the stockyards]( for shows & events. * [sundance square]( events calendar. * [free in fort worth]( for a list of free stuff to see/do. * [live music venues - big & small](","fort worth and the surrounding metroplex area, west of dfw airport. issues of concern, news and current events, outings, questions, and general discussions.",157714
FortNiteBR,t5_3oeyf,"###welcome to /r/fortnitebr fortnite battle royale is a free-to-play battle royale game mode within the fortnite universe. ###subreddit town hall is there a rule or policy on the subreddit that you don't like? is there a rule you wish existed? why do you want that one weekly megathread to return? we want to hear from you! join us in our [subreddit town hall]( where we are discussing what needs to be changed, revised, or implemented. help shape the future of the community! ###supported subreddits you can access the co-op fortnite: save the world subreddit at /r/fortnite. mobile users should visit /r/fortnitemobile. discuss the creative sandbox game mode at /r/fortnitecreative. for competitive fortnite discussion, please visit /r/fortnitecompetitive. ###frequently used links **[chapter 4 - season 3 | launch megathread]( **[extended flair-picker]( **[epic posts]( **[epic comments]( **[daily shop]( **[badge/emoji guidelines]( **[verified creator form]( ###subreddit rules users are expected to behave maturely and respectfully. for a full list of what you can and can't do, please check the [subreddit rules]( ### subreddit features visit [new.reddit.com]( or use the official app for more subreddit features. includes bricks, special membership, and gif replies. ### moderator applications [apply at any time.]( if you don't hear back from us within a month, reapply! ###official links [fortnite official site]( [discord]( [facebook: [instagram: [twitch: [twitter: [youtube: ","the developer supported, community run subreddit dedicated to the fortnite: battle royale game mode by epic games.",2959447
FortCollins,t5_2rrmq,"## rules content must abide to [reddit's content policy]( inappropriate content includes doxing, illegal or prohibited transactions, under-age sexual content. sub rules: **one**. be civil: follow [the reddiquette]( no personal attacks, harassing, bullying, threats of violence, even through ""dog whistles"" **two**. no commercial/promotional content: classified-style (craigslist-like, jobs, housing, personal ads, give-aways), transactions, spam (including blog-spam, youtube spam), self-promotion (per [reddit's rules on self-promotion]( (a), advertising, commercial content, fundraising, politicking (b); post such content in /r/fortcollinsclassified **three**. problematic content: mods may at their discretion moderate the following: * not related or pertinent to fort collins and vicinity * crime reports; if you observe a crime, call the police, don't post it here; posts about imminent threats are allowed * allegations that might cause harm to a potentially innocent person * requests for accident details * ~~requests for dispersed campsites, great fishing spots or the like~~ * trolling: posting inflammatory, insincere, digressive, extraneous, or off-topic messages with the intent of provoking readers into displaying emotional responses or manipulating others' perception * rants: posting a submission to complain about someone or something; if warranted, mods may create a megathread and direct the discussion there * ~~cause promotion: (^may ^make ^an ^exception ^for ^regular ^contributors ^to ^this ^sub )~~ * pictures with legible vehicle license plates any content that violates these rules is still welcome in the weekly thread, as long as it doesn't violate the reddit content policy. notes: a) event announcements from a disinterested party are ok b) political discussion is ok ## new to town we are excited to have you, but before making a new post, try searching and reading through past threads to see if your question has already been answered. otherwise, i'm sure our friendly denizens can dispense some helpful advice. ||| |:-------------|:---------| | [fort collins gov]( | [larimer county]( | [covid dash]( | [trails and hiking]( | | [poudre tubing]( | [down town]( | ## local reddits ||| |:--------------|:----------------| | [colorado]( | [front range]( | | [louisville]( | [boulder]( | | [denver]( | [estes park]( | | [greeley]( | [longmont]( | [loveland]( | [cheyenne]( ##colorado life ||| |:------------|:------------| | [co bike]( | [co beer]( | [co snow]( | [co ents]( | | [focomeets]( | [csu]( | ##useful links || |:---------:| |[r/fortcollins discord server]( | | [r/fortcollins facebook group]( | | [fort collins bicycle registry]( | | [fort collins bicycle map]( | | [fort collins street maintenance]( | | [fort collins music subreddit]( |","a subreddit specifically about fort collins, colo. please, no posts that have nothing to do with fort collins. ",48547
FortMyers,t5_2tnir,"fort myers, fl - city of palms >[rules to read before posting]( **sister subreddits:** * **/r/lehighacres ** * /r/swfl * /r/sanibel * /r/fgcu * /r/capecoral * /r/naples_fl * /r/floridaman **local business in fort myers** (events and entertainment) * /r/swfl007 (recreational automotive) * /r/northtrailrv",,21757
FortSaskatchewan,t5_2sqqw,"#welcome this is the unofficial subreddit for the city of fort saskatchewan, alberta, as well as the surrounding region. we encourage content and discussions, such as news, events, and pictures, that are related to fort saskatchewan and the counties and communities around it. #rules 1. please follow proper [reddiquette]( 2. be respectful to others 3. don't spam 4. be descriptive with your titles 5. don't alter news headlines unless they're poor quality 6. don't post personal information 7. submissions must be related to fort saskatchewan and the area around it #community resources * city: [website]( | [wikipedia page]( * fort sask transit: [website]( | [wikipedia page]( * [families first society]( * [food bank]( * [furniture bank]( * [support your fort]( #local communities * [alberta]( * [alberta beer]( * [alberta discord server]( * [alberta gardening]( * [alberta jobs]( * [alberta photography]( * [banff]( * [camping alberta]( * [edmonton]( * [fishing alberta]( * [hiking alberta]( * [hunting alberta]( * [macewan university]( * [nait]( * [sherwood park]( * [university of alberta](","the unofficial subreddit for the city of fort saskatchewan, alberta, and the surrounding region.",8501
FortPorn,t5_2sljq,"a community for posting high-res photos, maps, and diagrams of fortifications. [please be respectful]( message the mod if your submission isn't showing. if you like fortporn, please check out these subreddits: **[earthporn]( **[history]( **[historyporn]( **[medievalporn]( **[zombiefortress]( and a special nod to **[minecraft]( check out our friends at: **[home defense](",,7853
FortBend,t5_2shj0,sugarland missouri city richmond,sub for the residents of the fort bend county in texas,3755
fortSALTA,t5_3oybc9,a community for all kinda of ocean salt found in the world of attack on titan,a community for all kinds of ocean salt found in the world of attack on titan,3321
FortMill,t5_2tkzw,"an estimated 13,000 citizens reside in the township of fort mill, sc. so far, based on research, 31 in 13,000 citizens are also redditors. [official fort mill website](","a subreddit for fort mill, sc. local resident? visiting soon? looking to move here? feel free to start a conversation.",1034
FortWalton,t5_2slhs,* fort walton beach subreddit * if you want to advertise an event for your business you have to run it by the mods first. * no vacation spam allowed. * any posts that appear to be nothing but spam will get the poster banned from the fort walton subreddit * please observe [reddiquette]( **also visit** [r/destin]( [r/pensacola]( ,,1217
FortStJohn,t5_30c3y,check out our friends! /r/britishcolumbia,a place for residents and visitors of fort st. john to come and share stories and get information!,1855
FortWorth,t5_2rsbl,"funky town, panther city, hell's half acre...call it what you will. news, happenings, and discussions related to tarrant county. **relevant reddits** [r/coronavirustx]( cities: * [r/dallas]( * [r/arlington]( * [r/benbrook]( * [r/irving]( * [r/keller]( * [r/mansfieldtx]( * [r/burleson]( colleges: * [/r/utarlington]( * [r/tcu]( * [r/tccstudentsconnect]( interests: * [r/dfwmusic]( * [r/dfwfilmmakers]( * [/r/dfwgaymers]( * [/r/geekdfw]( * [/r/dfwpets]( * [/r/dfwbeer]( * [/r/texaspolitics]( extras: * [reddit fort worth facebook group]( * [reddit mid-cities facebook group] ( * [r/dfwjobs]( * [r/dfwclassifieds]( * [r/dfwmarketplace]( **fort worth events calendars** * [fortlive]( for local shows happening. * [fort worth weekly]( for calendar of events. * [west 7th events]( * [near southside events]( * [the stockyards]( for shows & events. * [sundance square]( events calendar. * [free in fort worth]( for a list of free stuff to see/do. * [live music venues - big & small](","fort worth and the surrounding metroplex area, west of dfw airport. issues of concern, news and current events, outings, questions, and general discussions.",157714
FortNiteBR,t5_3oeyf,"###welcome to /r/fortnitebr fortnite battle royale is a free-to-play battle royale game mode within the fortnite universe. ###subreddit town hall is there a rule or policy on the subreddit that you don't like? is there a rule you wish existed? why do you want that one weekly megathread to return? we want to hear from you! join us in our [subreddit town hall]( where we are discussing what needs to be changed, revised, or implemented. help shape the future of the community! ###supported subreddits you can access the co-op fortnite: save the world subreddit at /r/fortnite. mobile users should visit /r/fortnitemobile. discuss the creative sandbox game mode at /r/fortnitecreative. for competitive fortnite discussion, please visit /r/fortnitecompetitive. ###frequently used links **[chapter 4 - season 3 | launch megathread]( **[extended flair-picker]( **[epic posts]( **[epic comments]( **[daily shop]( **[badge/emoji guidelines]( **[verified creator form]( ###subreddit rules users are expected to behave maturely and respectfully. for a full list of what you can and can't do, please check the [subreddit rules]( ### subreddit features visit [new.reddit.com]( or use the official app for more subreddit features. includes bricks, special membership, and gif replies. ### moderator applications [apply at any time.]( if you don't hear back from us within a month, reapply! ###official links [fortnite official site]( [discord]( [facebook: [instagram: [twitch: [twitter: [youtube: ","the developer supported, community run subreddit dedicated to the fortnite: battle royale game mode by epic games.",2959447
