display_name,name,description,public_description,subscribers
NewJeans,t5_5pmlj3,,"welcome to r/newjeans, the subreddit community for newjeans! newjeans (뉴진스) is a five-member k-pop girl group by ador, an independent record label under hybe, consisting of members hanni, minji, danielle, haerin, and hyein. the group made their official debut on august 1st, 2022. rabbit_face ",28123
PRINCE,t5_2qoju,"dearly beloved, we are gathered here today to discuss and celebrate the career, life and legacy of prolific american musician and influential pop culture icon **prince** june 7, 1958 - april 21, 2016 feel free to post any **articles**, **images**, **videos** or any other **links** that are relevant for discussion in the musical universe of *prince* and associated artists. ###connections: [prince.com]( - official site of the prince estate [ - prince's verified twitter [instagram]( - official instagram [princevault]( - the definitive prince encyclopedia [wikipedia]( - prince on wikipedia ###content filters: [n.e.w.s. only]( [no photoshop art](","the purple one. his royal badness. the high priest of pop. the minneapolis genius. the modern day mozart. the prince of funk. a subreddit produced, arranged, written and composed by the music of prince june 7, 1958 - april 21, 2016 - ∞",24342
DragonPrince,t5_p3q0p,please mark spoilers in your title!,"a second place to discuss the netflix show dragon prince. the first place is r/thedragonprince. you should really try there first. if you're still here, be cool. discuss the show amongst friends.",9494
FreshPrince,t5_2sycc,,a place for fans to chat about this amazing 90s sitcom! ----------------------------------discord: discord.gg/mpzne2v,3800
TheDragonPrince,t5_lghxu,"###[enable night mode](#/res_sr_config/nightmodecompatible) [watch this show]( # content filtering filters | ---|--- **[no spoilers]( | **[no literature threads]( | # about the show [](#poster) **the dragon prince**, created by aaron ehasz (avatar: the last airbender) and justin richmond, tells the story of two human princes who forge an unlikely bond with the elven assassin sent to kill them, embarking on an epic quest to bring peace to their warring lands. * [*twitter*]( * [*facebook*]( * [*tumblr*]( * [*instagram*]( # rules 1. **spoiler policy** *spoilers must be marked for one month after relevant content is released. read the [spoiler policy]( for full spoiler rules.* 2. **be courteous** *be nice and follow [reddiquette]( 3. **flair your submissions** *if you're having trouble choosing the right flair, check out our [our wiki page]( for guidance.* 4. **art crediting policy** *when sharing fanart that is not yours, credit artists within the title. comment a source link if you submit the art as an image, and do not share art here against an artists own wishes. indicate fanart as your own by putting [oc] in the title.* 5. **no politics** *outside politics are prohibited* 6. **no nsfw content** *try to keep submitted content appropriate* 7. **no illegal streaming** *posting of streaming or download links is prohibited* 8. **keep submissions tdp related** *submissions should be related to the dragon prince only* 9. **no self-promotion in the title** *your submission's title must not contain any self promotion. you are only allowed to promote yourself once in the comments of your own submission.* 10. **do not spam the subreddit** *you're allowed to have 4 submissions a day. anything above that threshold will be removed.* # discord support think you've been wrongfully banned from our discord server and want to prove it? [appeal]( # related communities subreddits | ---|--- **r/thelastairbender** | **r/hildatheseries** | **r/cartoons** | --- * [listen to the soundtracks **official**]( * [season 3 trailer **official**]( * [season 3 discussion hub]( * [ama with the creators of the show]( * [ama with claudia's va - racquel b.](","season 5 is out now! the dragon prince, created by aaron ehasz (avatar: the last airbender) and justin richmond, tells the story of two human princes who forge an unlikely bond with the elven assassin sent to kill them, embarking on an epic quest to bring peace to their warring lands. ",106701
Prince_Albert,t5_2ti1h,"welcome to the prince albert sub-reddit. this is your place to have conversations of relevance to you, the citizens of prince albert, sk. pretty much anything goes, with only one request. no pictures of piercings, please... geographically related links: [/r/canada]( [/r/saskatchewan]( [/r/saskatoon]( [/r/regina]( special interest links: [/r/university of saskatchewan]( [/r/university of regina]( [/r/princealbertraiders]( [/r/saskms](",,3530
Prince2,t5_2tbkm,"prince2 is a structured project management method endorsed by the uk government as the project management standard for public projects. the methodology encompasses the management, control and organization of a project. **sub-reddit rules:** * only posts related to prince2",,1359
FingerPrince,t5_2wu8n,"this subreddit is devoted to the fp principle, and its law: on a reddit ""cartoon jokes"" thread, or cartoon picture with a double-entendre, the probability of someone mentioning the animaniacs finger prince gag is 100%. finger prince: because everything's funnier the 200th time around! submissions can be children's cartoons, tv shows, or movies that have adult jokes hidden in the show/movie. in support of a decentralized and federated internet, youtube links are not allowed. we recommend importing the video in a peertube instance which takes only 30 seconds! peertube instances we recommend: [what is peertube?](",this subreddit is devoted to children's cartoons/tv shows with adult jokes in all their glory.,1076
PrinceHarry,t5_2w6pr,,"during an interview in afghanistan, prince harry runs off to class. ",715
CaptivePrince,t5_3lv5m,"a forum for discussion and sharing of fanwork relating to c s pacat's m/m fantasy romance trilogy, the captive prince. **rules** 1. no sexism/racism/homophobia/transphobia/etc. 2. link posts of art or writing should always be to the creator's page, no rehosting and no direct image links. 3. flag nsfw content ","discussion of c s pacat's m/m fantasy romance trilogy, the captive prince, as well as related fan work.",511
rock,t5_2qknc,"1) no private/ unknown covers or remixes if it's a well-known band remixing/ re-recording their own stuff, or covering someone else, then we'll allow it - but (for example) single-instrument covers are a no-no. also includes artwork that's basically a 'painting' of a photo or a cover of a famous artists' style. repeat offenders will be banned. 2) no playlists/ i-like-x posts if it's a well-known band remixing/ re-recording their own stuff, or covering someone else, then we'll allow it - but (for example) single-instrument covers are a no-no. also includes artwork that's basically a 'painting' of a photo or a cover of a famous artists' style. repeat offenders will be banned. i-like-x - try actually posting something by the band, you can have the discussion you want in the comments (or comment in the weekly sticky post, which is, after all, what it's for) 3) use correct formatting band name - song or album name (year) - [optional additional tag or info]. english only. please use flairs wherever possible. 4) image/ video posts must be worthwhile. no memes that nobody will understand, or low effort posts in general. ai voices do our heads in, so none of that either. do not simply post an image with no context. memes that make no sense or are so niche that nobody will get them are subject to an instant ban. discussion posts must actually be thought out and generate discussion. ai voices do our heads in, so none of that either. 5) self-promotion must be balanced and in good taste this applies to artists, engineers, producers, writers, reviewers, podcasters, etc. don't spam the same article or podcast episode more than once a month, and don't spam your band more than once a week. post the whole song, or at least most of it - worry about teasers when you've gotten somewhere. be transparent. engage with the community. and most of all, take criticism well. lastly, please engage in the community in ways other than just posting your own material. 6) adequate sources when posting music, links that require a sign-up to play will be removed. when posting news or information, post the original source, not the shitty virus infected obscure blog that just copied and pasted it. when commenting in discussion and making claims, cite your sources. 7) feedback this is not a safe space. artists should be prepared for honest and critical feedback, whether positive or negative. if you cannot handle criticism, don't post here. however, users are instructed to keep feedback specific and avoid being overly derogatory. 8) reposts no reposting of tracks that have been posted within the last 30 days. no mass-posting of single artists. use the search function to determine if your post meets this criteria. 9) must be rock or acceptable rock subgenres we know it when we hear it. this is an all-inclusive space for most forms of rock. acceptable genres include (but are not limited to) hard rock, classic rock, grunge/post-grunge, punk/post-punk/pop-punk, hardcore/post-hardcore, traditional heavy metal, post-rock, nu-metal, industrial rock/metal, indie rock, folk rock, and some groove metal and metalcore, and some symphonic metal. death metal, black metal, grind/crust, grindcore, deathcore, heavier metalcore, serbian turbofolk etc. are not allowed here. 10) no ""recommendations/suggestions"" posts, no song id posts, and no ""top/best"" lists or discussions. violations will result in a temporary ban; repeat offenders will be permabanned. 11) no ""rock is/isn't dead"",""rock needs to make a comeback!"", or ""is rock making a comeback?"" posts it's a tired subject that gets brought up constantly and doesn't really contribute anything to the sub...other than paving the way for other rule violations, arguments, etc. let it go and find something else worth discussing. 12) no birthday/ anniversary posts - if you want to celebrate one of these, post a track by the artist/s and add the information in the comments - otherwise, your post will be removed. this is the rock subreddit not facebook :-)","rock music. not a sub for polls, top/ best lists, etc. - a sub for the *music*. please read the sub rules!",114540
indie_rock,t5_2tx8o," welcome to the indie rock subreddit! we're all about sharing and discussing new and old music that seems to fly under the radar. artists that aren't necessarily affiliated with independent record labels, but still align with the indie rock genre (like arcade fire and the shins) are also very welcome here. * self promotion is welcome. * news articles, album reviews, and other discussion posts are encouraged. ",a place to share and discover new (and old) music that seems to fly under the radar.,637909
30ROCK,t5_2rgm3,"a subreddit for 30 rock fans. > **guess which subreddit thinks gesturing with one's thumbs is for poor people, is immortal, has two bad knees, is beautiful but doesn't know it, and hasn't cried once today? this one.** a sub-reddit for the fans and critics of the show 30 rock. discussion of the show, pictures from the show and anything else 30 rock related. ""liz lemon, head writer of the sketch comedy show 'tgs with tracy jordan', must deal with an arrogant new boss and a crazy new star, all while trying to run a successful tv show without losing her mind."" **masterlists:** * [30 rock fictional movies, tv shows, etc.]( * [30 rock fictional slogans]( * [30 rock fictional sketches]( **other links:** [here comes the funcooker]( [official 30 rock site]( [watch 30 rock episodes on hulu!]( we're on [twitter]( too. _______ * * * **other shows (and subreddits) you should check out** * [the unbreakable kimmy schmidt](/r/kimmyschmidt ) * [great news](/r/greatnewstv) * [television quotes](/r/televisionquotes)","guess which subreddit thinks gesturing with one's thumbs is for poor people, is immortal, has two bad knees, is beautiful but doesn't know it, and hasn't cried once today? this one. a sub-reddit for the fans and critics of the show 30 rock. discussion of the show, pictures from the show and anything else 30 rock related.",143322
ClassicRock,t5_2r3kh,###[new subreddit! check out /r/vinyl_memes!!](/r/vinyl_memes) --- **please do not post/request illegal download links in this subreddit** ##related subreddits - **/r/boneyard** - **/r/rock** - **/r/country** - **/r/southernrock** - **/r/acousticmusic** - **/r/soundsvintage** - **/r/outlawcountry** - **/r/alternativerock** - **/r/indie_rock** ##by the decade - **/r/50smusic** - **/r/60smusic** - **/r/70smusic** - **/r/80smusic** - **/r/90smusic** - **/r/2000smusic** - **/r/2010smusic** ##more rockin' subreddits - **/r/vinyl_memes** ***new*** - **/r/nowplaying** ***new*** - **/r/70spunk** - **/r/00srock** - **/r/90srock** - **/r/90salternative** - **/r/gethightothis** - **/r/oldschoolmusic** ***new*** - **/r/80salternative**,anything relating to rock up to the late 80s.,94244
RockClimbing,t5_2qk00,this is the smaller rock climbing community on reddit. check /r/climbing for more content. rules: be friendly.,rock climbing,36534
LittleRock,t5_2sj2s,"####welcome to r/littlerock! events, discussions, and items of interest from little rock, arkansas and the greater metropolitan area. ####rules + [1: no racism]( + [2: no homophobia]( + [3: no hate]( + [4: no covid debate] ( + [5: only local content]( + [6: only approved advertising]( ####faq + [essays on lr neighborhoods]( + [central arkansas bar guide]( ####external links + [arkansas times]( + [little rock wikipedia]( + [little rock craigslist]( + [little rock urbanspoon]( ####other arkansas subreddits + [r/arkansas]( + [r/fayetteville]( + [r/hotsprings]( + [r/conwayar]( + [r/ftsmithar]( + [r/dequeen]( + [r/razorbacks]( + [r/arkansasbeer]( + [r/northwestarkansas]( #####","events, discussions, and items of interest from arkansas's capital city and the greater metropolitan area. please be kind and welcoming, we're all neighbors here!",29429
RoundRock,t5_2s6vc,"# rules: we ask that all news related posts are linked to a source and not just a self post. you are encouraged to speak your opinions here as long as you are not putting other users down in the process. no spamming, soliciting, or anything along those lines. please do not report opinions you disagree with, that option is here to take action against those who stray from the rules. use your head. [reddiquette]( is always encouraged, including no personal information is to be publicly shared (within reason of course). ***** *subreddit style not fitting? post not showing up? questions about the sub? [message the mods]( and we'll work to get your issue settled.*","**this subreddit is temporarily private as part of a joint protest to reddit's recent api changes, which breaks third-party apps and moderation tools, effectively forcing users to use the official reddit app.** a place for people living in, visiting, or wanting to discuss round rock, wilco, and texas.",29339
Punk_Rock,t5_2s6h5,# ## created to allow redditors to share and discover punk rock and music of that ilk. ## post and discuss the music that you shout along to. *** [search reddit](/r/punk_rock/search)[submit a post](/r/punk_rock/submit)[message the mods]( ###similar subs |--|--| :-|:- /r/punk|/r/punkskahardcore /r/punkrockin|/r/hardcoremusic /r/poppunkers|/r/punkvinyl /r/ska|/r/posthardcore /r/bookyourband|/r/localpunkmusic /r/weedpunk|/r/music /r/corejerk|/r/poppunkjerk /r/punksubculture|/r/riotgrrrl |/r/touringmusicians|/r/needaband| |/r/70spunk|/r/80spunk| |/r/80spunk|/r/metalcore| |/r/deathcore|/r/pop_punk| |/r/melodichardcore|/r/localpunkmusic| |/r/punkrockgirls|/r/punkmusicians| |/r/underground_punk| /r/punksocial |/r/skatepunk/| # --- ###music news & sites * [absolutepunk.net]( * [punknews.org]( * [punktastic]( * [if you make it]( * [dying scene]( * [bandcamp browser/finder]( * [music map](,,25380
DeepRockGalactic,t5_3iufz,"**rules** 1. hatespeech, racism, etc. is not tolerated 2. don’t use inappropriate language 3. don't encourage or engage in bad behavior 4. no elves allowed 5. no naming and shaming 6. no explicit nsfw text or images 7. art/screenshots may be used/shared in other channels or in-game. if you violate these rules, we reserve the right to take appropriate action, including deleting posts and comments, and muting, banning, and reporting users. **useful links** **[-> report bugs here on pleasefix <-]( **[important! steam dx11/12 selection]( **[new to drg? see this faq!]( **[get deep rock galactic on steam]( **[get deep rock galactic on the microsoft store]( **[deep rock galactic discord]( **[deep rock galactic wiki]( **[karls advanced remote loadout - community made visual tool for sharing builds]( **twitter: [ **[ **tiktok: [deeprockgalactic]( **youtube: [ghost ship games]( **[how to transfer your save between steam and windows store versions]( **[community made resource guide!] (","deep rock galactic is a 1-4 player co-op-first sci-fi fps featuring badass space dwarves, 100% destructible environments, procedurally-generated caves, and endless hordes of alien monsters. now fully released!",322997
RockTumbling,t5_3kztg,"a place to show pictures, before and after, or not. trade ideas. share secrets. just show off your pretty rocks.",a beginners notes and ideas,14867
Charissa_Thompson,t5_3j4q3,,anything and everything relating to her!,4619
LexiThompson,t5_3be93,subreddit for lpga star lexi thompson *** **also check out:** * r/ladieswhogolf * r/blaironeal * r/paigespiranac * r/golf ,subreddit for lpga star lexi thompson,993
MercyThompson,t5_2vsbf,"for fans of the mercy thompson series. a place to discuss the series, characters, magic and laws of the mercy thompson universe. ","for fans of the mercy thompson and alpha and omega series'. a place to discuss the series, characters, magic, and laws of the mercy thompson universe.",971
LiamThompson,t5_27qyc3,this is the official subreddit for liam thompson and his subscribers,this is the official subreddit for liam thompson and his subscribers,607
CraigThompson,t5_peleq,"r/miniladd is the gaming side of craig r/craigthompson is the ""lifestyle"" side of craig",,273
JasmineThompson,t5_31p9m,welcome to /r/jasminethompson where redditors come together to admire her music. feel free to post anything about jas. []( * follow [ in twitter! * subscribe to [tantrumjas]( in youtube! * like [jasmine thompson]( in facebook! * listen to jasmine on [soundcloud](,this subreddit is solely dedicated to everything about jasmine thompson.,137
Tumbler,t5_2sduq,"you're probably looking for /r/tumblr (there's a link to that in the sticky). feel free to post anything here though, but **keep it safe for work**.",,903
USDT_Tumbler_Tether,t5_4pd4zy,,"this subreddit is entirely exclusively focusing on how to gain/keep privacy while holding the crypto currency usdt (tether) coins on the ethereum network (erc20). we will explain what usdt mixers are (also known as tether mixer, usdt tumblers, ...). we will review the main tether mixer on the market, we will explain you the technologies behind their service and also rate their services.",22
WestVirginia,t5_2rfre,"*** ##montani semper liberi *** featuring the best of what the mountain state has to offer: arts, culture, natural beauty, friendly people, and pepperoni rolls. interested in west virginia politics? please visit /r/westvirginiapolitics. *** ## **rules:** * west virginia related posts only. * be civil. we're all friends here. * no combative, hostile, inflammatory, or threatening language. * be considerate of other people's views, thoughts, and perspectives. * political posts will be allowed on a case-by-case basis. all political posts are subject to review and removal. * advertising, self-promotion for monetary gain, or classifieds **must** be limited to the weekly classified thread unless prior moderator approval is given. * **please do not editorialize the title of your submissions.** submission titles should be kept as close as possible to the original article. if you have an opinion about an article, please reserve that for the comments. * additional rules may be listed on the [rules page]( * follow reddit's side-wide rules. we expect you to know and follow proper [reddiquette]( *** ###relevant links: * [/r/westvirginia classifieds (updated weekly)]( * [everything wv travel guide]( * [west virginia tourism official site]( * [west virginia discord server]( *** ###related subreddits: cites/regions: * /r/appalachia * /r/beckleywv * /r/charlestonwv * /r/clarksburgwv * /r/huntingtonwv * /r/martinsburg * /r/morgantownwv * /r/parkersburg * /r/wheelingwv * /r/wveasternpanhandle culture/politics: * /r/westvirginiapolitics * /r/wvhistory colleges/universities: * /r/marshalluniversity * /r/mountaineers * /r/wvu *** *...a few notes about the subreddit rules:* *1) it is the discretion of the moderators of /r/westvirginia to determine what constitutes a violation of the subreddit rules and act accordingly.* *2) the moderators of this subreddit reserve the right to remove or lock the comments of any post that we feel violates these rules.* *3) all moderator actions are open for discussion via [modmail](","featuring the best of what the mountain state has to offer: arts, culture, natural beauty, friendly people, and pepperoni rolls.",118055
NewWest,t5_2xddj,"welcome to /r/newwest! [new westminster]( is a historically important city in the lower mainland region of british columbia, canada, and is a member municipality of the greater vancouver regional district. it was founded as the capital of the colony of british columbia (1858–1866). **related reddits** [r/vancouver]( [r/greatervan]( [r/britishcolumbia]( [r/canada]( **guidelines** * please treat each other with respect and follow [reddiquette]( hate speech, derogatory, inflammatory comments and general rudeness are not welcome. * please don't downvote an otherwise acceptable post because you don't personally like it. if it does not contribute to the discussion, is off-topic or violates the guidelines, downvote it. * please upvote if you think something contributes to conversation. * please do not post spam. * please report comments and posts that violate the guidelines. * please keep your threads related to new westminster. **helpful posts** * [the best & worst of new west vol. 1]( * [the best & worst of new west vol. 2]( * [the best & worst of new west vol. 3]( * [the best & worst of new west vol. 4]( * [the best & worst of new west vol. 5]( * [the best & worst of new west vol. 6]( * [the best & worst of new west vol. 7]( * [the best & worst of new west vol. 8]( * [the best & worst of new west vol. 9]( * [the best & worst of new west vol. 10]( * [the best & worst of new west vol. 11]( * [the best & worst of new west vol. 12]( *thanks to /u/irich for our header photo and /u/unerds for their help with css!* **have a suggestion or concern? message the mods!**"," welcome to /r/newwest! new westminster is a historically important city in the lower mainland region and the former capital of british columbia, canada. it is a member municipality of the greater vancouver regional district. please see below for our best & worst of new west archive, community guidelines, and related subreddits.",14545
KeyWest,t5_2syos,"a space to share your key west experiences. stories, images and videos are welcome.",,10421
WestSubEver,t5_2zppb9,"welcome to **/r/westsubever**, dedicated to news, theories, and discussions about recording artist & designer kanye west and other related artists. ---- **read the [subreddit's rules]( and pinned posts before posting/commenting.** **asking for a download = 3 day ban** search for the ""kanye tracker"" ---- **wse community:** [ on twitter [westserverever]( on discord /r/yedits - kanye edits wse [""alien community cypher""]( on soundcloud",dedicated to discussion of ye and associated artists.,118479
west,t5_2tovw,the west is where its at!,come here to talk about anything westward of the mississippi! have dreams of going out to live in colorado? want to share your catch of the day while fishing? or even just a photo or 2 of how amazing the west really is! feel free to post here! ,147
WackyWest,t5_4xvlkj,,the highest form of parody is the thing itself. this is a left leaning sub dedicated to satirizing and parodying everything to do with the global west... the west is a wacky place!,5883
WestOrlando,t5_3exiy3,the wars in west orlando,the wars in west orlando,2958
HorizonForbiddenWest,t5_2r9zdj,dasdasdasd,now entering cauldron: fw subreddit prime. official subreddit for horizon forbidden west and burning shores dlc your journey begins here… gg / playstation exclusive. ,41233
PeakWest,t5_sv1u0,"a subreddit to satire ethno-nationalism and white supremacist narratives in the western hemisphere. the ""peak western civilization"" meme was made to showcase only the finest specimens from the greatest living accomplishment of mankind: the western civilization. --- **rules:** - [follow reddiquette]( - hide personal information and mark your posts nsfw when necessary. - do not indulge in excessive political madness. - memes and macroimages are encouraged. - no meta drama. - no fake news. --- **css theme:** - [yotsuba blue]( - [photon]( - [dark mode]( - [res night mode](#/res_sr_config/nightmodecompatible) --- **related communities:** - r/indiaspeaks - r/canconfirmiamindian - r/desimeta - r/samaj",a subreddit to satire ethno-nationalism and white supremacist narratives in the western hemisphere. this subreddit is not a house to any political wing and it is recommended to not use it as a space to spread one's agenda.,2680
WeirdWest,t5_5a4h46,,survive and unveil the mysteries of the weird west through the intertwined destinies of its unusual heroes in an immersive sim from the co-creators of dishonored and prey.,2465
