display_name,name,description,public_description,subscribers
FortCollins,t5_2rrmq,"## rules content must abide to [reddit's content policy]( inappropriate content includes doxing, illegal or prohibited transactions, under-age sexual content. sub rules: **one**. be civil: follow [the reddiquette]( no personal attacks, harassing, bullying, threats of violence, even through ""dog whistles"" **two**. no commercial/promotional content: classified-style (craigslist-like, jobs, housing, personal ads, give-aways), transactions, spam (including blog-spam, youtube spam), self-promotion (per [reddit's rules on self-promotion]( (a), advertising, commercial content, fundraising, politicking (b); post such content in /r/fortcollinsclassified **three**. problematic content: mods may at their discretion moderate the following: * not related or pertinent to fort collins and vicinity * crime reports; if you observe a crime, call the police, don't post it here; posts about imminent threats are allowed * allegations that might cause harm to a potentially innocent person * requests for accident details * ~~requests for dispersed campsites, great fishing spots or the like~~ * trolling: posting inflammatory, insincere, digressive, extraneous, or off-topic messages with the intent of provoking readers into displaying emotional responses or manipulating others' perception * rants: posting a submission to complain about someone or something; if warranted, mods may create a megathread and direct the discussion there * ~~cause promotion: (^may ^make ^an ^exception ^for ^regular ^contributors ^to ^this ^sub )~~ * pictures with legible vehicle license plates any content that violates these rules is still welcome in the weekly thread, as long as it doesn't violate the reddit content policy. notes: a) event announcements from a disinterested party are ok b) political discussion is ok ## new to town we are excited to have you, but before making a new post, try searching and reading through past threads to see if your question has already been answered. otherwise, i'm sure our friendly denizens can dispense some helpful advice. ||| |:-------------|:---------| | [fort collins gov]( | [larimer county]( | [covid dash]( | [trails and hiking]( | | [poudre tubing]( | [down town]( | ## local reddits ||| |:--------------|:----------------| | [colorado]( | [front range]( | | [louisville]( | [boulder]( | | [denver]( | [estes park]( | | [greeley]( | [longmont]( | [loveland]( | [cheyenne]( ##colorado life ||| |:------------|:------------| | [co bike]( | [co beer]( | [co snow]( | [co ents]( | | [focomeets]( | [csu]( | ##useful links || |:---------:| |[r/fortcollins discord server]( | | [r/fortcollins facebook group]( | | [fort collins bicycle registry]( | | [fort collins bicycle map]( | | [fort collins street maintenance]( | | [fort collins music subreddit]( |","a subreddit specifically about fort collins, colo. please, no posts that have nothing to do with fort collins. ",48547
FortMyers,t5_2tnir,"fort myers, fl - city of palms >[rules to read before posting]( **sister subreddits:** * **/r/lehighacres ** * /r/swfl * /r/sanibel * /r/fgcu * /r/capecoral * /r/naples_fl * /r/floridaman **local business in fort myers** (events and entertainment) * /r/swfl007 (recreational automotive) * /r/northtrailrv",,21757
FortSaskatchewan,t5_2sqqw,"#welcome this is the unofficial subreddit for the city of fort saskatchewan, alberta, as well as the surrounding region. we encourage content and discussions, such as news, events, and pictures, that are related to fort saskatchewan and the counties and communities around it. #rules 1. please follow proper [reddiquette]( 2. be respectful to others 3. don't spam 4. be descriptive with your titles 5. don't alter news headlines unless they're poor quality 6. don't post personal information 7. submissions must be related to fort saskatchewan and the area around it #community resources * city: [website]( | [wikipedia page]( * fort sask transit: [website]( | [wikipedia page]( * [families first society]( * [food bank]( * [furniture bank]( * [support your fort]( #local communities * [alberta]( * [alberta beer]( * [alberta discord server]( * [alberta gardening]( * [alberta jobs]( * [alberta photography]( * [banff]( * [camping alberta]( * [edmonton]( * [fishing alberta]( * [hiking alberta]( * [hunting alberta]( * [macewan university]( * [nait]( * [sherwood park]( * [university of alberta](","the unofficial subreddit for the city of fort saskatchewan, alberta, and the surrounding region.",8501
FortPorn,t5_2sljq,"a community for posting high-res photos, maps, and diagrams of fortifications. [please be respectful]( message the mod if your submission isn't showing. if you like fortporn, please check out these subreddits: **[earthporn]( **[history]( **[historyporn]( **[medievalporn]( **[zombiefortress]( and a special nod to **[minecraft]( check out our friends at: **[home defense](",,7853
FortBend,t5_2shj0,sugarland missouri city richmond,sub for the residents of the fort bend county in texas,3755
fortSALTA,t5_3oybc9,a community for all kinda of ocean salt found in the world of attack on titan,a community for all kinds of ocean salt found in the world of attack on titan,3321
Fort_Salta,t5_3w7g63,"##[**welcome to fort salta: the final festival!**]( this is a subreddit dedicated to discussing the *attack on titan* series while sharing our personal thoughts, memories and experiences with the series thus far! the aot fandom can be a very polarising and uncomfortable place to be in these days, however we intend on bringing as much of a positive and caring community as possible! ----- **rules** 0) try to keep discussion related to attack on titan! the *mini-festival* threads can be off-topic, but all other posts should be aot-related! 1) do not incite any flame wars, bait or trigger other users here. this is a friendly environment. 2) restrict usage of slurs as much as possible. if a meme has a slur in it, the mods will review it and choose whether or not to approve it on a case-by-case basis. 3) be civil in discussion. 4) leak spoilers must be tagged. leak posts will be scrutinised closely by moderators. 5) nsfw content is restricted. ensure nsfw/nsfl content is tagged. refrain from posting pornography, hentai or excessive gore. ----- ###[**request a mini-festival!**]( when requesting a mini-festival thread, ensure you contact one of the mods beforehand before we allow you to host one on your own. the mini-festivals can be as off-topic as you want, but ensure they are at least somewhat general topic-wise.",thank you for taking part in r/fort_salta! this subreddit is now closed.,1302
FortStJohn,t5_30c3y,check out our friends! /r/britishcolumbia,a place for residents and visitors of fort st. john to come and share stories and get information!,1855
FortWorth,t5_2rsbl,"funky town, panther city, hell's half acre...call it what you will. news, happenings, and discussions related to tarrant county. **relevant reddits** [r/coronavirustx]( cities: * [r/dallas]( * [r/arlington]( * [r/benbrook]( * [r/irving]( * [r/keller]( * [r/mansfieldtx]( * [r/burleson]( colleges: * [/r/utarlington]( * [r/tcu]( * [r/tccstudentsconnect]( interests: * [r/dfwmusic]( * [r/dfwfilmmakers]( * [/r/dfwgaymers]( * [/r/geekdfw]( * [/r/dfwpets]( * [/r/dfwbeer]( * [/r/texaspolitics]( extras: * [reddit fort worth facebook group]( * [reddit mid-cities facebook group] ( * [r/dfwjobs]( * [r/dfwclassifieds]( * [r/dfwmarketplace]( **fort worth events calendars** * [fortlive]( for local shows happening. * [fort worth weekly]( for calendar of events. * [west 7th events]( * [near southside events]( * [the stockyards]( for shows & events. * [sundance square]( events calendar. * [free in fort worth]( for a list of free stuff to see/do. * [live music venues - big & small](","fort worth and the surrounding metroplex area, west of dfw airport. issues of concern, news and current events, outings, questions, and general discussions.",157714
FortNiteBR,t5_3oeyf,"###welcome to /r/fortnitebr fortnite battle royale is a free-to-play battle royale game mode within the fortnite universe. ###subreddit town hall is there a rule or policy on the subreddit that you don't like? is there a rule you wish existed? why do you want that one weekly megathread to return? we want to hear from you! join us in our [subreddit town hall]( where we are discussing what needs to be changed, revised, or implemented. help shape the future of the community! ###supported subreddits you can access the co-op fortnite: save the world subreddit at /r/fortnite. mobile users should visit /r/fortnitemobile. discuss the creative sandbox game mode at /r/fortnitecreative. for competitive fortnite discussion, please visit /r/fortnitecompetitive. ###frequently used links **[chapter 4 - season 3 | launch megathread]( **[extended flair-picker]( **[epic posts]( **[epic comments]( **[daily shop]( **[badge/emoji guidelines]( **[verified creator form]( ###subreddit rules users are expected to behave maturely and respectfully. for a full list of what you can and can't do, please check the [subreddit rules]( ### subreddit features visit [new.reddit.com]( or use the official app for more subreddit features. includes bricks, special membership, and gif replies. ### moderator applications [apply at any time.]( if you don't hear back from us within a month, reapply! ###official links [fortnite official site]( [discord]( [facebook: [instagram: [twitch: [twitter: [youtube: ","the developer supported, community run subreddit dedicated to the fortnite: battle royale game mode by epic games.",2959451
FortCollins,t5_2rrmq,"## rules content must abide to [reddit's content policy]( inappropriate content includes doxing, illegal or prohibited transactions, under-age sexual content. sub rules: **one**. be civil: follow [the reddiquette]( no personal attacks, harassing, bullying, threats of violence, even through ""dog whistles"" **two**. no commercial/promotional content: classified-style (craigslist-like, jobs, housing, personal ads, give-aways), transactions, spam (including blog-spam, youtube spam), self-promotion (per [reddit's rules on self-promotion]( (a), advertising, commercial content, fundraising, politicking (b); post such content in /r/fortcollinsclassified **three**. problematic content: mods may at their discretion moderate the following: * not related or pertinent to fort collins and vicinity * crime reports; if you observe a crime, call the police, don't post it here; posts about imminent threats are allowed * allegations that might cause harm to a potentially innocent person * requests for accident details * ~~requests for dispersed campsites, great fishing spots or the like~~ * trolling: posting inflammatory, insincere, digressive, extraneous, or off-topic messages with the intent of provoking readers into displaying emotional responses or manipulating others' perception * rants: posting a submission to complain about someone or something; if warranted, mods may create a megathread and direct the discussion there * ~~cause promotion: (^may ^make ^an ^exception ^for ^regular ^contributors ^to ^this ^sub )~~ * pictures with legible vehicle license plates any content that violates these rules is still welcome in the weekly thread, as long as it doesn't violate the reddit content policy. notes: a) event announcements from a disinterested party are ok b) political discussion is ok ## new to town we are excited to have you, but before making a new post, try searching and reading through past threads to see if your question has already been answered. otherwise, i'm sure our friendly denizens can dispense some helpful advice. ||| |:-------------|:---------| | [fort collins gov]( | [larimer county]( | [covid dash]( | [trails and hiking]( | | [poudre tubing]( | [down town]( | ## local reddits ||| |:--------------|:----------------| | [colorado]( | [front range]( | | [louisville]( | [boulder]( | | [denver]( | [estes park]( | | [greeley]( | [longmont]( | [loveland]( | [cheyenne]( ##colorado life ||| |:------------|:------------| | [co bike]( | [co beer]( | [co snow]( | [co ents]( | | [focomeets]( | [csu]( | ##useful links || |:---------:| |[r/fortcollins discord server]( | | [r/fortcollins facebook group]( | | [fort collins bicycle registry]( | | [fort collins bicycle map]( | | [fort collins street maintenance]( | | [fort collins music subreddit]( |","a subreddit specifically about fort collins, colo. please, no posts that have nothing to do with fort collins. ",48547
FortMyers,t5_2tnir,"fort myers, fl - city of palms >[rules to read before posting]( **sister subreddits:** * **/r/lehighacres ** * /r/swfl * /r/sanibel * /r/fgcu * /r/capecoral * /r/naples_fl * /r/floridaman **local business in fort myers** (events and entertainment) * /r/swfl007 (recreational automotive) * /r/northtrailrv",,21757
FortSaskatchewan,t5_2sqqw,"#welcome this is the unofficial subreddit for the city of fort saskatchewan, alberta, as well as the surrounding region. we encourage content and discussions, such as news, events, and pictures, that are related to fort saskatchewan and the counties and communities around it. #rules 1. please follow proper [reddiquette]( 2. be respectful to others 3. don't spam 4. be descriptive with your titles 5. don't alter news headlines unless they're poor quality 6. don't post personal information 7. submissions must be related to fort saskatchewan and the area around it #community resources * city: [website]( | [wikipedia page]( * fort sask transit: [website]( | [wikipedia page]( * [families first society]( * [food bank]( * [furniture bank]( * [support your fort]( #local communities * [alberta]( * [alberta beer]( * [alberta discord server]( * [alberta gardening]( * [alberta jobs]( * [alberta photography]( * [banff]( * [camping alberta]( * [edmonton]( * [fishing alberta]( * [hiking alberta]( * [hunting alberta]( * [macewan university]( * [nait]( * [sherwood park]( * [university of alberta](","the unofficial subreddit for the city of fort saskatchewan, alberta, and the surrounding region.",8501
FortPorn,t5_2sljq,"a community for posting high-res photos, maps, and diagrams of fortifications. [please be respectful]( message the mod if your submission isn't showing. if you like fortporn, please check out these subreddits: **[earthporn]( **[history]( **[historyporn]( **[medievalporn]( **[zombiefortress]( and a special nod to **[minecraft]( check out our friends at: **[home defense](",,7853
FortBend,t5_2shj0,sugarland missouri city richmond,sub for the residents of the fort bend county in texas,3755
fortSALTA,t5_3oybc9,a community for all kinda of ocean salt found in the world of attack on titan,a community for all kinds of ocean salt found in the world of attack on titan,3321
FortWalton,t5_2slhs,* fort walton beach subreddit * if you want to advertise an event for your business you have to run it by the mods first. * no vacation spam allowed. * any posts that appear to be nothing but spam will get the poster banned from the fort walton subreddit * please observe [reddiquette]( **also visit** [r/destin]( [r/pensacola]( ,,1217
BrendanFraser,t5_33m3j,"welcome to the official home of the world's zaniest man, brendan fraser. don't forget to join the /r/savebrendan movement and help bring b-frase back to the big screen.",a community dedicated to brendan fraser.,2887
LauraFraser,t5_6o20m6,,"sub dedicated to the amazing actress laura fraser, who has played many great characters such as lydia in bb/bcs, cat mackenzie in lip service, and many more.",203
FraserIRL,t5_2w2wbw,big funny,yet another place to make sure i own my name weeeeeee,39
Gold,t5_2qmqp,all about gold related subreddits /r/silverbugs /r/preciousmetalrefining/ shout out to /r/money_design,,109885
GoldCoast,t5_2shzr,"#**gold coast & hinterland** #[the big list of thing to do on the gold coast & hinterland]( *** **[subreddit rules & info]( rule 1: remember the human rule 2: promotion rule 3: relevance rule 4: bot accounts rule 5: single-focus accounts rule 6: disinformation and politics rule 7: don't break the law we do not allow research data gathering posts on the sub. **tips** * don't forget to check the 'new' tab. * consider commenting or starting a discussion with your post. otherwise we may consider it as spam. * please submit the non-mobile version of articles. * read [reddiquette.]( * vlog spam will be removed outright, unique vids of the gc are allowed. *** **recommended australian subreddits** * r/australia **qld** * r/brisbane * r/queensland * r/cairns * r/sunshinecoast **nsw** * r/bluemountains * r/centralcoastnsw * r/newcastle * r/nsw * r/sydney * r/wollongong **act** * r/canberra **vic** * r/ballarat * r/geelong * r/melbourne **sa** * r/adelaide **wa** * r/perth **nt** * r/darwin **tas** * r/hobart * r/tasmania *** **and where would we be without** * r/ausbeer * r/ausfood * r/ausinviro * r/auslaw * r/auspol * r/afl * r/nrl * r/fishingaustralia * r/triplej","gold coast & hinterland subreddit in queensland, australia.",96091
GoldReplies,t5_37ns8," ##what is a 'gold reply'? a gold reply isn't necessarily any old bundle of sticks' gilded comment. gold means nothing, really. it's just an expensive upvote. the amount of upvotes doesn't matter either, two upvotes will do. but if it's the kind of reply you think you would get karma from linking a list of burn centers after it, or is an askreddit response that gets more karma than the parent, it's probably good. --- ##the funniest subreddits on the site (check them out!): /r/gatekeeping /r/beetlejuicing /r/lol /r/jokes /r/funnyinternet /r/jokesprompt /r/finishthejoke /r/scenesfromahat",the funniest replies on the web.,17950
WeGold,t5_i8gpb,"##a place to discuss travel, crypto, and life. wegold fuels the growth of “travel pathfinders” - people aspiring to earn a living through travel. exploring and connecting the world’s most aspirational travel experiences to our wegogo platform earns wegold tokens! *ever dreamed of an exciting life of travel?* do you prefer experiencing real local culture over the tourist-y spots? *what if you could travel, pay, and earn benefits from a single interface?* ####if you answered yes to any of these, then our community is a fit for you! [please subscribe to this sub]( and share your fun! ------------------------------------------ #important links [**our website**]( [**facebook**]( [**telegram**]( [**linkedin**]( [**medium**]( [**twitter**]( ",wegold empowers the individual to pay and earn from travelling on wegogo platform - a decentralized fair-share travel ecosystem!,8156
GoForGold,t5_2y633,"/r/goforgold is the original place to host and compete in challenges for reddit awards. ***we complementary upvote here.*** --- #[rules]( 1. no begging 2. do not delete posts 3. content must be **[safe]( / legal / **[sfw]( 4. challenges must offer reddit awards and deliver within 48 hours of completion 5. no restricted content see our **[rules page]( for details. --- #additional info [*it's better to award comments rather than posts in this subreddit.*]( **when making a challenge, word it carefully:** properly wording your challenge will protect you from being forced to give an award due to a technicality. **any content may be removed at the moderators' discretion:** common reasons for removal include ill-natured comments, doxxing, unfair challenges/awards, self-promotion, or if we feel the user issuing the challenge doesn't intend on following through. **ban appeals: [click here]( **for everything else, please visit our** - [**wiki**]( - [**faq**]( --- # [megathread]( to reduce spam we are currently limiting the following types of posts to the **[weekly megathread]( - challenge requests (e.g. i will eat a hot pepper for gold) - meta discussion (e.g. i'm tired of seeing this challenge) --- #[hall of fame]( we keep a record of you rockstars that go out of your way to keep this community as awesome as it has ever been. to see them, check out our [hall of fame]( --- #[user flair]( in /r/goforgold users can earn a *user flair* for themselves or to gift to others by making a challenge that generates at least 500 *community coins* (cc). any post that generates greater than 500cc makes op eligible to earn a user flair and get added to our [***hall of fame***]( the specific flair earned corresponds to the amount of community coins generated: - **500cc:** op earns an emoji from the [**500cc table**]( or an image-based unicode character. - **1000cc:** op earns an emoji from the [**1000cc table**]( and flair text of their choice. - **1800cc:** op earns a custom & unique emoji and flair text of their choice. [see our user flair guide for full details.]( --- #discord feel free to join our **official /r/goforgold discord**. you can get push notifications of new challenges there, straight to your phone! []( --- #want to be a helper? fill out our *helper application form!* --- #sister subreddits - /r/goforgoldafterdark - /r/gophergold (2019 april fools) - /r/goforgolf (2020 april fools) - /r/goforold (2021 april fools) --- #[the egg]( hidden throughout /r/goforgold there are easter eggs. there is always at least one hidden at a time, normally more. **egg finders get the following rewards:** - you get temporary custody of the animated [*golden egg*]( user flair until the next egg is found. - you'll earn yourself a mod award that can range in value from a *mod platinum* (goldinum) to a *mod ternion* (modobtainium)... or maybe even more. - you will be entered into the [*hall of egg*]( see [***the egg wiki***]( for more details! --- #filter by flair [mod announcement](/r/goforgold/search?sort=new&restrict_sr=on&q=flair%3a%2bmod%2bannouncement) [platinum challenge](/r/goforgold/search?sort=new&restrict_sr=on&q=flair%3aplatinum%2bchallenge) [gold challenge](/r/goforgold/search?sort=new&restrict_sr=on&q=flair%3agold%2bchallenge) [coin challenge](/r/goforgold/search?sort=new&restrict_sr=on&q=flair%3acoin%2bchallenge) [community award challenge](/r/goforgold/search?sort=new&restrict_sr=on&q=flair%3acommunity%2baward%2bchallenge) [vanity award challenge](/r/goforgold/search?sort=new&restrict_sr=on&q=flair%3avanity%2baward%2bchallenge) [all incomplete challenges](",the original place to host and compete in challenges for goforgold bux. check out our discord: ,58666
FindingFennsGold,t5_2xpsj,"*as i have gone alone in there* *and with my treasures bold,* *i can keep my secret where,* *and hint of riches new and old.* *begin it where warm waters halt* *and take it in the canyon down,* *not far, but too far to walk.* *put in below the home of brown.* *from there it’s no place for the meek,* *the end is ever drawing nigh;* *there’ll be no paddle up your creek,* *just heavy loads and water high.* *if you’ve been wise and found the blaze,* *look quickly down, your quest to cease,* *but tarry scant with marvel gaze,* *just take the chest and go in peace.* *so why is it that i must go* *and leave my trove for all to seek?* *the answers i already know,* *i’ve done it tired, and now i’m weak.* *so hear me all and listen good,* *your effort will be worth the cold.* *if you are brave and in the wood* *i give you title to the gold.* --- this is the riddle left by forrest fenn, who has challenged people to go out and [find his hidden treasure]( by solving the riddle in poem. additional clues have been released: - the treasure is hidden above 5,000 feet sea level. - the treasure is not hidden in a graveyard. - the treasure is not hidden in idaho or utah - no need to dig up the old outhouses, the treasure is not associated with any structure. this subreddit started in june 2013 when a [youshouldknow thread]( posted about the treasure lead one colorado native to attempt a solution and locate the treasure in the mountains southwest of denver. now, it is devoted to all who seek to find fenn's gold. --- **there are now two ways to chat online about the fenn treasure:** [click here]( to join the official finding fenn's gold reddit chat [click here]( to join us on discord! --- **rules of finding fenns gold** 1.) no taking unnecessary/life threatening risks. the treasure was concealed by an 80-year old man; it will not be at the bottom of a mine shaft or at the end of an catacomb of caves. 2.) be respectful of all who attempt to solve the puzzle. we understand that people disagree, but cruel language or disrespect will not be tolerated. 3.) always come properly prepared, and with a friend. 4.) if you are going on a treasure hunt, make sure to let a close family member or friend know when you are leaving, precisely where you are hiking, and when you plan to be back. do not simply leave that information here on reddit. if you get lost, your family or friends are most likely to call for help if you do not return on-time; reddit will not be much help. 5.) links to personal blogs or websites containing revenue-generating advertising or products for sale, even if these exist on pages other than the one linked to, will be considered spam and removed. 6.) no ""i found it posts"". pics, or it didn't happen. 7.) your post must be directly related to the search for indulgence. if a post does not directly relate to the treasure, forrest fenn, or specific information about the rockies and the search area (trip advice, maps, land ownership, etc.) it will be removed. if you post something that doesn't at first glance appear to be related, then you must include a comment with your post explaining yourself. if you're unsure whether your post meets this rule, then please message the moderators and we can help you decide. --- if you're interested in reading forrest fenn's book, *the thrill of the chase*, you can pick up a copy [at the collected works bookstore](",a subreddit devoted to finding the hidden treasure of forrest fenn - discord link- ,20242
