display_name,name,description,public_description,subscribers
Blue,t5_2qk1w,"welcome to the [color spectrum network expanded (csne)]( the official subreddit for the shades of blue. all quality blue content is accepted here. blue, like all other colors, can be appreciated in its own unique ways. r/blue - *your daily dose of blue!* --- #####rules ([see more](/r/colorspectrumnetwork/wiki/networkrules)): 1. **only post the appropriate content of the networked color you are participating in.** help us reduce spam and bring better content! 2. **credit the artist in the submission title where applicable.** we want the creators to get some vision! 3. **comment with at least one source or artist website link.** we want to drive some traffic to the creators! 4. **use the search function before you post.** if you repost something that was posted to this subreddit less than three months ago, or is currently in the top 100 list, it will be removed. --- want a user flair to join in the fun? [click here!]( --- #####related subreddits ([see more](/r/colorspectrumnetwork/wiki/networksublist)): --- > * [colorspectrum](/u/shylo132/m/colorspectrum/#cs) * r/blue * r/red * r/white * r/silverandgold * r/blueorange > * [csfriends](/u/shylo132/m/colorspectrumfriends/#csf) * r/orange * r/tealblue * r/yellow * r/colorblack * r/colorgreen * r/colorpink * r/colorpurple",the official subreddit for the shades of blue.,12672
AlienBlue,t5_2rt3a,"### [before asking any questions please take a look in the help center!]( welcome to the official alienblue subreddit! * **for a bunch of helpful videos on how to use alien blue, head on over to /r/alienblue101** **please take a look [in the help center]( for the answer to your question before posting. thanks!** links to specific sections of the [our wiki]( [**iphone user guide**]( [**ipad user guide**]( **[check out some fellow users' favorite ""hidden"" features in alienblue!]( to view a subreddit's sidebar while in alienblue, simply click the [arrow to the right of the subreddit's name like so.]( __________ **rules and guidelines** __________ some answers to this subreddit's frequently asked questions (posts that are just re-asking these questions will be removed, and a link to the relevant post provided as a comment). some of this information is a little dated but still basically rings true: * [what's the status on the mac app?]( * [why isn't there an alien blue app for android?]( * [can you add a nsfw random button?]( 1. no memes/rage comics (other image posts/screenshots are fine) 2. no complimentary posts, or posts that lack any other content/issue/discussion 3. posts not pertaining to the topic of alien blue will be removed. please post to /r/redditmobile for questions on other official reddit apps or future reddit apps. ",the official subreddit for the alien blue ios reddit client!,179993
BlueLock,t5_mm79h," --- #about --- yoichi isagi lost the opportunity to go to the national high school championships because he passed to his teammate who missed instead of shooting himself. isagi is one of 300 u-18 strikers chosen by jinpachi ego, a man who was hired by the japan football association after the 2018 fifa world cup, to guide japan to winning the world cup by destroying japanese football. ego's plan is to isolate the 300 strikers into a prison-like institution called ""blue lock"", in order to create the world's biggest ""egotist""/striker, which has been lacking in japanese football. --- ##rules --- ###**be nice** * don't insult/ harass other users. treat them with the same respect you expect to receive. ######**no drama** * this sub is not a breeding ground for pushing your emotional/ political agenda. keep content relevant to the series, and refrain from toxicity. * any issue you have towards other users should be dealt with through the **report button**. similarly, all moderator feedback should be given through **modmail**. do not make a scene. ######**flair posts** * posts must have flairs relevant to the content they provide. ######**source fan-art** * make sure to include the source for any artwork that is not oc. ######**tag spoilers** * this subreddit supports **spoiler tags**! make them by doing the following: * \[spoilers](#s ""put your text here"") * [spoilers](#s ""put your text here"") --- #information --- * [wikia](",(welcome to r/bluelock) a subreddit dedicated to the blue lock ~ブルーロック~ series written by muneyuki kaneshiro and illustrated by yusuke nomura. check our sidebar for more information and read our rules before participating. desktop banner by: u/brandonxf,116517
BlueArchive,t5_2vhvtt,"## blue archive --- blue archive is an rpg mobile title by nat games and published by nexon kr (global) and yostar (jp). the player will be a teacher that leads their students into various incidents around the city. ## official links --- - (jp) [official site]( [twitter]( [youtube]( - (en) [official site]( [twitter]( [youtube]( - (cn) [official site]( ##subreddit links/resources --- [community discord server]( - [database site]( - [blue archive wiki]( ##megathreads --- please use the following megathreads! - [daily questions]( - [club recruitment]( - [kivotos lounge]( - [technical issue]( - [text mistranslations and errors]( ##**rules** --- **1. be respectful** - do not harass each other or use hate speech. each person is entitled to their own opinion but it should not escalate to insults and/or personal attacks. **2. flair your posts** - use the post flairs to keep the subreddit organized. if you want to request a flair, ask the mods in the official r/bluearchive discord server. **3. all content must be related to blue archive** - this subreddit is dedicated to blue archive related content, posts and discussions. if your post is deemed irrelevant, it will be removed. **4. no reposts** - do not repost content. only non-oc art and discussion posts must be older than 12 months in order to be reposted. - oc art, memes, in-game news + content and merch announcements are not allowed to be reposted at all. **5. no explicit or sexual content** - explicit content is not allowed. content that directly references or directly implies sexual acts is also not allowed. remember to tag nsfw for content that is deemed not safe for work (e.g. swimsuits and/or other revealing clothing). consistent failure to do so will lead to removals/bans. [post reference]( **6. art posts** - all art post must include character names in the title. if there are more than 3, list the prominent students. min 1. - there is a zero tolerance policy for unsourced art. ban for repeated offenders. op must always provide original source (no aggregate sites, e.g. boorus). this also applies to memes using art. - 24hr rules applies only to non-oc art post and must include artist name in the title. oc art are exempted from this rule. - oc art is given priority over non-oc art. - ai art is not allowed. **7. no commercial promotion/commission** - promoting paid products and/or services which involve virtual or real-life monetary transactions is not allowed. in any case, it is best to consult with the moderators before any of these types of posts. - non-commercial promotion/requests are only allowed if they are related to blue archive and samples of your work are included (e.g. a video). - you are allowed to share your fanbox, patreon, or merch content for an upcoming convention. **8. spoilers should be tagged** - unedited screenshots of story content and spoilers in the title are not allowed. posts discussing or involving spoilers should be tagged as such. spoilers in comments should also be tagged as such as follows: `>!spoiler text goes here!<` **9. self promotion and content creator control posting** - only 1 self-promotion post related to blue archive per week. - you are only allowed to post 1 video per 24 hours, 3 days if a livestream video. - your video and post title must not be click-bait. a definite statement or clear topic as a title is highly recommended. - [detailed rule description]( **10. no account selling/buying/trading/giveaways** - attempting to buy, sell, trade, or give away accounts is not allowed. **11. use dedicated megathreads** - to prevent clutter, posts should be directed to their appropriate megathreads. **12. posting quality assurance (no extremely low effort content)** - posts must meet the minimum criteria as outlined [here]( final judgement is reserved for moderators, but the guidelines are there to help visualize what is considered ""low effort"".","blue archive is a rpg mobile title developed by nat games, published by nexon kr (global) and yostar (japan). the player will be a teacher that leads their students into various incidents around the city.",85443
VoteBlue,t5_3g6n1,"**vote blue is a subreddit dedicated to promoting and helping elect down-ballot democrats all across the united states of america!** --- ###rules 1. be the best person you can be. 2. all content must be relevant to down-ballot races. 3. this is a democratic subreddit for activism. 4. no trolling. 5. submissions must be current (less than 30 days old) and properly titled. 6. source your claims. 7. no hate speech. 8. ask mods before self-promotion. 9. no posting/sharing direct download links. 10. no meta posts or participation in meta posts. 11. no cross-posting from other subreddits. 12. **do not discourage voting** [read detailed rule descriptions]( --- #tuesday, january 5th 2021 #georgia senate election runoff voting day --- ###important links **volunteer** * [flippable]( * [sister district]( * [indivisible]( * [mobilizeamerica]( * [swingleft]( * [tech for campaigns]( * [emily's list]( **donate** * [swingleft's blueprint]( **voting information** * [register to vote]( * [vote from abroad]( * [map the vote]( * [ballotpedia]( * [votewithme]( * [vote411]( * [iwillvote]( **jobs and campaigning** * [democratic gain]( * [run for something]( * [jobsthatareleft]( * [guide for running]( * [re:power]( **democratic party** * [dlcc (state leg.)]( * [ndrc (redistricting)]( * [dccc (us house)]( * [dscc (us senate)]( * [dga (governors)]( * [dnc main site]( [register now]( [volunteer now]( [donate now](",,59913
BlueStacks,t5_2utvq,"welcome to the official subreddit of **bluestacks**. bluestacks app player lets you run mobile apps fast and fullscreen on windows. join people in more than 100 countries who are using bluestacks to run the most popular android apps bigger than ever before. download for free today at **[bluestacks.com]( members of the bluestacks team view the subreddit for tips, suggestions and of course, to answer your questions as best as possible. ---- please visit our official **[support]( page to see if your question's been answered and submit others before you choose to ask it here.",welcome to the official subreddit of bluestacks. bluestacks app player lets you run mobile apps fast and fullscreen on windows. download for free today at bluestacks.com.,53139
RedvsBlue,t5_2rofm,"#####[how to know if there's going to be another season.]( all episodes of red vs blue are on [roosterteeth.com]( how to mark spoilers: \[put spoiler here](/spoiler) [put spoiler here](/spoiler) #rules 1. all posts must be related to rvb, or at least mildly related to rvb. 2. be respectful. being extremely rude, racist, homophobic will not be tolerated. if this rule is broken, you will be banned. 3. please tag all spoilers! the mods cannot stress this enough! 4. respect reddit rules & reddiquette. 5. encourage discussion about episodes and theories. 6. there are stupid mean people, stupid annoying people, and stupid stupid people. don't be any of those. airing season rule: any discussion of the latest two episodes of an airing season belong in the stickied discussion threads. #### seasons * [season 1]( * [season 2]( * [season 3]( * [season 4]( * [out of mind: mini series]( * [season 5]( * [recovery one: mini series]( * [season 6: reconstruction]( * [relocated: mini series]( * [season 7: recreation]( * [season 8: revelation]( * [season 9]( * [season 10]( * [season 11]( * [season 12]( * [season 13]( * [season 14]( * [season 15]( * [season 16]( * [season 17]( ##related links [our discord]( - join the blood gulch discord server! /r/roosterteeth - the subreddit for all things rt. [the shizno]( the official unofficial fan-run red vs. blue podcast! /r/rwby - a kickass animated web series made by monty oum. /r/redvsbluememes - a place for all your rvb meme needs. /r/shisnopost - rvb memes but more random. ### link filters * [question]( * [discussion]( * [image]( * [video]( * [season 18]( * [roosterteeth](","the subreddit for the popular web-series, red vs. blue.",49222
BlueJackets,t5_2sl3f,###[ blue_book *new fan? learn more about the team and subreddit here!*]( ###[ balance_scale *r/bluejackets state of the subreddit rules and policies*]( #twitter accounts * [official cbj twitter]( * [official cbj pr]( * [aaron portzline]( * [bob mcelligott]( * [jody shelley]( * [jeff rimer]( * [cbj prospects]( * [dave maetzold]( * [mark scheig]( * [brian hedger]( * [jackets insider jeff svoboda]( #blogs & news * [cleveland monsters subreddit]( * [columbus dispatch cbj blog]( * [the cannon]( * [fox sports ohio]( * [union and blue]( * [last word on hockey]( * [1st ohio battery]( * [cbj discord channel]( #amas * [mark scheig (the hockey writers)](,,46679
GrandBlue,t5_3gbft,"#read the rules before posting. check out the sidebar and the [faq]( [](#chisav2)[](#chisa) [](#sidebarv2) [subreddit discord link]( *** *if your account is less than one day old then your posts/comments will be auto removed.* *** *hover to read:* >###rules >> 1. everything posted here must be grand blue related. * no spoilers in titles for either anime or manga. * flair posts appropriately. if you're on mobile put [ms] in the title of your post to flair it as manga spoilers automatically. * use the spoiler button in addition to the manga spoilers flair for manga-related posts, as flairs may not show up on mobile for some users. * use spoiler tags according to how the post is flaired. * use spoiler tags for non grand blue spoilers. * self-posts are mandatory for posting chapter threads and raw spoiler discussions. * unreleased/raw chapter spoiler discussions and comments must go in the stickied spoiler threads, regardless of whether spoiler tags are used or not, otherwise they will be removed and dealt with strictly. * don't post links to plain (or slightly edited) panels, pages, screenshots, gifs or scenes from the manga & anime unless they are submitted as a self-post (text post) and provide some sort of discussion. * do not link to illegal content if legal (free or not) content is available. * when posting official art or fan art, please link to the original source. use [saucenao]( [google]( [yandex]( to find source. * titles should be appropriate and descriptive. * nsfw content allowed but no hentai. * mods reserve the right to remove posts if necessary. * avoid making separate posts about the latest chapter or episode for 48 hours after the release. (fanart excluded) * do not use link shortening services. * no image macros, reaction images, ""fixed"" posts or rage comics. * **do not post links to discord or any other servers**. *** >###spoiler tags >>this subreddit supports spoiler tags! make them by doing the following: >>`[spoilers](#s ""spoiler text goes here"")` >>and the result will be [spoilers](#s ""spoiler text goes here"") >>keep the "" "" as it's part of the code. copy-paste it rather than typing it, as the quotes on your device may not be the same as the ones needed for the code. >>or you can use official reddit spoiler tags, by doing the following: `>!spoilers go here!<` and the result will be >!spoilers go here!< *** >###recommended sources >>**read online** [mangadex]( [crunchyroll]( (requires premium subscription) >>**buy physical copies** [kodansha listing all the vendors] ( >>**buy digital copies** [kodansha comics]( (volumes) [comixology]( (single chapters) *** >###useful links >>**general information:** >> [manga]( >> [anime]( >>**creators' twitter:** manga author: [inoue kenji]( manga artist: [yoshioka kimitake]( >>**official anime twitter:** [grand blue anime]( >>**official anime website:** ***","welcome to r/grandblue. subreddit for anything related to the manga grand blue. grand blue is a manga (japanese comics) series written by kenji inoue, and illustrated by kimitake yoshioka.",33745
boston,t5_2qh3r,"welcome to r/boston, a reddit focused on the city of boston, ma and the greater boston area. ######[](#h6-red) # please note low-effort posts will be locked and removed and that doxxing, excessive trolling, witch hunting, brigading, shitstirring, user impersonation and abuse of the report button **will not be tolerated under any circumstances**. **be civil, don't spam, and follow the rules.** ********* ######[main wiki page]( ######[rules]( ######[things to see & do]( ######[guide to moving to boston]( ######[where is my post?]( ######[discord channel]( ######[related subreddits]( ######[rules for journalists]( ###**quick reference faq:** ### moving to the boston area? * check out the [moving to boston wiki]( for residency resources and user tips. the city of boston website also has a lot of [getting-settled resources]( * looking for a local job? want to share an opening? see /r/bostonjobs * have renting/owning questions, or just seeking roommate(s)? see /r/bostontenants and /r/bostonhousing/ * looking to buy or sell or give away something? see /r/bostonforsale ### visiting boston, or seeking locally-sourced tips? we get a *lot* of posts asking about visiting and making the most of the city! we ask that you do some research before posting. * for tourism basics, try the [official city of boston visitor's guide]( * for fun bar, restaurant, and activity suggestions, check out [the /r/boston wiki travel page]( and [the wikivoyage boston page]( * [watch out for scammers]( that flock to tourist locations!]( * [find and share local events with the boston calendar]( * still curious? try [the reddit search features]( or [an advanced google search]( such as ""[keyword] site:reddit.com/r/boston"". if no recent results for the same kind of inquiry exist, feel free to start a discussion! *********",a community for the city of boston and surrounding area,590753
BostonBruins,t5_2rmt9,"#welcome to /r/bostonbruins, home of the 6-time stanley cup champion boston bruins! # [come join our discord server for live game chats!]( # please familiarize yourself with our [subreddit rules]( and [code of coduct and submission guidelines]( before participating in our community.** ###schedule |date|away|home|time/result| |:--:|:--:|:--:|:--:| all times in edt ###standings last updated: 01 jul 2023 at 04:00am |team|gp|w|l|otl|points| |:--:|:--:|:--:|:--:|:--:|:--:| |bos|82|65|12|5|135| |tor|82|50|21|11|111| |tbl|82|46|30|6|98| |fla|82|42|32|8|92| |buf|82|42|33|7|91| |ott|82|39|35|8|86| |det|82|35|37|10|80| |mtl|82|31|45|6|68|",ha-ha! time for bruins!,84777
BostonTerrier,t5_2slfg,"**[midwest boston terrier rescue]( kent city, mi **[boston buddies]( huntington beach, ca **[midamerica boston terrier rescue]( serving the states of nebraska, colorado, iowa, kansas, missouri, north/south dakota, wyoming, minnesota, utah, montana, idaho, and arkansas **[boston terrier rescue of east tennessee]( east tennessee **[nebtr- northeast boston terrier rescue]( new york, ny **[btrnc - boston terrier rescue of north carolina]( serving north carolina and assisting in south carolina, georgia and virginia **[arizona boston terrier rescue]( scottsdale, az **[boston terrier rescue team of the carolinas]( serving nc, sc, va, and ga **[boston terrier rescue of florida]( serving fl, ga, and tn **[the boston terrier rescue canada]( serving canada (yes, all of canada...they are nation-wide!) ****** * this subreddit is for those addicted to the smelly, snorty, yet charming boston terrier breed. * please share your stories, pictures, or questions about boston terriers. * also, we are more than happy to help out boston terriers in need so please feel free to post them here. please check out [/r/dogs]( for information on all breeds. if you're looking for information about a new puppy please go to [/r/puppy101]( although bostons are not true terriers, please check out /r/terrier. they need some love too!","all about the american gentleman. r/bostonterrier is a place to share photos, ask questions, and learn about these fantastic dogs.",53653
BostonU,t5_2s4to,"submit posts here to share what matters to the boston university community. keep up to date on events and groups on campus, off campus... above campus? **rules:** **1. no ""chance me""-type admission posts** - try /r/chanceme. all other inquiries about bu, academics, and student life are welcome. **2. no surveys.** try /r/samplesize instead. **3. no spam.** if it isn't relevant to bu, it doesn't belong here. **4. promoting sales:** only items such as school supplies, dorm supplies, textbooks, and secondhand items may be listed for sale. for all other items, feel free to purchase ads through reddit directly. **4. avoid posting screenshots of your schedule.** specific questions about classes/professors are encouraged instead. **5. keep it civil.** insulting others or violating reddit site-wide rules is grounds for a ban. **related links:** [flair]( **useful threads:** [prospective and incoming students q&a]( [bu life hacks]( [your best bu stories]( [how to get a job at bu]( ##### [**class of 2024 newly admitted students megathread**]( | [**new graduate and transfer student megathread**](",greetings from beantown! this is the official unofficial subreddit for the boston university community.,22206
BostonDynamics,t5_2zkbv,"#[official website]( #r/bostondynamics rules --- ####1. the golden rule > treat others as you would like to be treated - we all deserve respect, kindness, and consideration. ####2. posting of the usage of boston dynamics products > do not post any submission regarding the usage of any boston dynamics product that goes against boston dynamics' terms and conditions of sale. if you are utilizing any of boston dynamics' products, you must be using it in compliance with the law and not be using it to promote violence, harm, intimidation, or any dangerous acts. as this is a fan-run community, we ask that **we all** not promote such actions. any user found doing such actions, as listed above, will be banned. ####3. community behavior > it is expected that all users follow reddit's general rules and tos. be respectful, civil, and constructive at all times. do not result to personal attacks. ####4. irrelevant content > content that does not contain any relevance to this subreddit is not permitted. please refrain from posting multiple submissions from past events and stick to current events. ####5. impersonation is not allowed > any user found guilty of impersonating any party that they do not legitimately represent will be punished. if you represent a company/organization affiliated with boston dynamics and would like to promote something, send us a modmail message first. ####6. titles should be relevant to the post > please make sure your title's post is relevant to what your post is about. it's okay to make your title funny, but it must fit this sub. ####7. limit memes and low-effort submissions > as the focus of this community is more on boston dynamics progress and overall work, **please limit** the amount of memes, low-effort, or nonsensical posts in this community. if you do not tag it with the appropriate ""satire"" post flair, **your post will be subject to removal.** ####8. no advertising or self-promo > you can post about your recent artwork or fan edits, however you cannot conduct, facilitate, or hint at trying to sell a product to others on this subreddit. this subreddit is not the place to self promote your etsy or other media (petitions, surveys, etc.). if you have something to advertise that is of some notability, please send us a modmail to be reviewed if it will be approved or not. **update to subreddit stylesheet - 19 february 2021**","a community for the robotics company, boston dynamics!",12331
