author,author_flair_text,created_utc,distiguished,edited,id,is_original_content,is_self,name,num_comments,over_18,permalink,score,selftext,subreddit,title,upvote_ratio,url
Hyperhormoan,,1684368720,,False,13kit96,False,False,t3_13kit96,1,False,/r/MissionBC/comments/13kit96/davis_lake_fire_must_be_out/,14,Good job guys!!,MissionBC,Davis lake fire must be out,0.99,https://i.redd.it/zsam1wdzwi0b1.jpg
HiramTheBuilder,,1588192754,,False,gah7eu,False,False,t3_gah7eu,5,False,/r/MissionBC/comments/gah7eu/warcraft_games_fire_on_1st_ave_apr_13_2020/,14,,MissionBC,"Warcraft Games Fire on 1st Ave Apr. 13, 2020",1.0,https://v.redd.it/tmxux0auitv41
-as_you-wish-,,1565830900,,False,cqiuuo,False,True,t3_cqiuuo,3,False,/r/MissionBC/comments/cqiuuo/hey_does_anyone_have_any_info_on_the_canadian/,5,"All the news articles are very vague, but my Mum told me that someone tried shoplifting and she he got caught, he set a clothing rack on fire. Did she make it up?",MissionBC,"Hey, does anyone have any info on the Canadian Tire arsonist?",0.86,https://www.reddit.com/r/MissionBC/comments/cqiuuo/hey_does_anyone_have_any_info_on_the_canadian/
TrueNorthGreen,,1539540996,,False,9o4yn5,False,False,t3_9o4yn5,0,False,/r/MissionBC/comments/9o4yn5/video_fire_destroys_historic_silverhill_hall/,5,,MissionBC,VIDEO: Fire destroys historic Silverhill Hall - Community mourns loss of 99-year-old building,1.0,https://www.missioncityrecord.com/news/fire-destroys-historic-silverhill-hall/
ADirty_Microwave,,1498060049,,False,6imnrz,False,False,t3_6imnrz,0,False,/r/MissionBC/comments/6imnrz/mission_invades_abbotsford_for_a_free_metal_show/,3,,MissionBC,"Mission invades Abbotsford for a FREE Metal Show @ Gators Pub! Giants Arise (Mission), Slaughterhauser (Mission), Raised by Cain (Mission), Order of Entropy (Abby) and touring from Alberta; Life Like Fire! Friday, June 30th.",1.0,https://imgur.com/QLbTA4p
mybloodismaplesyrup,,1688681651,,False,14snnn4,False,True,t3_14snnn4,10,False,/r/MissionBC/comments/14snnn4/animatronic_vegetables/,3,"Hey there. I grew up in Mission BC during the late 90's and my mom used to always take my sister and I to Save on Foods (I am 99% sure it was save on foods) it used to be right beside where the silvercity cinema is now (where staples is currently).

I recall it had a huge metal pot out front which was a waterfall with a pool beneath that people threw coins into. There was also a big knife and fork as well.

Anyway, I also remember inside there was a bunch of animatronic vegetables, animals, and even a cloud that used a smoke machine to blow at you. You could activate them by swiping your membership card.

I have such fond memories of that and I was wondering if anyone else remembers or maybe has photos of them? Idk just a weird nostalgia thing but I started thinking about them out of the blue the other day.",MissionBC,Animatronic Vegetables,0.81,https://www.reddit.com/r/MissionBC/comments/14snnn4/animatronic_vegetables/
brookiewoodman,,1657500063,,False,vw5j9q,False,True,t3_vw5j9q,4,False,/r/MissionBC/comments/vw5j9q/new_to_mission/,8,"hi i just moved to mission and want to make friends. my name is brooke and  i’m 19 years old. i love hikes, cars, greys anatomy, going to the gym, smoke weed all the time and honestly a good listener. drop your instas or snaps :) (remove if not allowed)",MissionBC,new to mission,0.9,https://www.reddit.com/r/MissionBC/comments/vw5j9q/new_to_mission/
kingcobra0411,,1680646144,,False,12byg9a,False,True,t3_12byg9a,9,False,/r/MissionBC/comments/12byg9a/is_there_a_place_near_mission_to_have_a_small/,4,I love campfires and always wanted to have a campfire everyday. Is there any place around Mission where I can drive around have that? If it is accessible 24x7 that would be super great too.,MissionBC,Is there a place near Mission to have a small wood campfire?,1.0,https://www.reddit.com/r/MissionBC/comments/12byg9a/is_there_a_place_near_mission_to_have_a_small/
