author,author_flair_text,created_utc,distiguished,edited,id,is_original_content,is_self,name,num_comments,over_18,permalink,score,selftext,subreddit,title,upvote_ratio,url
daveinpg,,1693879645,,False,16abakb,False,True,t3_16abakb,6,False,/r/chilliwack/comments/16abakb/church_fire_in_chilliwack/,7,"Holy smokes.  I hope no one was seriously injured!

 [https://fraservalleytoday.ca/2023/09/04/fire-breaks-out-at-chilliwack-church-monday/](https://fraservalleytoday.ca/2023/09/04/fire-breaks-out-at-chilliwack-church-monday/)",chilliwack,Church fire in Chilliwack,0.82,https://www.reddit.com/r/chilliwack/comments/16abakb/church_fire_in_chilliwack/
sizzlinsizzler,,1693285695,,False,16494he,False,True,t3_16494he,7,False,/r/chilliwack/comments/16494he/backyard_fire_pit/,0,"I know there is a fire ban right now but in the fall or spring are you allowed to have one of those backyard firepits you see at Walmart in your backyard?

I looked up the bylaws but I found them confusing.",chilliwack,Backyard fire pit?,0.5,https://www.reddit.com/r/chilliwack/comments/16494he/backyard_fire_pit/
tharizzla,,1692824066,,False,15zgdcn,False,True,t3_15zgdcn,1,False,/r/chilliwack/comments/15zgdcn/cultus_lake_waterslide_tickets/,0,"We have to cancel our trip to the cultus lake waterslides tomorrow due to some schedule changes that came up with the fires in the Okanagan. I want to sell my tickets and realize they say non-transferrable , but from what i recall they don't check the names on the tickets? Do they? Anyone have experience with this?",chilliwack,Cultus Lake Waterslide Tickets,0.5,https://www.reddit.com/r/chilliwack/comments/15zgdcn/cultus_lake_waterslide_tickets/
smavinagain,,1690248797,,False,158trmp,False,True,t3_158trmp,2,False,/r/chilliwack/comments/158trmp/fire_or_clouds_on_mount_thom/,1,"It looks like there's smoke up near lindeman street on mount thom, as well as a minor smell of fire. Anyone there able to corroborate this?",chilliwack,Fire or clouds on Mount Thom?,0.6,https://www.reddit.com/r/chilliwack/comments/158trmp/fire_or_clouds_on_mount_thom/
Redvanlaw,,1689899107,,False,15588me,False,True,t3_15588me,22,False,/r/chilliwack/comments/15588me/fire_along_the_river/,17,"Looks and sounds like something going along by the river. Up chilliwack river road perhaps. Try stay clear of that area and let crews do their shit. Also, dont be fucking around in this heat. Especially with fire, cigarettes etc.",chilliwack,Fire along the river?,0.95,https://www.reddit.com/r/chilliwack/comments/15588me/fire_along_the_river/
Dry_Foot587,,1688975272,,False,14vn9j0,False,True,t3_14vn9j0,7,False,/r/chilliwack/comments/14vn9j0/loud_crack/,5,Anyone hear that loud (thunder crack like) noise in the DT area? I don’t think we’re supposed to have thunder or lightening tonight. Might have been a fire cracker but it sounded way to loud to be one,chilliwack,Loud crack,0.86,https://www.reddit.com/r/chilliwack/comments/14vn9j0/loud_crack/
xlxoxo,,1684813958,,False,13pd654,False,False,t3_13pd654,17,False,/r/chilliwack/comments/13pd654/reports_of_shots_fired_in_chilliwack_police_urge/,20,,chilliwack,"Reports of shots fired in Chilliwack, police urge residents to shelter in place",0.95,https://globalnews.ca/news/9716270/reports-of-shots-fired-in-chilliwack-police-urge-residents-to-shelter-in-place-rcmp/
wicccked,,1680133408,,False,1264tz1,False,True,t3_1264tz1,3,False,/r/chilliwack/comments/1264tz1/shortterm_rentals_fire_extinguisher_and_emergency/,1,"As far as I understand, to host a short-term rental City of Chilliwack [requires](https://www.chilliwack.com/main/attachments/Files/2974/STR%20Fire%20Safety%20Self%20Assessment%20Form.pdf) you to have the extinguisher and emergency lighting serviced annually by a ASTT BC Certified Technician. 

1. Can someone please recommend a good and inexpensive technician? 
2. Am I required to get the service it as soon as I start renting my place out or do I need to do it for the first time a year after? 

TIA!",chilliwack,Short-term rentals: fire extinguisher and emergency lighting service,0.67,https://www.reddit.com/r/chilliwack/comments/1264tz1/shortterm_rentals_fire_extinguisher_and_emergency/
AWildAndWackyBushMan,,1665283812,,False,xzaov3,False,True,t3_xzaov3,9,False,/r/chilliwack/comments/xzaov3/how_does_one_get_recruited_by_the_fire_dept/,3,"I've got no paramedic or firefighter experience, but I'd definitely like the latter experience",chilliwack,How does one get recruited by the fire dept?,0.71,https://www.reddit.com/r/chilliwack/comments/xzaov3/how_does_one_get_recruited_by_the_fire_dept/
Just_wanna_talk,,1663784671,,False,xkcqco,False,False,t3_xkcqco,6,False,/r/chilliwack/comments/xkcqco/appears_to_be_a_large_fire_in_the_vedder_river/,12,,chilliwack,Appears to be a large fire in the vedder river area / Chilliwack lake road. Lots of fire trucks just went down there via vedder road.,0.94,https://i.imgur.com/YYyY3YL.jpg
BigPlunk,,1663350414,,False,xfxz0n,False,True,t3_xfxz0n,10,False,/r/chilliwack/comments/xfxz0n/chilliwack_school_bus_horror_stories/,4,"In the past year, two separate school buses have crashed into parked vehicles with my children on board. One just today. My son told me the other day that the bus was smoking very badly and the driver kept going to school. The kids were worried the bus was on fire because the smoke was so bad.



Anyone else out there seeing a pattern of bad driving / bad school bus experiences in Chilliwack?",chilliwack,Chilliwack school bus horror stories?,0.7,https://www.reddit.com/r/chilliwack/comments/xfxz0n/chilliwack_school_bus_horror_stories/
xlxoxo,,1663175277,,False,xe7eo2,False,False,t3_xe7eo2,1,False,/r/chilliwack/comments/xe7eo2/5_chilliwack_fires_set_overnight/,15,,chilliwack,5 Chilliwack fires set overnight,0.9,https://vancouver.citynews.ca/2022/09/14/chilliwack-fires-overnight/
Madam-misfit,,1655537114,,False,vf0vw6,False,True,t3_vf0vw6,6,False,/r/chilliwack/comments/vf0vw6/a_truck_hit_a_major_power_line_fire_crew_at_our/,14,,chilliwack,A truck hit a major power line. Fire crew at our complex had come straight from the crash site. Said to expect it to be fairly long outage.,0.94,https://www.reddit.com/r/chilliwack/comments/vf0vw6/a_truck_hit_a_major_power_line_fire_crew_at_our/
al3x_birch,,1649958110,,False,u3n07p,False,True,t3_u3n07p,5,False,/r/chilliwack/comments/u3n07p/where_are_good_camping_spots_not_up_in_the/,9,"Hello!

I had created a post about the state of Chilliwack lake road, as this was my first go to camping spot, however after finding out the road around the lake is in poor conditions, it doesn't seems like I'll be able to drive in.

I am wanting to find a free camping spot (I don't need any amenities- obviously since I am looking for free hehe) and not up in the mountains- the reason being the weather difference. I am not wanting to hit below 0 at night, not wanting to hit any snow, or just really cold weather in general- I know it will be cold wherever I go, but just minimizing the cold as much as I can. Would love to be by some type of water source. And a place where I can chop dead fall or find fire wood...

I was thinking Harrison lake, but would love to explore new territories for myself. What about cultus lake? Are there any pull off spots there? 

Are there even any pull off spots around Vedder river? or some type of water source?

Also- Just looking at Chilliwack lake weather for fun- I guess it is up in the mountains. I didn't realize that. Calls for snow all week.

Thanks everyone for your help!",chilliwack,Where are good camping spots not up in the mountains?,1.0,https://www.reddit.com/r/chilliwack/comments/u3n07p/where_are_good_camping_spots_not_up_in_the/
Gnarbachy,,1638987490,,False,rbxg1t,False,True,t3_rbxg1t,5,False,/r/chilliwack/comments/rbxg1t/where_can_i_get_firewood/,10,"Y'know, the wood that burns? It's like regular wood but for fires.",chilliwack,Where can I get firewood?,0.81,https://www.reddit.com/r/chilliwack/comments/rbxg1t/where_can_i_get_firewood/
Randy_Bobandy_Lahey,,1635823825,,False,qkvddv,False,True,t3_qkvddv,7,False,/r/chilliwack/comments/qkvddv/hows_cheam_avenue/,0,"Can any local tell me about Cheam Ave?  The one with the fire station on it. Is there are lot of homeless people around there?  I heard that Chilliwack is trying to ""clean up"" their downtown. Is North Chilliwack heading in the right direction or is it getting worse?  Haven't lived here long enough to see any trends.",chilliwack,How's Cheam avenue?,0.44,https://www.reddit.com/r/chilliwack/comments/qkvddv/hows_cheam_avenue/
Hervee,,1626345940,,False,okqbhn,False,True,t3_okqbhn,0,False,/r/chilliwack/comments/okqbhn/person_badly_burned_in_trailer_fire_at_cultus/,15,"Sunnyside Campground was evacuated following the fire. It’s lucky that the fire was contained because it’s really dry out there. 

https://globalnews.ca/news/8026901/trailer-fire-cultus-lake-bc-campground/",chilliwack,Person badly burned in trailer fire at Cultus Lake campground,0.89,https://www.reddit.com/r/chilliwack/comments/okqbhn/person_badly_burned_in_trailer_fire_at_cultus/
Onyxthecat1,,1614217526,,False,lru1x1,False,False,t3_lru1x1,2,False,/r/chilliwack/comments/lru1x1/patti_bacchus_firing_horrible_school_trustees_is/,10,,chilliwack,Patti Bacchus: Firing horrible school trustees is dangerous,0.78,https://www.straight.com/education/patti-bacchus-firing-horrible-school-trustees-is-dangerous
settlementblues,,1609638506,,False,kpaxha,False,True,t3_kpaxha,2,False,/r/chilliwack/comments/kpaxha/please_help_sign_this_petition_to_give_hero_pay/,18,"Please help sign this petition to give hero pay to grocery employees under the Loblaws umbrella (No Frills, Loblaws, Superstore, Shoppers Drug Mart, Fortinos).

https://you.leadnow.ca/petitions/tell-loblaws-reinstate-hero-pay-for-frontline-workers

The living wage for Toronto as of 2019 is 20.08$/hr working full time. Despite this, most clerks at grocery stores make 14$/hr.

A lot of them per my friends/family who work in Loblaws have their part timer hours either below 10hrs/week or deliberately kept just under 40hrs/week as for the company not to have to give them benefits.

They have no stability in their hours. Schedules are often changed last minute in the same week despite union contract stating they have to post schedules 2 weeks in advance.

These clerks are literally risking their lives everyday to bring food on our tables. I work in healthcare and think it's abysmal. Just because they don't have quote 'professional' jobs it doesn't mean we don't need to treat them with respect. I actually feel more scared for workers working at grocery stores ATM than myself. I bet most can barely afford to put food on their own tables.

They are scared of speaking up or calling in sick as their income is so low or they are afraid of getting fired.  So more Covid.

One friend also working for Loblaws  told me they were going to get interviewed by 2 newspapers but the newspapers were ultimately denied permission to talk to them by Loblaws a few months back when the journalists asked for formal permission - keep in  most workers interviewed for articles is are actual union stewards as well and my friend isn't. They think it's because they are afraid of more whistle blowers and want to control their PR. Sounds like musling to me. Very 1984.

Also relevant:

https://www.canadaland.com/podcast/350-loblaws-will-eat-us-all/

Edit: Grammar & preserve anonymity - because you know people are scared of being fired.",chilliwack,"Please help sign this petition to give hero pay to grocery employees under the Loblaws umbrella (No Frills, Loblaws, Superstore, Shoppers Drug Mart, Fortinos).",0.82,https://www.reddit.com/r/chilliwack/comments/kpaxha/please_help_sign_this_petition_to_give_hero_pay/
Belle_Mx987643,,1599869735,,False,ir2hem,False,True,t3_ir2hem,7,False,/r/chilliwack/comments/ir2hem/are_camp_fires_allowed_near_vedder_river_in/,3,,chilliwack,Are camp fires allowed near vedder river in chilliwack? Sorry if it’s a stupid question but I want to go and maybe cook lunch over a fire. I read it’s crown land but I can’t find a definitive answer about fires being banned in that area.,0.67,https://www.reddit.com/r/chilliwack/comments/ir2hem/are_camp_fires_allowed_near_vedder_river_in/
AutismoTheClown,,1595293039,,False,huxroh,False,True,t3_huxroh,4,False,/r/chilliwack/comments/huxroh/camping_party/,0,"Looking to find places in Chilliwack / Hope area to have a group of people come and camp, have a fire, go for a swim, spend the night. ( don't worry I'm staying the full time and always pack out everything and some). I know Jones Lake, but other than that I'm stumped when it comes to bigger groups.",chilliwack,Camping Party?,0.33,https://www.reddit.com/r/chilliwack/comments/huxroh/camping_party/
AutismoTheClown,,1586391605,,False,fxi6gw,False,True,t3_fxi6gw,9,False,/r/chilliwack/comments/fxi6gw/places_to_have_fires/,3,Was wondering if anyone knew places outside of municipality to have a fire this weekend? Would I get in shit for having a fire at Gill?,chilliwack,Places to have fires?,0.67,https://www.reddit.com/r/chilliwack/comments/fxi6gw/places_to_have_fires/
thefatandthefurious,,1557640351,,False,bnltiq,False,True,t3_bnltiq,2,False,/r/chilliwack/comments/bnltiq/whats_going_on_with_the_huge_fire_north_of_lickman/,12,"Looks like it started pretty recently. Anyone have any details? Looks like there were a bunch of brake lights on the road there, and firetrucks were still on the way.",chilliwack,What's going on with the huge fire north of Lickman?,0.93,https://www.reddit.com/r/chilliwack/comments/bnltiq/whats_going_on_with_the_huge_fire_north_of_lickman/
Clumsybarnacle,,1546643710,,False,acnyug,False,True,t3_acnyug,3,False,/r/chilliwack/comments/acnyug/can_i_burn_things/,3,"just moved to our first home in chilliwack and want to put in a bonfire (small) in the backyard... but I'm sure there are rules around what is allowed and how to go about it...but all i seem to ind in my searches in land clearing burn specs... are back yard minor fires limited to coal now? any info would be lovely!!!

&#x200B;

Thanks!",chilliwack,can i burn things?,0.81,https://www.reddit.com/r/chilliwack/comments/acnyug/can_i_burn_things/
Theolaa,,1533713137,,False,95jwtg,False,True,t3_95jwtg,7,False,/r/chilliwack/comments/95jwtg/forest_fire_on_chilliwack_mountain/,3,No news reporting on it as of yet. Stay safe everyone on that end of the valley.,chilliwack,Forest fire on Chilliwack Mountain,1.0,https://www.reddit.com/r/chilliwack/comments/95jwtg/forest_fire_on_chilliwack_mountain/
PrisonBull,,1527917233,,False,8nyigk,False,True,t3_8nyigk,0,False,/r/chilliwack/comments/8nyigk/bailey_landfill_is_on_fire/,3,Please do not roast marshmallows on dump fire!,chilliwack,Bailey Landfill is on fire,0.81,https://www.reddit.com/r/chilliwack/comments/8nyigk/bailey_landfill_is_on_fire/
helixflush,,1523466861,,False,8bis03,False,True,t3_8bis03,4,False,/r/chilliwack/comments/8bis03/trying_to_find_chilliwack_river_campsite/,2,"Hey there,


A few years ago a bunch of friends and I drove down Chilliwack Lake Road along the river and found a trail through the trees that lead to a campsite on the edge of the river. It had several steel fire pits and looked like a fairly common spot. Right now I'm trying to locate it on the map but I can't find the exact location. Is there a site with a location of these spots online anywhere? Unfortunately since then I reformatted my phone so lost all photos that could have been possibly geotagged, and my friend who had a few pictures didn’t have that feature turned on apparently.",chilliwack,Trying to find chilliwack river campsite,1.0,https://www.reddit.com/r/chilliwack/comments/8bis03/trying_to_find_chilliwack_river_campsite/
GoldenAgeIsAMyth,,1475916470,,False,56g6i7,False,False,t3_56g6i7,0,False,/r/chilliwack/comments/56g6i7/chilliwacks_piper_james_richardson_wins_a/,6,,chilliwack,Chilliwack's Piper James Richardson wins a Victoria Cross for playing his pipes under fire during Battle of Ancre Heights on this day Oct 8 1916. Is killed in Action,0.76,https://twitter.com/ThisDayInWWI/status/784522859876126720
broknbones,,1423135721,,False,2uv1rg,False,True,t3_2uv1rg,4,False,/r/chilliwack/comments/2uv1rg/ideas_for_an_islander_visiting_some_locals/,1,"hey r/Chilliwack

I just found this sub reddit a few moments ago so please bear with me if this has been asked and answered previously

a couple years ago a friend/co-worker transferred job sites.  I have visited a handful of times since then. once or twice for the better part of a week the other time for a long weekend type of thing.  there is a heavy armed force influence on my and friend / co-worker part so we have done / are aware of the military museum, legion/anavet type things to do which is always a guaranteed / fall back to things to do....also that being said im aware there is always cultus lake, fishing hiking trails and such

im wondering if there is anything else available on a touristy out door type of thing to do that you could recommend?? maybe helicopter tours, sports venue / pubs.......basicly anything that could be for outdoor activities and or to sit back have a brew with come laid back people over a open pit fire........ill be visiting again for the better part of a week so there is time to have a lazy sunday and time to be on the go without having to rush things

cheers ya'll",chilliwack,ideas for an islander visiting some locals,0.67,https://www.reddit.com/r/chilliwack/comments/2uv1rg/ideas_for_an_islander_visiting_some_locals/
HenrikFromDaniel,,1666427898,,False,yai93o,False,False,t3_yai93o,1,False,/r/chilliwack/comments/yai93o/wildfire_smoke_as_seen_from_space_earlier_this/,25,,chilliwack,Wildfire Smoke as seen from space earlier this week,0.96,https://i.redd.it/e5xovnqsjbv91.jpg
xlxoxo,,1654313855,,False,v4g9pz,False,False,t3_v4g9pz,2,False,/r/chilliwack/comments/v4g9pz/woman_who_lost_home_in_lytton_wildfire_victim_of/,6,,chilliwack,Woman who lost home in Lytton wildfire victim of theft; Chilliwack RCMP ask public for help,0.75,https://vancouver.citynews.ca/2022/06/03/chilliwack-theft-rcmp-lytton-victim/
leeringapple,,1625326579,,False,od0c5e,False,True,t3_od0c5e,7,False,/r/chilliwack/comments/od0c5e/wildfires_in_chilliwack/,11,Hello everyone! I am new to Chilliwack and the recent news has me thinking about how safe Chilliwack is from the wildfires. I just bought a home here and would hate to see the town and my new investment end up the same way as Lytton.,chilliwack,Wildfires in Chilliwack?,0.87,https://www.reddit.com/r/chilliwack/comments/od0c5e/wildfires_in_chilliwack/
Kines_Researcher,,1600031873,,False,is6zom,False,True,t3_is6zom,4,False,/r/chilliwack/comments/is6zom/physical_activity_habits_during_wildfire_season/,5,"Hi, I'm a researcher from the University of the Fraser Valley. I think my research about the impact of wildfire smoke on physical activity will be of interest to this group.

We are looking for people 19 years or older whose local air quality has been impacted by wildfire smoke to complete an online survey. The survey assesses how wildfire smoke impacts physical activity and mental health. It will take approximately 10-20 minutes to complete.

If you are interested in participating, go to:

[https://www.surveymonkey.ca/r/WildfiresandPhysicalActivity](https://www.surveymonkey.ca/r/WildfiresandPhysicalActivity)

Thank-you for your time.",chilliwack,Physical activity habits during wildfire season: University research,0.65,https://www.reddit.com/r/chilliwack/comments/is6zom/physical_activity_habits_during_wildfire_season/
lemmego,,1694457946,,False,16g3i40,False,True,t3_16g3i40,13,False,/r/chilliwack/comments/16g3i40/outdoor_spot_for_a_cigar/,6,"Hello everybody,

Hoping to get some advice. I just moved to Chilliwack and I'm renting a basement suite that doesn't allow smoking on the property. 

I enjoy a nice cigar from time to time so I was wondering where might be a good outdoor place to go and have a stogie? I don't want to bother anybody around parks or hiking trails. Maybe a back road with a view?

Cheers!",chilliwack,Outdoor Spot for a Cigar,0.75,https://www.reddit.com/r/chilliwack/comments/16g3i40/outdoor_spot_for_a_cigar/
Halollet,,1692667556,,False,15xqsb1,False,True,t3_15xqsb1,6,False,/r/chilliwack/comments/15xqsb1/hows_the_air/,2,"I really don't want to stick my head outside as I deal with athsma but all the sites say the air quality is low to moderate.  This is confusing as it looks like hell out there.

What's going on? Is all the smoke I'm the upper atmosphere or something?",chilliwack,How's the air?,0.63,https://www.reddit.com/r/chilliwack/comments/15xqsb1/hows_the_air/
00365,,1692547717,,1692563841.0,15wfcxm,False,True,t3_15wfcxm,32,False,/r/chilliwack/comments/15wfcxm/air_quality_is_230_extremely_bad/,56,"If you can, minimize your travel and stay indoors with the windows closed.

If you are outside, wear a mask, N95 or higher. It's like breathing cigarettes non-stop oug there. Bring a large water bottle, and drink tons of water.

Extended smoke inhalation can cause headaches, fatigue, nausea and just burning lungs and throat.

I highly recommend against going to the airshow. You are risking not insignificant bodily harm if you spent too much time inhaling heavy smoke. 

You may not get permanent lung damage, but you can feel really sick for days after.

This is bad, please take is seriously.

UPDATE: Chilliwack is ~~278~~ Now 315.

Hope is now 420. (Nice)(but also not nice)",chilliwack,"Air quality is 230+, extremely bad",0.88,https://www.reddit.com/r/chilliwack/comments/15wfcxm/air_quality_is_230_extremely_bad/
tazerwhip,,1686339921,,False,145essp,False,True,t3_145essp,16,False,/r/chilliwack/comments/145essp/local_gym_without_ridiculous_liability_waivers/,4,"I just quit smoking, and as such wanted to start exercising regularly. Legs are easy enough to do for free; but for an upper body workout I wanted to find a gym. Family had decent experience with Planet Fitness, went there and was appalled by first the customer service for a potential new customer, then secondly had to walk out due to taking 5 requests to actually be allowed to read the liability waiver before signing it, then upon reading it, found that they have a clause that even if due to their negligence (poor maintenance) I would apparently agree not to litigate were I to be injured. I assume most commercial gyms are like this, and it is likely not legally enforceable but if they have that clause that tells me they don't maintain the equipment properly.  


The question is basically: are there any gyms that have a proper LIMITED liability waiver or none at all?",chilliwack,Local gym without ridiculous liability waivers,0.62,https://www.reddit.com/r/chilliwack/comments/145essp/local_gym_without_ridiculous_liability_waivers/
00365,,1675034373,,False,10oly27,False,True,t3_10oly27,11,False,/r/chilliwack/comments/10oly27/best_place_to_buy_local_smoked_salmon/,9,"Preferably I'd like to support indigenous business and buy local. What are your recs? I'm not a huge consumer, but it's a really nice treat in omlettes and salads.",chilliwack,Best place to buy local smoked salmon?,0.85,https://www.reddit.com/r/chilliwack/comments/10oly27/best_place_to_buy_local_smoked_salmon/
No_Candidate_272,,1666127560,,False,y7j1ub,False,True,t3_y7j1ub,38,False,/r/chilliwack/comments/y7j1ub/why_so_smokey/,9,"I was planning on going to the river today, but this smoke has put a damper on things. Where is all this smoke coming from?",chilliwack,why so smokey?,0.74,https://www.reddit.com/r/chilliwack/comments/y7j1ub/why_so_smokey/
DarkWingLance,,1651275401,,False,ueyk3r,False,True,t3_ueyk3r,5,False,/r/chilliwack/comments/ueyk3r/roommate_wanted/,14,"Place available soon

I am a 47 your old man who is partially paralyzed, due to a stroke late last year. I am looking for a roommate. It is the bottom of a house, large yard, private balcony. I have everything that is needed to furnish the place except for that room. I have 2 cats. I am very friendly. Looking for a non smoker and drinker (allergic to alcohol) i dont care if you smoke outside bit not in the place. The rent is $700 a month  $50 for your half of the high speed internet. It is on street parking. There are kids who live upstairs. You will need references. Me and the landlord need to contact. 

Contact me on here to arrange a viewing.",chilliwack,roommate wanted,0.82,https://www.reddit.com/r/chilliwack/comments/ueyk3r/roommate_wanted/
