author,author_flair_text,created_utc,distiguished,edited,id,is_original_content,is_self,name,num_comments,over_18,permalink,score,selftext,subreddit,title,upvote_ratio,url
christmaslover0014,,1638530882,,1639725925.0,r7x3sy,False,True,t3_r7x3sy,34,False,/r/canadatravel/comments/r7x3sy/travelling_to_mexico_a_week_from_now/,11,"I’ll be travelling to Mexico a week from now on the grounds that I am not cancelling my trip. So far the new restrictions are making me undecided. When we booked the trip, it wasn’t as complicated as now, testing at the airport, and quarantining till we get a negative test. We will be flying from Cabo to Vancouver to Calgary. I’m not sure if we will have to quarantine in Vancouver while waiting for the results (very costly) or in Calgary our home destination. So many questions, but I haven’t found anyone who can answer them.

Should I just cancel the trip? My only concern is that the flight to Cabo is non-refundable because it is through swoop airlines.

****************UPDATE****************

Went through with the trip! Prior to that, I bought a Covid-19 travel insurance just in case I do end up contracting it while on vacation. On top of that, I got tested 3x (Antigen) before flying out of the country for peace of mind (paid for tests out of my own pocket). Alberta Health Services will not test you if you do not have any symptoms or close contact. When I arrived at the resort I was going to stay at, the first thing I did was book a PCR test 48 hours before my flight back home. Paid 1800 MXN for the test which took about 8 hours for the result to come out. PCR tests are not free, only antigens are. Set up ArriveCan on my phone before flying out of Mexico. You need both ArriveCan + Negative PCR result before they check you in. I flew with Swoop Airlines on the way to Mexico, and with WestJet back to Canada. My final destination is in Edmonton but I had a 2 hour layover in Vancouver. I was selected for the random mandatory testing done by Lifelabs. I believe they say Random, but I’m pretty sure mostly everyone if not all got tested. The procedure and testing was organized well, and it took about 20 minutes of my time for the whole thing. If you do have a connecting flight that was going to leave right away, you’ll be taking a home testkit with you and you don’t have to do it at the airport, but you must do it once you get home. I took the PCR test in Vancouver at around 9:00pm and got the result back the next day at 4:00pm. During the wait time for the result of the airport on-site PCR testing, I quarantined in my place.",canadatravel,Travelling to Mexico a week from now,0.93,https://www.reddit.com/r/canadatravel/comments/r7x3sy/travelling_to_mexico_a_week_from_now/
motopalm,,1638450479,,False,r773d3,False,True,t3_r773d3,1,False,/r/canadatravel/comments/r773d3/upcoming_mexico_travel_omicorn/,3,"Have plans in early Dec for a week long trip to Mexico. Not so much worried about the health risk but about any severe travel restriction measure (such as they had in the past: hotel quarantine, third country PCR testing) that Canada could impose for returning travelers. What worries me even more is that I will be traveling with my father, who is currently only a visitor to Canada (so new rules could complicate his return to Canada).

Anyone know of any history about Canada having put in place special restrictions for Mexico for COVID? If Mexico ends up Canada's red list (like Southern African countries), then I am toast.

What would you do if you were in my shoes?",canadatravel,Upcoming Mexico travel & Omicorn,0.8,https://www.reddit.com/r/canadatravel/comments/r773d3/upcoming_mexico_travel_omicorn/
D1L5,,1638405996,,False,r6u9ez,False,True,t3_r6u9ez,11,False,/r/canadatravel/comments/r6u9ez/new_travel_restrictions/,10,Has anyone arrived in Canada from a location other than the US today and gone through the new testing requirements? I know it's still very new but curious how the experience had been.,canadatravel,New travel restrictions?,1.0,https://www.reddit.com/r/canadatravel/comments/r6u9ez/new_travel_restrictions/
jrow871,,1634459116,,False,q9uosg,False,True,t3_q9uosg,3,False,/r/canadatravel/comments/q9uosg/how_many_negative_covid_tests_do_i_need_prior_to/,2,"Hello! 

My wife and I are coming back home to visit family in BC from Japan. I am a Canadian citizen and she is a Permanent resident. I am a little bit confused with the pre entry requirements and wondering if someone could please clarify the following. 

FYI - We are both fully vaccinated with pfizer. 

Travel.gc.ca says we need a previous negative covid test between 14 - 180 days prior to flying. 

We fly in 3 weeks (Nov5), does this mean we need to get tested asap within the next few days? 

And do I also need to get a second test 3 days prior to flying as well? 

These tests are not cheap :( any clarity would help as I don't want to pay for extra tests. 

https://travel.gc.ca/travel-covid/travel-restrictions/covid-vaccinated-travellers-entering-canada#entry-vaccinated 

Thank you!!",canadatravel,How many negative covid tests do I need prior to entering Canada?,1.0,https://www.reddit.com/r/canadatravel/comments/q9uosg/how_many_negative_covid_tests_do_i_need_prior_to/
duffano,,1633176325,,1633176540.0,pztwgn,False,True,t3_pztwgn,1,False,/r/canadatravel/comments/pztwgn/recent_experiences_on_quarantine_plan_requirement/,2,"Dear all,

we have been planning a trip to Canada for a long time (coming from Europe). Beginning from September 7 they announced that borders have been opened for those who are fully vaccinated  (which we are). I am wondering if the trip is realistic anytime soon wrt. Covid-19. Also because I don't really expect the situation to become much better anytime soon (waiting for the world to return to Pre-Covid state will be a very long wait).

I am in particular wondering about the quarantine requirements. Some sources (e.g. [https://www.canada.ca/en/public-health/services/diseases/2019-novel-coronavirus-infection/awareness-resources/entering-canada-covid-19.html?utm\_campaign=cbsa-asfc-covid19-21-22&utm\_source=news&utm\_medium=pog&utm\_content=exemptions\_sep21\_en137](https://www.canada.ca/en/public-health/services/diseases/2019-novel-coronavirus-infection/awareness-resources/entering-canada-covid-19.html?utm_campaign=cbsa-asfc-covid19-21-22&utm_source=news&utm_medium=pog&utm_content=exemptions_sep21_en137)) say that a quarantine plan is always necessary even if fully vaccinated. Other websites, such as [https://travel.gc.ca/travel-covid/travel-restrictions/covid-vaccinated-travellers-entering-canada](https://travel.gc.ca/travel-covid/travel-restrictions/covid-vaccinated-travellers-entering-canada), say that a quarantine plan is necessary ""in case you don’t qualify as a fully vaccinated traveller"". When I checked a few days ago, [travel.gc.ca](https://travel.gc.ca) was even self-contradictory, saying in one section that a quarantine plan is necessary \*even if fully vaccinated\*, while another section said that it is necessy ""in case you don’t qualify as a fully vaccinated traveller"". All of these pages seem to be official govermental sources. First question: Does anyone agree that there is contradictory information around or am I just confused?

In case one has to provide a quarantine plan even as a fully vaccined traveller (I assume this worst case for planning), does anyone have recent experience what will be accepted as a proper plan? Do you actually need to book a hotel for 14 days in case you need to quarantine, or can you just say that you \*would\* book this place in case you have to? (Our plan is to visit multiple cities, and if it is necessary to book quarantine places everywhere, this makes that whole trip kind of unrealistic.)",canadatravel,Recent experiences on quarantine plan requirement,1.0,https://www.reddit.com/r/canadatravel/comments/pztwgn/recent_experiences_on_quarantine_plan_requirement/
girlduck,,1631821834,,False,ppknek,False,True,t3_ppknek,2,False,/r/canadatravel/comments/ppknek/foreign_national_parents_with_both_sinopharm/,1,"Hi All,

My parents need to travel to Canada in a few weeks for an important family matter. They are foreign nationals, while I am Canadian. As mentioned in the subject, given the country they reside in, they were offered both doses of Sinopharm (not recognized by Health Canada), and recently got their Pfizer booster. They also have a place where they will quarantine for 14 days (as required, since they are considered only partially vaccinated).

I used this link: [https://travel.gc.ca/travel-covid/travel-restrictions/answers/foreign-family-cit-pr](https://travel.gc.ca/travel-covid/travel-restrictions/answers/foreign-family-cit-pr), to find out if they will be allowed to enter Canada, and the answer is **""Based on your answers, you will** **likely** ***be allowed*** **to enter Canada; however, the final determination will be made by a government official at the port of entry.""**

I also called CBSA to be extra sure, and a sleepy sounding agent told me that as long as they are parents of a Canadian, and have plans to quarantine, they will be allowed to enter.

I wanted to know if anyone's had a similar experience, or know a partially/unvaccinated foreign national who recently went through the border. Appreciate any help!",canadatravel,"Foreign National Parents, with both SinoPharm doses + Pfizer Booster",1.0,https://www.reddit.com/r/canadatravel/comments/ppknek/foreign_national_parents_with_both_sinopharm/
Kitchen_Safe_1123,,1631476376,,False,pmzsbb,False,True,t3_pmzsbb,2,False,/r/canadatravel/comments/pmzsbb/short_road_trip_to_canada_from_us_have_some/,2," 

Hello, my friend and I are planning to drive soon to Quebec, Canada from New York State in the US for a touristic visit. We are fully vaccinated and I'm aware we will have to show a negative PCR test at the Canadian border taken within 72h. However, I have some questions related to this trip and I would appreciate if you could help me answering some of them, especially if you have been driving to Canada from the US recently:

\- If we drive to Canada and drive back to the US, do we need another negative Covid test to re-enter the US? My understanding is that we don't need a test to re-enter the US if we drive, only if we fly, but I could be wrong.

\- How strict are the covid restrictions in Canada? We are planning to visit Quebec and besides enjoy our stay at restaurants, hotels, bars or other public places open for tourists there but we are concerned with how strict the sanitary rules are there. Will we have to wear a mask all the time, outside and inside? In restaurants too? Will it even be possible to enter in restaurants/bars?

\- Finally, is now really the best time to visit Quebec/Montreal? The recent Canadian border opening to fully vaccinated Americans encouraged us to plan this short trip but now, we are having second thoughts of how practical and enjoyable our trip would be if the sanitary restrictions are too drastic. Should we postpone our trip?

Thank you all!",canadatravel,Short road trip to Canada from US- Have some questions.,1.0,https://www.reddit.com/r/canadatravel/comments/pmzsbb/short_road_trip_to_canada_from_us_have_some/
Cookie--Monster-,,1630351966,,False,pepbus,False,True,t3_pepbus,2,False,/r/canadatravel/comments/pepbus/can_work_permit_holders_travel_to_canada_with/,1,"Hi I'm currently living and working in Canada on a work permit. I'd like to travel to my country and return but I know there are restrictions on travel to Canada until September 7th possibly.

It mentions foreign nationals are restricted right now and I can't seem to find out if a work permit holder is considered a foreign national or if I'd be allowed to re-enter Canada.

My concern is that the date gets extended and I'll be stuck in another country. Any advice or contacts would be appreciated. Thanks!",canadatravel,Can work permit holders travel to Canada with covid restrictions?,1.0,https://www.reddit.com/r/canadatravel/comments/pepbus/can_work_permit_holders_travel_to_canada_with/
mrbeanlovesyoga,,1629810349,,False,pamxrx,False,True,t3_pamxrx,0,False,/r/canadatravel/comments/pamxrx/us_land_border_crossing_with_a_pet/,2,"Has anyone crossed into Canada with a pet from the US since the restrictions changed? Or in the other direction?

I didn't see anything on the [Canadian government's website](https://travel.gc.ca/travel-covid/travel-restrictions/covid-vaccinated-travellers-entering-canada) mentioning anything specific about pets traveling but wanted to make sure we'd be okay for our trip.",canadatravel,US land border crossing with a pet,1.0,https://www.reddit.com/r/canadatravel/comments/pamxrx/us_land_border_crossing_with_a_pet/
srb2411,,1628090765,,False,oxv1k1,False,True,t3_oxv1k1,0,False,/r/canadatravel/comments/oxv1k1/us_f1_stem_opt_traveling_to_canada_on_visitor_visa/,4,I am currently on US Student Visa. My spouse has Canada PR and currently staying in Canada. I would like to travel to Canada at this time and wanted to know if there are any travel restrictions on either side that would prevent me entering US after my visit,canadatravel,US F1 STEM OPT traveling to Canada on visitor visa,0.84,https://www.reddit.com/r/canadatravel/comments/oxv1k1/us_f1_stem_opt_traveling_to_canada_on_visitor_visa/
AlrightGamer,,1626828863,,False,oofbhb,False,True,t3_oofbhb,2,False,/r/canadatravel/comments/oofbhb/traveling_to_canada_under_current_restrictions/,2,I am an American trying to travel to Canada to see my partner. We met online and have been dating for over 7 months. We already bought a  ticket prior and have post poned the trip 3 times because the travel ban keeps getting pushed back. I am fully vaccinated and show no symptoms of covid. This time they will allow someone who has been in an exclusive dating relationship with a canadian citizen for over a year and had to have met in person before to enter canada. If I sign all the necassary forms and tell them we already met and been together a year would there be any serious investigation into it? I just don't see the difference it would make if it was a year or 7 months OR that we met in person or not. Does anyone have any suggestions or been through a similar experience?,canadatravel,Traveling to canada under current restrictions,1.0,https://www.reddit.com/r/canadatravel/comments/oofbhb/traveling_to_canada_under_current_restrictions/
WannabeMacho,,1626590839,,1626674702.0,omlep9,False,True,t3_omlep9,1,False,/r/canadatravel/comments/omlep9/international_student_travelling_from_india/,2,"I am confused about the restrictions in place right now. As of today, Indian residents are not allowed to directly fly into Canada without stopping over at a 3rd country for 14 days. Most countries have banned travel from India all together.

I do not know if this restriction applies to me too or will I be allowed to fly in to Canada without a stopover somewhere.

EDIT: I should probably mention that I'm a returning student. So I have my study permit and visa already. I just need to get back in the country asap.",canadatravel,International Student travelling from India,1.0,https://www.reddit.com/r/canadatravel/comments/omlep9/international_student_travelling_from_india/
lofitaco,,1626027500,,False,oi9mng,False,True,t3_oi9mng,2,False,/r/canadatravel/comments/oi9mng/citizens_traveling_to_canada_from_usa_since_july/,2,"Hi there! I’m a vaccinated dual citizen finally traveling back to Montreal after 1.5 years of being away due to the quarantine restrictions. I’m traveling July 18th, I’m a Canadian citizen, am fully vaccinated and am getting my COVID test on the 16th. I’m getting my arrival test at the airport and will be quarantining at my father’s house until results are received (I have my own bathroom and bedroom). Anything else I need? I’m so worried I won’t have all my “ducks in a row” so to speak. I can’t login to the ArriveCAN app until 72 hours in advance. TIA!",canadatravel,Citizens traveling to Canada from USA since July 5th?,1.0,https://www.reddit.com/r/canadatravel/comments/oi9mng/citizens_traveling_to_canada_from_usa_since_july/
Windows90Five,,1625800208,,False,ogmukq,False,True,t3_ogmukq,1,False,/r/canadatravel/comments/ogmukq/rapid_pcr_ok_for_canada_preentry_covid_test/,5,"I’m flying into Toronto next week now that Canada has relaxed entry rules for Canadians. One requirement is a negative Covid test within 72 hours of departure. A PCR test can take up to 4 days and last time I had to re-do the test due to inconclusive results. 

One options I have is a ‘Rapid PCR’ Covid test which I can get results within 30 mins, but I’m unsure if this is an acceptable Covid test type. The Canadian government lists the types of test acceptable (link attached), but I’m unsure if Rapid PCR is the same as PCR and I don’t see it listed explicitly. 

Does anyone know or have experience of using a Rapid PCR test as their pre-entry Covid test to Canada? 



[Canada Pre Entry Covid Testing](https://travel.gc.ca/travel-covid/travel-restrictions/flying-canada-checklist/covid-19-testing-travellers-coming-into-canada#getting-tested)",canadatravel,Rapid PCR ok for Canada Pre-entry Covid Test?,1.0,https://www.reddit.com/r/canadatravel/comments/ogmukq/rapid_pcr_ok_for_canada_preentry_covid_test/
VernonFlorida,,1625153997,,False,obof2u,False,True,t3_obof2u,3,False,/r/canadatravel/comments/obof2u/how_to_get_a_certified_translation_of_proof_of/,2,"As most know, as of July 5, people allowed to travel to Canada will not have to quarantine (in a hotel or anywhere) IF they can show prove of full vaccination.

[https://travel.gc.ca/travel-covid/travel-restrictions/covid-vaccinated-travellers-entering-canada#entry-vaccinated](https://travel.gc.ca/travel-covid/travel-restrictions/covid-vaccinated-travellers-entering-canada#entry-vaccinated)

But , if they were vaccinated outside of Canada, the government requires a **certified translation** of the vaccine documents into English or French: [https://imgur.com/a/tLMlbfi](https://imgur.com/a/tLMlbfi)

My in-laws are trying to do this from Japan. Any advice on what the government means by ""certified translation"" and how that might be acquired in Japan – or anywhere?",canadatravel,"How to get a ""certified translation"" of proof of vaccination for entering Canada?",1.0,https://www.reddit.com/r/canadatravel/comments/obof2u/how_to_get_a_certified_translation_of_proof_of/
ferland182,,1624562472,,False,o77yda,False,True,t3_o77yda,0,False,/r/canadatravel/comments/o77yda/citizen_coming_back_to_canada_from_france/,2,"Hello everyone,

I've been in France for about a month now for work purposes and I am planning to fly back to my home in Canada (Quebec) within the next fews weeks and I would like to know if by any way, I could be exempted from the expensive 3-day hotel quarantine. I am aware of the changes in the restrictions for the fully vaccinated people that will occur on July 5th, but I won't be fully vaccinate at that time.

I totally agree to respect the 14-day quarantine at home and to make as much PCR tests as it is need to do (in France before departure, at the arrival in Canada, during the quarantine), but I just don't get the 1300$ hotel fees for 3 days (in a 125-dollar room by the way) as I would be safe for everyone at home for free. My intention is not to break the law, but to go home safely without at fine from the Public Health of Canada

Does somebody have any idea? Or maybe knows someone that can help? 

Thank you very much!",canadatravel,Citizen coming back to Canada from France,1.0,https://www.reddit.com/r/canadatravel/comments/o77yda/citizen_coming_back_to_canada_from_france/
IaM_Kobi,,1624202169,,False,o47v40,False,False,t3_o47v40,0,False,/r/canadatravel/comments/o47v40/canada_and_us_planning_to_lift_border_restrictions/,1,,canadatravel,Canada and US Planning to Lift Border Restrictions,1.0,https://youtube.com/watch?v=_UM6Wn-S-bw&feature=share
unknown_3366,,1624169426,,False,o3z10x,False,True,t3_o3z10x,2,False,/r/canadatravel/comments/o3z10x/canada_restrictions/,2,Is there restrictions in Canada upon arrival? We’ll be coming from Los Angeles but originally from Canada. We’re fully vaccinated. Would we still need to do quarantine at a designated hotel and do covid test because it’s non essential travel? Or do we get exemption?,canadatravel,Canada restrictions,1.0,https://www.reddit.com/r/canadatravel/comments/o3z10x/canada_restrictions/
FoundationKey9978,,1623167007,,False,nv6y1k,False,True,t3_nv6y1k,1,False,/r/canadatravel/comments/nv6y1k/traveling_from_toronto_to_hawaii/,1,"Travelling from Toronto to Hawaii on Air Canada later this month. Their COVID restrictions say you can either get a PCR test 72 hours pre-departure or quarantine 10 days.

The Air Canada website says to take the International Travel test at Shoppers ($200!!) ... But I can get a PCR test at the airport for free (Pearson has a pilot project running)

Can Air Canada deny me boarding if its not the exact travel test they want?",canadatravel,Traveling from Toronto to Hawaii,1.0,https://www.reddit.com/r/canadatravel/comments/nv6y1k/traveling_from_toronto_to_hawaii/
Just_Ad_7197,,1621467915,,False,ngkvjr,False,True,t3_ngkvjr,2,False,/r/canadatravel/comments/ngkvjr/travel_to_canada_from_india/,2,"Has anyone travel from india to Canada in last month ?
I want to know what are the travel restrictions and arrival steps",canadatravel,Travel to Canada from India ?,1.0,https://www.reddit.com/r/canadatravel/comments/ngkvjr/travel_to_canada_from_india/
IaM_Kobi,,1613741981,,False,lng2sr,False,False,t3_lng2sr,1,False,/r/canadatravel/comments/lng2sr/canada_extends_travel_restrictions_again/,1,,canadatravel,Canada Extends Travel Restrictions Again,0.67,https://youtube.com/watch?v=8Arya38EPMc&feature=share
lschmieds,,1608301361,,False,kflzmg,False,True,t3_kflzmg,2,False,/r/canadatravel/comments/kflzmg/travelling_within_canada_currently_ontario_to/,5,"Hi all,

&#x200B;

Planning on a short trip/getaway for a few days (located in southern Ontario) and was wanting to travel to Alberta, specifically hoping to explore Lake Louise/Banff.  


Wondering if there's anyone in Alberta, or has travelled recently, any restrictions on places you can/cannot go? Really just wanting to view the scenery, national park themselves etc so specific stores being closed isn't too much of a concern.  


Hope someone has done the trip recently & look forward to responses!",canadatravel,Travelling within Canada Currently (Ontario to Alberta),0.86,https://www.reddit.com/r/canadatravel/comments/kflzmg/travelling_within_canada_currently_ontario_to/
Goldwin_,,1602779837,,False,jbr299,False,True,t3_jbr299,1,False,/r/canadatravel/comments/jbr299/traveling_to_us_and_back_to_canada/,1,"I am planning to visit my sister who lives in California but I am a bit concerned with the travel restrictions. From what I heard from my friends getting into the US is not really the main issue and I am more concerned with coming back to Canada, especially because I am not a PR/Citizen (still under worker's permit). Can someone who might have been in the same boat share their experience? Thank you in advance.",canadatravel,Traveling to US and back to Canada,1.0,https://www.reddit.com/r/canadatravel/comments/jbr299/traveling_to_us_and_back_to_canada/
bexmig,,1597522351,,False,iaeiqc,False,True,t3_iaeiqc,1,False,/r/canadatravel/comments/iaeiqc/international_student/,1,"Hey guys! I’m currently living in Switzerland and I‘m planning to go to Vancouver next month to start my studies (Improve my english). As my course only last 5 months I don’t need a Study permit. As far as I know I won’t be able to start my studies because I’m not considered a student because I don’t have a study permit, right? Do you guys think travel restrictions will be lifted end of the month? Thanks for you help!",canadatravel,International Student,0.67,https://www.reddit.com/r/canadatravel/comments/iaeiqc/international_student/
artsyswarley,,1596144086,,False,i0uhto,False,True,t3_i0uhto,1,False,/r/canadatravel/comments/i0uhto/what_issues_will_i_come_across_traveling_from/,2,"Hi! So basically I live in Ontario and since I am out of work for the time being I want to go and visit my elderly father who lives in Alberta. 

I for sure don’t feel comfortable flying there so I was just going to drive. I also thought that since I would be out west it might be fun to drive into BC and see some sights. 

I have been extremely careful about following every single rule related to the pandemic so far and don’t plan to break the ones in the provinces I will be visiting. I guess my question is what are the restrictions like in these provinces right now and what can I expect once I’m there. Also do you think people would get mad at seeing my Ontario license plates and do things to my car??? Any advice would be much appreciated!",canadatravel,What issues will I come across traveling from Ontario to Alberta right now?,1.0,https://www.reddit.com/r/canadatravel/comments/i0uhto/what_issues_will_i_come_across_traveling_from/
MandyPatinkin1998,,1595265967,,False,hupggf,False,True,t3_hupggf,2,False,/r/canadatravel/comments/hupggf/flying_from_canada_to_the_us_during_covid/,5,"Hi, has anyone had any experience traveling from Canada to the US and back (as a Canadian national)? What was your experience and protocol during considering border restrictions and COVID. Thanks!",canadatravel,Flying from Canada to the US during COVID,1.0,https://www.reddit.com/r/canadatravel/comments/hupggf/flying_from_canada_to_the_us_during_covid/
