author,author_flair_text,created_utc,distiguished,edited,id,is_original_content,is_self,name,num_comments,over_18,permalink,score,selftext,subreddit,title,upvote_ratio,url
Hym3n,,1693332746,,False,164pt2a,False,True,t3_164pt2a,3,False,/r/canadatravel/comments/164pt2a/alberta_bc_road_trip_fire_consideration/,1,"Hello! I was looking at coming up from the Colorado Rockies into Calgary, over into Vancouver, and back down the Pacific Coast here in a couple weeks during mid-September. From what I'm seeing the wildfires along that route are quite extreme, and I do not want to contribute to the problem.

Are they expected to improve between now and then? Is it safe/possible to travel between/around these provinces at this time? Any other suggestions for travel in or around these provinces?

Thanks!",canadatravel,Alberta & BC Road Trip - Fire Consideration,1.0,https://www.reddit.com/r/canadatravel/comments/164pt2a/alberta_bc_road_trip_fire_consideration/
Level390,,1686496050,,False,146waai,False,True,t3_146waai,17,False,/r/canadatravel/comments/146waai/first_trip_to_bc_worried_about_fires/,1,"Hi all, I know this might sound entitled and it's obviously impossible to predict anything but we're planning a trip to Canada this July and I keep getting cold feet about booking things because of all the news about fires. Not just this year, I've followed things even in previous years too just out of interest (and since I've always wanted to visit.)

Am I being silly and should we just book? The main reason I'm getting cold feet is that everything is so expensive too, bear in mind we're a family of 4 too.

Not looking for validation here, just honest opinions. Thanks.",canadatravel,First trip to BC - worried about fires,0.57,https://www.reddit.com/r/canadatravel/comments/146waai/first_trip_to_bc_worried_about_fires/
PortlyTravellers,,1585335655,,False,fq37g7,False,False,t3_fq37g7,0,False,/r/canadatravel/comments/fq37g7/what_do_bored_canadians_do_in_winter_we_have/,1,,canadatravel,What do bored Canadians do in winter? We have carnivals; from fire dancers to mountain tops. Enjoy a break from. The doldrums. ***THIS WAS FILMED IN FEBRUARY 2020 PRIOR TO COVID-19 BEING IN CANADA. THERE WERE NO SOCIAL DISTANCING STEPS IN PLACE AT THAT TIME. We are currently safe at home in Canada,0.66,https://youtu.be/9p5ZS-QBkM0
roguetowel,,1540448714,,False,9r7rjn,False,False,t3_9r7rjn,0,False,/r/canadatravel/comments/9r7rjn/travel_from_the_us_was_up_in_august_but_down_in/,1,,canadatravel,"Travel from the US was up in August, but down in B.C. and Alberta because of the fires",1.0,https://www150.statcan.gc.ca/n1/daily-quotidien/181023/dq181023a-eng.htm
sacrificearcadiabay,,1693295058,,False,164bujq,False,True,t3_164bujq,10,False,/r/canadatravel/comments/164bujq/vancouver_calgary_elopement_roadtrip/,3,"Hi there advice needed 🙏 I'm UK based and due to be travelling into Vancouver 9th September. 

Ive always dreamt of road tripping through Canada and my partner is obsessed with Crater Lake, Oregon, USA.  

We decided to get married this year and are going to elope at Crater Lake! The plan was to drive straight down from Vancouver to Oregon, get married, then honeymoon in Canada, doing a Vancouver > Calgary road trip through the Rockies.

We have flights already booked. Landing in Vancouver, departing in Calgary. Hire car is also booked for pickup and dropoff in those locations. Marriage licence and permit is sorted as are a photographer and officiant for the ceremony.

No accommodation is booked, as we were going to figure that out on the way.

Im absolutely in pieces at the minute, the stress of everything is really getting to me. There is zero news in UK about the wildfire situation but I am aware of it.

Im worried we wont be able to find anywhere to stay, we wont be able to travel within Canada. We also need to travel from Vancouver through Washington to Oregon. Is that even possible right now??? 

Im also super aware that I dont want to be a tourist taking up any resources needed by locals.

Im this far away from pulling the plug on everything.

Am I overreacting or is this the situation right now?",canadatravel,Vancouver > Calgary elopement roadtrip,0.72,https://www.reddit.com/r/canadatravel/comments/164bujq/vancouver_calgary_elopement_roadtrip/
swen1919,,1688678255,,False,14sm4bh,False,True,t3_14sm4bh,49,False,/r/canadatravel/comments/14sm4bh/traveling_to_canada_during_wildfires/,0,"We have an up coming trip to Canada last week of July. Never been to Canada and always wanted to go. However, with the wildfires spreading across Canada Im wondering if I should start to consider maybe cancelling. I don't know anyone in Canada so I can get a locals perspective on the situation.",canadatravel,Traveling to Canada during Wildfires,0.35,https://www.reddit.com/r/canadatravel/comments/14sm4bh/traveling_to_canada_during_wildfires/
stereoGraf,,1688227456,,False,14nyp9c,False,True,t3_14nyp9c,6,False,/r/canadatravel/comments/14nyp9c/nocar_roadtrip_bus_trip_between_quebec_and_the/,1,"Hello!

Just looking for some pointers / tips / tricks if anyone has something interesting to share about this.

I'm a young guy living in Quebec looking for a plan for a couple of weeks off this summer and can't really afford to fly abroad, so I figured I'd visit the rest of Canada!

Because of wildfires, my family won't let me go further west, so my only option is to pass through the Eastern Townships, New Brunswick, and possibly Nova Scotia, and then head back (since I suppose it's a bit optimistic to think I could perhaps visit PEI in that single trip as well)

I'm planning on taking 2 weeks off work, but I need to decide on the best dates for such a trip.

I don't have a driver's license or a friend who would be interested in coming along, and really want a solo travel experience honestly, so my options for transport are:
- bus
- train (I don't even know if it's feasible for my destinations)
- hitchhiking (I feel like it would be safe enough for a man, but could be wrong)

I also don't know what to expect in terms of places to sleep. Are there youth hostels around these parts?

Would really appreciate any input from people who have either done solo travelling in Canada or have done a similar itinerary and might have recommendations in terms of towns and parks to visit!

Thanks in a advance! :)",canadatravel,No-car roadtrip / bus trip between Quebec and the Maritimes?,1.0,https://www.reddit.com/r/canadatravel/comments/14nyp9c/nocar_roadtrip_bus_trip_between_quebec_and_the/
TheMajesticMoose08,,1686840743,,False,14a4fpe,False,True,t3_14a4fpe,4,False,/r/canadatravel/comments/14a4fpe/wildfires_in_quebec/,5,"Hello,

I'm planning on traveling to the Saguenay area next week and am wondering how the conditions there are with the recent wildfires. 

Are there ongoing restrictions or air quality concerns that should cause me to reschedule my travel plans?",canadatravel,Wildfires in Quebec?,1.0,https://www.reddit.com/r/canadatravel/comments/14a4fpe/wildfires_in_quebec/
Impossible-Basis-189,,1677475463,,False,11d3p9p,False,True,t3_11d3p9p,5,False,/r/canadatravel/comments/11d3p9p/i_was_curious_if_anybody_has_brought_menthols/,0,,canadatravel,"I was curious if anybody has brought menthols smokes into Canada & if so if they had a issue. Side note, going to Mexico for a week, just a personal carton since their not for sale here.",0.33,https://www.reddit.com/r/canadatravel/comments/11d3p9p/i_was_curious_if_anybody_has_brought_menthols/
malommo,,1658425140,,False,w4mpj0,False,True,t3_w4mpj0,0,False,/r/canadatravel/comments/w4mpj0/travel_advice_1st_october_9_october/,1,"Hi everybody!

As written in the title I'm looking for suggestions/tips for my next trip to Canada, hopefully somebody can help me with that :)

I'm going to fly with my girlfriend from London to Montreal on the 1st and I'll be back from the same airport on 9th October.

We were planning to spend at least 5 days in Montreal (is it enough?) and then move to Quebec City or maybe do day trips using Montreal as main hub.

It is going to be our first time in Canada, any tips? We both are food lovers (Poutine, smoked meat and bagels are already on the list ahaha) and sightseeing/experiencing new cultures is what we like doing when traveling. Not very big on clubbing.

I also like to take pictures with my camera so any suggestions for beautiful spots for photography is welcomed :D

Thank you so much in advance for your help!",canadatravel,Travel advice (1st October - 9 October),0.67,https://www.reddit.com/r/canadatravel/comments/w4mpj0/travel_advice_1st_october_9_october/
under_score_forever,,1690559725,,False,15c1awl,False,True,t3_15c1awl,4,False,/r/canadatravel/comments/15c1awl/question_about_us_citizen_travel_to_canada/,2,"Thanks for looking!

I am a us citizen who will visit canada as a tourist, not to work or study. Does the 6 month restriction apply to each visit individually or is that a cumulative amount amount of time per calendar year? In other words, can I enter canada, stay for 6 months, leave for 1 day, and come back in and stay for another 6 months indefinitely?  (Please note that I'm aware there is a significant amount of discretion that the border official can exercise in each entry - I'm just asking about the letter of the law).

In Europe, us citizens can only stay 90 days per 180 days so I'm essentially wondering if Canada has a similar restriction in place for US citizens.",canadatravel,Question about US citizen travel to Canada,1.0,https://www.reddit.com/r/canadatravel/comments/15c1awl/question_about_us_citizen_travel_to_canada/
swagdried,,1690370024,,False,15a2urs,False,True,t3_15a2urs,2,False,/r/canadatravel/comments/15a2urs/driving_calgary_to_vancouver_mid_november/,1,"Howdy

I will be in Calgary mid November and want to drive through to Vancouver over 7-10 days. Rough plan right now is:

1 night Calgary
2 nights Banff/Lake Louise
1 night Jasper
1 night between Jasper & Kamloops (not sure where as yet)
1 night Kelowana
1 night Kamloops

And then from there either via Whistler to Vancouver  or direct to Vancouver via Coquihalla Hwy. Is there a better/other suggestions on stop overs along the way? I am mindful it will be Winter and reduced daylight so want to restrict driving to around the 3 hour mark

Cheers",canadatravel,Driving Calgary to Vancouver - mid November,1.0,https://www.reddit.com/r/canadatravel/comments/15a2urs/driving_calgary_to_vancouver_mid_november/
topshot14,,1678724744,,False,11qe870,False,True,t3_11qe870,5,False,/r/canadatravel/comments/11qe870/tips_for_a_family_of_3_visiting_canada_from_india/,1,"So as the title suggests, we are a family of 3 who are thinking of visiting Western Canada in the month of August (second half). I would like to have some suggestions as to what all is a must to experience when we visit Banff, Jasper, Whistler and Vancouver.

Is Whale watching a good experience in the month of August? And if it is, what time of the day is the best for it? 

As far as the temperature of the place we live in - the temperature ranges from 29-35 degrees Celsius (that is about 85-90 degrees Fahrenheit), so even though August end seems to be the peak summer time, I think that heat won't be much of a problem. Am I right to believe that?

What precautions do we take as tourists? What are some do's and don'ts that you would suggest? Also, we are pure vegetarians - (no eggs as well) . Where can we find good vegetarian food in the places mentioned above?


All three of us can understand and speak decent English but I would like to know of any and all statements/slangs that we can use or not use to bond well with the locals?  


What is the expectation when it comes to handing out tips? Is it an obligatory thing? Would you recommend us to try street food?


What about local travel? Should we take taxis or are buses good enough? Are there any COVID restrictions in place while travelling within the country? 


Would love to get an overview for the points mentioned above!",canadatravel,Tips for a family of 3 visiting Canada from India,1.0,https://www.reddit.com/r/canadatravel/comments/11qe870/tips_for_a_family_of_3_visiting_canada_from_india/
Hunt69Mike,,1677433045,,False,11cnchm,False,True,t3_11cnchm,3,False,/r/canadatravel/comments/11cnchm/restricted_foods_crossing_from_us_to_canada_us/,1,"We (4 adults) are traveling to Tremblant next week for a ski trip. The food restrictions we are finding aren’t incredibly clear. Are we able to cross with food for our stay such as sealed store bought ground beef, sealed chicken breast, eggs, cheese, bread, condiments, etc.?",canadatravel,Restricted foods crossing from US to Canada (US citizens),1.0,https://www.reddit.com/r/canadatravel/comments/11cnchm/restricted_foods_crossing_from_us_to_canada_us/
ConceptSilver5216,,1675527570,,False,10tk8zc,False,True,t3_10tk8zc,1,False,/r/canadatravel/comments/10tk8zc/question_about_requirements_for_entering_canada/,1,"I'm going to be travelling soon and when I get back to Canada, my flight transfers through Hong Kong for 3 hours. Can anyone confirm that I don't need a covid test when coming back?

As quoted:

""This **doesn’t** apply to:

* travellers transiting through China, Hong Kong or Macao, who are there for 24 hours or less
   * for example, if your flight itinerary starts in Australia and includes a connecting flight in China before continuing to Canada **and** if you are in China for 24 hours or less before the connecting flight to Canada is initially scheduled to depart""

Source: [https://travel.gc.ca/travel-covid/travel-restrictions/covid-19-pre-boarding-test-requirements-china-hong-kong-macao](https://travel.gc.ca/travel-covid/travel-restrictions/covid-19-pre-boarding-test-requirements-china-hong-kong-macao)",canadatravel,Question about requirements for entering Canada,0.99,https://www.reddit.com/r/canadatravel/comments/10tk8zc/question_about_requirements_for_entering_canada/
ubutterscotchpine,,1672771638,,False,102fwry,False,True,t3_102fwry,2,False,/r/canadatravel/comments/102fwry/covid_restrictions_crossing_uscanada_border/,0,"I know the restrictions are ever changing with the ongoing pandemic, but for someone who has traveled by car recently, we’re there any restrictions regarding vaccination/quarantine/testing etc? My partner and I haven’t been to Canada since prior to the pandemic and I’d love to plan a trip in a month or so. We’re both COVID-conscious, mask anywhere we go, are vaccinated, etc but can’t really find any information as to what’s required when crossing the border (and in return when coming back to the US). Does anyone have any advice or experience with this?",canadatravel,COVID Restrictions Crossing US/Canada border?,0.5,https://www.reddit.com/r/canadatravel/comments/102fwry/covid_restrictions_crossing_uscanada_border/
madtownmachine,,1660428603,,False,wnq0ob,False,True,t3_wnq0ob,0,False,/r/canadatravel/comments/wnq0ob/bringing_my_ebike_to_canada_ontario/,1,"We are visiting our family in Toronto next week for a couple of weeks. I wanted to bring my ebike along just to check out some bike trails. I read there are speed and power restrictions for ebike. I anyways don’t exceed those restrictions but my bike is a little bit more powerful 750W vs the 500W max allowed. My question is; is any of this looked at the border? It’s not an import, just a recreational thing that’s going back with me. How are these regulations policed at trails? Don’t want to haul it all the way and not be able to ride it or run into issues at the border.",canadatravel,Bringing my e-bike to Canada (Ontario),1.0,https://www.reddit.com/r/canadatravel/comments/wnq0ob/bringing_my_ebike_to_canada_ontario/
RepresentativeShop40,,1659663943,,False,wgij5x,False,True,t3_wgij5x,0,False,/r/canadatravel/comments/wgij5x/hi_i_am_currently_unvaccinated_living_in_bc_i_was/,0,,canadatravel,"Hi, I am currently unvaccinated living in BC. I was wondering if the travel restrictions for the unvaccinated were still on going and how strict are they because I want to go on Holiday with my family as we have been stuck in Canada for 4 years now. Ex. Want to travel to Cancun",0.38,https://www.reddit.com/r/canadatravel/comments/wgij5x/hi_i_am_currently_unvaccinated_living_in_bc_i_was/
RestlessCricket,,1657826010,,False,vz3svh,False,True,t3_vz3svh,5,False,/r/canadatravel/comments/vz3svh/return_of_random_arrival_testing_when_do_you_get/,2,"Apparently random arrivals testing will resume on 19 July, and the website says 'Travellers who must test will receive an email shortly after entering Canada'.

The website also still says 'You are exempt from arrival testing if you: provide a positive COVID-19 molecular test result, conducted at least 10 calendar days and no more than 180 calendar days before entering Canada.'

My question is when you would provide that test and to whom, as you could already be past customs when you receive the email that you've been selected, or you might not have access to your emails until later in the day. The press release the government issued doesn't seem to mention anything about prior recovery.

Sources:

[https://travel.gc.ca/travel-covid/travel-restrictions/covid-vaccinated-travellers-entering-canada](https://travel.gc.ca/travel-covid/travel-restrictions/covid-vaccinated-travellers-entering-canada)

[https://www.canada.ca/en/public-health/news/2022/07/government-of-canada-is-re-establishing-mandatory-random-testing-offsite-of-airports-for-air-travellers.html](https://www.canada.ca/en/public-health/news/2022/07/government-of-canada-is-re-establishing-mandatory-random-testing-offsite-of-airports-for-air-travellers.html)",canadatravel,Return of random arrival testing: when do you get the chance to show your previous positive test to be exempt?,1.0,https://www.reddit.com/r/canadatravel/comments/vz3svh/return_of_random_arrival_testing_when_do_you_get/
taramreadit,,1648620921,,False,trzxyv,False,True,t3_trzxyv,2,False,/r/canadatravel/comments/trzxyv/flying_back_to_the_us_from_canada_after_april_1st/,2,"Does anyone know if tests will still be needed upon going back to the USA after a visit to Canada after Canada lifts the covid restrictions on their end? 

Also, if yes we have to still get a test to get back... what does it mean for procedure, do we have to get a test 1 day or 3 days before? (are testing centers at the airports, how do you find it easily)? I may be going to Vancouver soon and i haven't travelled by air all pandemic.",canadatravel,Flying back to the US from Canada after April 1st? Covid- restrictions?,1.0,https://www.reddit.com/r/canadatravel/comments/trzxyv/flying_back_to_the_us_from_canada_after_april_1st/
myduyen135,,1647963692,,1647968806.0,tk5ttj,False,True,t3_tk5ttj,6,False,/r/canadatravel/comments/tk5ttj/can_i_leave_the_airport_during_a_19_hour_layover/,1,"I am a US citizen and will be traveling from Michigan to South Korea in May with a 19 hour layover in Toronto airport. I am wondering if anyone has experienced such a long layover in Canada and can comment on whether or not I can book a hotel near the airport and stay there overnight rather than staying in the airport for 19 hour. FYI, I am fully vaccinated.

From Air Canada, it says, ""Due to COVID-19 restrictions, passengers are currently prohibited from leaving the airport when connecting between consecutive flights, therefore the Air Canada Stopover Program is currently suspended until further notice."" ([https://www.aircanada.com/us/en/aco/home/book/travels/hotels/stopover.html#/](https://www.aircanada.com/us/en/aco/home/book/travels/hotels/stopover.html#/) )

On the US Embassy in Canada website, it says, ""Fully vaccinated travelers, including those engaging in non-essential travel (travel for tourism or recreation), may enter Canada."" ([https://ca.usembassy.gov/covid-19-information-canada-3/](https://ca.usembassy.gov/covid-19-information-canada-3/))

Because Canada recently allowed fully vaccinated travelers to enter Canada, I am not sure how up-to-date the first link is. I tried emailing Air Canada, the Canadian embassy in the US, CBSA and PHAC, all of whom just sent an automated response with links to their website, which did not really answer my question. Trying to call Air Canada is also useless since it's all automated response and I couldn't be connected to a representative.

If anyone is in similar situation as me or knows the answer, I'd really appreciate your help!

EDIT:  called Air Canada, and was told we are not allowed to leave the airport during our connection :(",canadatravel,Can I leave the airport during a 19 hour layover in Toronto International Airport during COVID?,1.0,https://www.reddit.com/r/canadatravel/comments/tk5ttj/can_i_leave_the_airport_during_a_19_hour_layover/
craigrobertsuk,,1645987798,,1645996750.0,t2uwx2,False,True,t3_t2uwx2,16,False,/r/canadatravel/comments/t2uwx2/unvaccinated_british_citizen_wanting_to_fly_out/,0,"Update: It seems they have changed the rules despite me viewing this page this morning from February 28th to August 31st 2022 for foreign nationals leaving.

Long story short me and my Canadian wife got here in July 2020, wanting to start a new life here, applied for permanent residence, work permit etc right away. Fast forward nearly 2 years later and still nothing apart from minor correspondence. Aswell as that and my legal inability to work we have realised just how much better off we were in England and the crazy cost of living among other things I won't go into here. We decided we want to return to England, my wife has English grandparents so can get in through an ancestry visa and ofc I'm a British citizen. I hear that Canada apparently won't let unvaccinated people board a plane or train. BUT surely they can't hold me, prisoner, here when I have a right to return to my home country where they don't have any restrictions anyway. I have heard of some brief ways around this, but almost everything I see seems to be geared towards unvaxxed entering Canada vs leaving. The UK has little to no restrictions currently. Any tips are greatly appreciated, there's NO way I'm being trapped here without the ability to work and with WW3 potentially on the horizon.",canadatravel,Unvaccinated British Citizen Wanting to Fly out of Canada late March-late April,0.42,https://www.reddit.com/r/canadatravel/comments/t2uwx2/unvaccinated_british_citizen_wanting_to_fly_out/
zar_bear,,1642111601,,False,s3b1tf,False,True,t3_s3b1tf,9,False,/r/canadatravel/comments/s3b1tf/i_tested_positive_for_covid_15180_days_ago_and/,4,"As per the Gov. of Canada website, I know I’m able to use a positive COVID test in lieu of. negative PCR test when re-entering the country (https://travel.gc.ca/travel-covid/travel-restrictions/flying-canada-checklist/covid-19-testing-travellers-coming-into-canada). My question is more about the source of how I accessed my test.

I was tested at a hospital in Toronto for free a few weeks ago. My results were only posted on the Ontario portal, meaning that the only information that is reported is my name, test date/type/name of hospital, and the test positive result. 

I know we are not allowed to use negative PCR tests funded by OHIP for travel, but can we use the positive results (also funded by OHIP) for travel?",canadatravel,I tested positive for COVID 15-180 days ago and want to use the positive test for re-entry into Canada in lieu of a negative PCR. I had my test done through a public hospital and it was covered under OHIP - can I use this positive test for travel?,0.84,https://www.reddit.com/r/canadatravel/comments/s3b1tf/i_tested_positive_for_covid_15180_days_ago_and/
derpt34,,1640787440,,False,rr95oy,False,True,t3_rr95oy,6,False,/r/canadatravel/comments/rr95oy/how_does_crossing_at_land_border_work/,1,"Does anyone have experience entering Canada by land with the new covid restrictions? I have a ski trip planned to Whistler and will be flying into Seattle, renting a car and driving to the mountain. I uploaded my US passport and proof of vaccination to the ArriveCan app, but it didn't ask me to upload my proof of negative PCR test. Is this something I bring along with me to the border checkpoint? Also, do they even verify the test or just check that the name matches up with my passport?",canadatravel,How does crossing at land border work?,1.0,https://www.reddit.com/r/canadatravel/comments/rr95oy/how_does_crossing_at_land_border_work/
maxidoom8,,1639757747,,False,rikuf3,False,True,t3_rikuf3,3,False,/r/canadatravel/comments/rikuf3/international_student_traveling_to_canada_nye/,4,"So I am scheduled for a travel to Canada on December 31st. I am a student from Norway, who is fully vaccinated and carrying all necessary documents. I will transit through Toronto and then leave for Halifax the same day. my stay will be a total of 5 months. 

This whole situation regarding omicron and potential ""travel ban"" stresses me the hell out. What is a a realistic scenario with regards to the development of travel restrictions up until new years eve? 

Should I set my self up for a letdown or what are the chances of it being possible for me to go?",canadatravel,International student traveling to Canada NYE,0.84,https://www.reddit.com/r/canadatravel/comments/rikuf3/international_student_traveling_to_canada_nye/
