author,author_flair_text,created_utc,distiguished,edited,id,is_original_content,is_self,name,num_comments,over_18,permalink,score,selftext,subreddit,title,upvote_ratio,url
Ehlora1980,,1622298998,,1622507806.0,nnordi,False,True,t3_nnordi,11,False,/r/chilliwack/comments/nnordi/if_you_heard_a_crash_around_leary_and_wells_last/,37,"I was asleep already, my youngest woke me up and said I think there's a car accident outside. 0.5seconds later my husband bursts into the room and says there's been a collision outside. 

I slipped on flip flops and booked it outside to find a strange scene. My mom's van was 10ft and 90° from where it was parked, on top of our garden bed, and the whole ass end was unrecognizable. 


At that point I realized that I was hearing the whirling of the tires still engaged and spinning at the back of the red BMW on my lawn, aswell as multiple people calling 911.


There were already people gathered and a tall gentleman from on Leary (thank you so much for being there giant red beard hero guy) immediately took over and requested someone get his med kit from home. 


We booked it to the address given on foot, which was right around the corner. My hubby ran up to the door, knocked furiously, and a lovely lady ran to get the med pack we requested.  


The police were there within moments, the ambulance was a heartbeat behind, and firetrucks momentarily after. Thank you, to all our first responders. They were working like a well oiled machine, and got Dude out right away.


Dude in the BMW was put on a stretcher  and put in the ambulance, and stablized. I sincerely hope he's ok.


 One witness said that he was doing about 120km/h down Wells Rd. My home, with my (supposed to be) sleeping children right next to the exterior wall, was  like 10ft from where he impacted my husband's front end.


 Hubby waited up until the vehicles had all been towed away before attempting sleep. I smoked a bowl and crashed around 12:30am. The youngest wanted to sleep in our bed as he was still pretty freaked out and shook up.


 A few thoughts keep surfacing. Firstly, (of course) I hope Dude is ok. I hope he has no lasting I'll effects. 


Secondly, why was he going so fast?
If it was a medical event, is he going to be ok? He was still stomping on the gas as I approached the vehicle initially, so I sure hope it wasn't clotting related, like a stroke. 


Lastly, how on earth did he manage to miss my mom's kidney car donation vehicle? He hit every other object in his path. My neighbors fence, 2 vehicles, our address signage, 10 years of landscaping...the list is extensive. But, some how, some way, he missed the junker by meer inches. Hilarious really.


That said, my grandma's pink dogwood tree is likely unsalvageable (I'm told it's rare and there's no way we could afford to replace it). Her smoke bush has a bit of a better chance I think, so we will assess today, replant what we can, and lament the roses that are beyond repair. 


Also destroyed was a 30+yo plum tree. The trunk was a meter around and it was obliterated. Branches had to be dragged off the road. The two (now 1) plum trees are beloved of my family because of their gorgeous spring blossoms, but were also an important food source and established homes for local wildlife. I'm so sad that the tree's going to be mulched up and forgotten. 


One upside is that I realized I need to renew my CPR and first aid certification as I was super hesitant to jump in. Also, I now will carry a first aid kit on my person instead of just in the car. Don't know why I didn't sooner.


So, Dude in the BMW. I hope you are ok. Red-beard the medic and wife, you are amazing. Thank you for taking charge of the scene and running that medic bag over. Everyone who came to help, thank you so much for your support. If you've made it this far, thanks for reading.


Update:  I have sadly been informed that BMW dude did not make it. Rest easy, friend.",chilliwack,"If you heard a crash around Leary and Wells last night about 10:15-ish, that was my front yard getting destroyed.",0.97,https://www.reddit.com/r/chilliwack/comments/nnordi/if_you_heard_a_crash_around_leary_and_wells_last/
BOGDANOFF-AGENT,,1621011521,,False,ncddpf,False,True,t3_ncddpf,2,False,/r/chilliwack/comments/ncddpf/anyone_know_any_good_spots_to_rent/,4,DOWNTOWN CHILLIWACK JUST LOOKING FOR A SINGLE PERSON SUITE. 20M WORKING GUY. NO PETS DONT SMOKE NOTHING. BED BUGS NOT PREFERRED...,chilliwack,ANYONE KNOW ANY GOOD SPOTS TO RENT,0.7,https://www.reddit.com/r/chilliwack/comments/ncddpf/anyone_know_any_good_spots_to_rent/
Staghornbob,,1610582948,,False,kwtpnn,False,True,t3_kwtpnn,0,False,/r/chilliwack/comments/kwtpnn/barry_neufeld_lights_up_smoke_and_has_a_glass_of/,2," Barry Neufeld, controversial school trustee, lights up smoke and has a sip of wine before falling asleep at meeting. He is asked to resign by members of the board and by the Minister of Education after calling the local paper reporters ""retards"" (as well as questioning the gender of the Chief Public Health Officer of Canada, etc.)

The board asks him to resign at 1:13, lights smoke at 6:55, Wine at 7:03, pretty much asleep by the 3 hour mark. (But hey, 3 hours of ZOOM will do that.)  [https://youtu.be/9PKZsQ9aEdo](https://youtu.be/9PKZsQ9aEdo)",chilliwack,Barry Neufeld lights up smoke and has a glass of wine at School Trustee Meeting.,0.67,https://www.reddit.com/r/chilliwack/comments/kwtpnn/barry_neufeld_lights_up_smoke_and_has_a_glass_of/
Staghornbob,,1610582605,,False,kwtlqp,False,True,t3_kwtlqp,10,False,/r/chilliwack/comments/kwtlqp/barry_neufeld_smokes_has_glass_of_wine_at/,39,"Barry Neufeld, controversial school trustee, lights up smoke and has a sip of wine before falling asleep at meeting. He is asked to resign by members of the board and by the Minister of Education after calling the local paper reporters ""retards"" (as well as questioning the gender of the Chief Public Health Officer of Canada, etc.)

The board asks him to resign at 1:13, lights smoke at 6:55, Wine at 7:03, pretty much asleep by the 3 hour mark. (But hey, 3 hours of ZOOM will do that.)

 [https://youtu.be/9PKZsQ9aEdo](https://youtu.be/9PKZsQ9aEdo)",chilliwack,"Barry Neufeld smokes, has glass of wine at Chilliwack School Trustee Meeting",0.95,https://www.reddit.com/r/chilliwack/comments/kwtlqp/barry_neufeld_smokes_has_glass_of_wine_at/
VapingAndSmoking,,1605307915,,False,jtqgo0,False,True,t3_jtqgo0,0,False,/r/chilliwack/comments/jtqgo0/social_media_use_smoking_and_vaping_survey_about/,5,"Hello! We are looking for Canadians or people living in Canada over the age of 19 to take part in our surv

ey that is being conducted by UBC (PI: Dr. Sarah Dow-Fleisner, Assistant Professor, UBCO School of Social Work, Co-I: Michelle Belliveau, MSW student). We are interested in understanding social media use, anxious and depressive symptoms, and vaping/smoking. So, we will be asking a few questions about these topics. Please be assured that your responses will be kept completely anonymous. The study should take you about ten minutes to complete. This study has gained ethics approval from the University of British Columbia, study number: H20-01453. If you have questions or concerns, please contact Michelle at vapingandsmokingresearch@gmail.com

Survey Link: [https://ubc.ca1.qualtrics.com/jfe/form/SV\_bjZR2UnVynmFAln](https://ubc.ca1.qualtrics.com/jfe/form/SV_bjZR2UnVynmFAln)",chilliwack,"Social media use, smoking, and vaping; Survey about Canadians or people living in Canada",0.78,https://www.reddit.com/r/chilliwack/comments/jtqgo0/social_media_use_smoking_and_vaping_survey_about/
ZaptheBrannigan,,1368471851,,1368477638.0,1e9f8n,False,True,t3_1e9f8n,16,False,/r/chilliwack/comments/1e9f8n/just_moved_to_chilliwack_what_do/,8,"Im 24, and I just moved over here from the island, and due to a couple of factors cant work just yet(thats in the *works*). I spend a good portion of my time on steam playing games and smoking wayyyy too many cigarettes.

 I really dont know anyone here and I was hoping i could find some like minded people to chill with, and help me discover some of the neater parts of town.

Sadly I dont have a vehicle or bicycle (as of yet) so I get stuck walking for the most part, but thats probably better for me right now. I do have a pass for the next year to prospera leisure center so even if someone would like to go for ice skating (i dont like swimming) or hit the gym as a buddy and some motivation.

As you can probably tell I need to get outta the damned house and meet some cool people! 

On the far far end of the spectrum my girlie and I are ents and kinda could use a hook up as well(us damned island hippies) for you know what. PM me bout that one.

Thanks /r/chilliwack so far, there has been nothing but awesome for me and hope that there is more!

EDIT: I should probably let you guys know a bit more about myself, don't be afraid to shoot me a msg!

As already stated I spend too much time on my computer, I like to work with 3D animation software and am currently trying to teach myself C++. Im fairly close to the four corners area, I would like to get a bit more fit and active (again as already stated) I probably have a slower pace than most are used to in my life due to growing up in a relaxed atmosphere that island kids get to experience. I like to meet people and even just chill at the park and burn one down, or what have you. I'd like to get more aquianted with the area and resources to keep myself from getting too bored. I like me a nice beer, but the no job keeps my budget pretty tight on that end. 

So in short if you're looking for someone to chill with thats pretty laid back and gets along with near anyone, leave a comment or pm me. 

thanks again guys!
",chilliwack,"Just moved to chilliwack, what do?",0.9,https://www.reddit.com/r/chilliwack/comments/1e9f8n/just_moved_to_chilliwack_what_do/
00365,,1690641671,,False,15ctymk,False,True,t3_15ctymk,77,False,/r/chilliwack/comments/15ctymk/is_there_a_way_to_report_lawn_overwatering_to_the/,7,"Someone in my neighborhood is absolutely not following the stage 3 water restrictions and has their lawn sprinkler set up to water it every morning. It's not newly established grass seed or anything, just flouting the law. 

 It's frustrating to watch so much water be wasted when we're bringing asked to take shorter showers.",chilliwack,Is there a way to report lawn overwatering to the city?,0.57,https://www.reddit.com/r/chilliwack/comments/15ctymk/is_there_a_way_to_report_lawn_overwatering_to_the/
prawduhgee,,1679954484,,False,12428ly,False,True,t3_12428ly,94,False,/r/chilliwack/comments/12428ly/paper_tigers/,99,"Seriously, what are these people protesting? There is no mask or vaccine mandate. Everything is open. Are they so cooped up in their echo chamber that they don't realize that restrictions ended months ago?",chilliwack,Paper tigers,0.87,https://www.reddit.com/r/chilliwack/comments/12428ly/paper_tigers/
xiorty,,1645072639,,False,sug2ue,False,True,t3_sug2ue,27,False,/r/chilliwack/comments/sug2ue/as_someone_that_moved_here_midcovid_and_knows/,12,"So as I'm sure everyone's well aware, tonight at midnight quite a few restrictions are being relaxed. As the title mentions, I moved here mid-covid and know basically no one. How can I take advantage of things opening back up and get to know some locals?

Groups, clubs, pubs with trivia night, just something as an excuse to get out of the house, and be social. I'm pretty open minded, though I wouldn't say I'm super outdoorsy.

Any suggestions would be much appreciated!",chilliwack,"As someone that moved here mid-covid and knows absolutely no one, how do I take advantage of everything opening back up and make some local friends?",0.93,https://www.reddit.com/r/chilliwack/comments/sug2ue/as_someone_that_moved_here_midcovid_and_knows/
A_Sightstone,,1643681826,moderator,False,shjbxr,False,True,t3_shjbxr,16,False,/r/chilliwack/comments/shjbxr/covid19_and_misinformation/,70,"Hi y'all!

We have been attacked by a few trolls today, one that keeps creating new accounts to spread misinformation regarding Covid-19 and vaccines.  Just a reminder that spreading misinformation is against Reddit site wide rules. I have temporarily restricted new accounts from being able to post, and hope to be able to turn it off soon. Thanks to all that reported these users!",chilliwack,Covid-19 and misinformation,0.88,https://www.reddit.com/r/chilliwack/comments/shjbxr/covid19_and_misinformation/
walkingsugarcube,,1630488055,,False,pfq8bw,False,True,t3_pfq8bw,57,False,/r/chilliwack/comments/pfq8bw/surprise_surprise_our_mp_voted_for_a_motion_to/,50,"[https://www.ourcommons.ca/members/en/votes/43/2/125?view=party](https://www.ourcommons.ca/members/en/votes/43/2/125?view=party)

Just search ""chilliwack"" and you'll see. Vote him out this month, please.",chilliwack,"Surprise, Surprise. Our MP voted for a motion to restrict abortion rights.",0.89,https://www.reddit.com/r/chilliwack/comments/pfq8bw/surprise_surprise_our_mp_voted_for_a_motion_to/
Indy_Pendant,,1625339701,,False,od4e8z,False,True,t3_od4e8z,0,False,/r/chilliwack/comments/od4e8z/bc_social_discord_server_join_chat_make_new/,3,"https://discord.gg/qPMj39RFrg

#What is it?#
It's a collection of chat rooms specifically for BC folk who want a little more *social* in their social lives.

#How's it work?#
Click [the link](https://discord.gg/qPMj39RFrg), say hi, and start meeting new friends.  You can run Discord either in your browser or download and install the application to your computer / phone.  Completely free and pretty darn easy.

The server is divided into chat rooms based on topics of interest, like #videogames, #food-n-cooking, and #hockey, etc.  There's even the age-restricted #adults-only room for those who like that sort of thing.  :)  Drop into the rooms that interest you and meet others in your area with the same interests.  There's something for everyone, but in case there isn't, stop by the #suggestions room and propose a new topic!

#Why?  What's the point?#

Every week or so there's another post in one of the BC subreddits saying something like ""How do you make friends here?"" or ""Hi, I'm new, looking for friends!""  I've moved more than 15 times across three countries and this is a situation that I've been in many times myself.  Everywhere I went, to make friends I started looking for groups to join or, if there were no groups, I started them myself.  That that's what this is, a first step to bring people together around common interests to help people be social and maybe make a few new friends.

#300 people have already signed up.  Come join us!#

This server is not affiliated with _any_ BC subreddit or their moderators in any way.",chilliwack,"BC Social Discord server - join, chat, make new friends across the province!",0.64,https://www.reddit.com/r/chilliwack/comments/od4e8z/bc_social_discord_server_join_chat_make_new/
SirLoopy007,,1621139216,,False,ndgdzj,False,True,t3_ndgdzj,12,False,/r/chilliwack/comments/ndgdzj/backyard_workshop_advicehelp/,4,"I'm looking to build a shop in our backyard, and wondering if anyone has any experience going through permits and design documents for the city or any other random advice?

I've looked through by-laws and the permit process and it seems straight forward and that I just have to submit a pretty basic sketch. Though I haven't found much in the way of height restrictions or even size/location limits.

Any help would be greatly appreciated.",chilliwack,Backyard workshop advice/help,0.83,https://www.reddit.com/r/chilliwack/comments/ndgdzj/backyard_workshop_advicehelp/
Wizard1987,,1619147198,,False,mwlw3k,False,True,t3_mwlw3k,9,False,/r/chilliwack/comments/mwlw3k/is_there_any_city_bylawrestriction_regarding/,5,,chilliwack,Is there any city bylaw/restriction regarding washing your car in your parking lot?,0.73,https://www.reddit.com/r/chilliwack/comments/mwlw3k/is_there_any_city_bylawrestriction_regarding/
truecanoebc,,1675581547,,False,10u6ogo,False,False,t3_10u6ogo,0,False,/r/chilliwack/comments/10u6ogo/campfire_on_the_fraser_river/,6,,chilliwack,Campfire on the Fraser River,0.72,https://www.youtube.com/watch?v=uHHm4J46i_U
