author,author_flair_text,created_utc,distiguished,edited,id,is_original_content,is_self,name,num_comments,over_18,permalink,score,selftext,subreddit,title,upvote_ratio,url
ubcstaffer123,,1696102891,,False,16wfu4b,False,False,t3_16wfu4b,2,False,/r/canada/comments/16wfu4b/dawson_city_yukons_fire_department_marks_125/,43,,canada,"Dawson City, Yukon's fire department marks 125 years of protecting the community",0.91,https://www.cbc.ca/news/canada/north/dawson-city-fire-department-serving-community-125-years-1.6980582
AutoModerator,,1696062650,,False,16w1ipw,False,True,t3_16w1ipw,7,False,/r/canada/comments/16w1ipw/national_day_for_truth_and_reconciliation_journée/,0,"On the National Day for Truth and Reconciliation, we would like to encourage all members of [r/Canada](https://www.reddit.com/r/Canada) to mark 30 September as a day of action and reflection.

We as Canadians continue to learn and understand the depth and breadth of the mistreatment of Indigenous children at residential schools under a government policy of assimilation. A recent, dark, and tragic period in our Canadian story that we have a responsibility to face with open minds, humility, and compassion to improve our understanding, learn, and be part of the process of healing.

Today offers a continued opportunity for all members of the subreddit to pause, recognize, and reflect on the malicious legacy of residential schools. Please, seize the opportunity by participating and learning for the betterment of our society.

\---

À l’occasion de la Journée nationale de la vérité et de la réconciliation, nous aimerions encourager tous les membres de r/Canada à marquer le 30 septembre comme une journée d’action et de réflexion.

En tant que Canadiens, nous continuons d’apprendre et de comprendre la profondeur et l’ampleur des mauvais traitements infligés aux enfants autochtones dans les pensionnats dans le cadre d’une politique gouvernementale d’assimilation. Une période récente, sombre et tragique de notre histoire canadienne à laquelle nous avons la responsabilité d'affronter avec un esprit ouvert, humilité et compassion pour améliorer notre compréhension, apprendre et faire partie du processus de guérison.

Aujourd’hui, tous les membres du subreddit ont l’occasion de faire une pause, de reconnaître et de réfléchir à l’héritage malveillant des pensionnats. S'il vous plaît, saisissez l'opportunité en participant et en apprenant pour le bien de notre société.

\---

**Opportunities to participate:**

* Both the National Day for Truth and Reconciliation and Orange Shirt Day take place today. Orange Shirt Day is an Indigenous-led, grassroots commemorative day that honours the children who survived Indian Residential Schools and remembers those who did not.
* There are various sacred Fires and Vigils in cities across the country that are held from sunrise to sunset today. We encourage you to seek out one in yours to respectfully participate in.
* CBC is hosting a series of Indigenous-led programming for television and radio audiences. Links and details for these programs and offerings can be found [here](https://www.cbc.ca/television/honour-national-day-for-truth-and-reconciliation-with-cbc-1.6978615)

**Opportunities to learn:**

* Download the mobile app – Reconciliation: A Starting Point [Reconciliation: A Starting Point - CSPS (csps-efpc.gc.ca)](https://na01.safelinks.protection.outlook.com/?url=https%3A%2F%2Fwww.csps-efpc.gc.ca%2Ftools%2Fapps%2Fils%2Findex-eng.aspx&data=04%7C01%7C%7C34bc29d4ea88464fc8c608d9836e87c5%7C84df9e7fe9f640afb435aaaaaaaaaaaa%7C1%7C0%7C637685333014337130%7CUnknown%7CTWFpbGZsb3d8eyJWIjoiMC4wLjAwMDAiLCJQIjoiV2luMzIiLCJBTiI6Ik1haWwiLCJXVCI6Mn0%3D%7C1000&sdata=REjjsieekCV3gl%2B1tI%2BRXLwD4JymRJh1fZAoEeGRBYI%3D&reserved=0)
* Read the Truth and Reconciliation Commission of Canada’s 94 calls to action [https://www2.gov.bc.ca/assets/gov/british-columbians-our-governments/indigenous-people/aboriginal-peoples-documents/calls\_to\_action\_english2.pdf](https://na01.safelinks.protection.outlook.com/?url=https%3A%2F%2Fwww2.gov.bc.ca%2Fassets%2Fgov%2Fbritish-columbians-our-governments%2Findigenous-people%2Faboriginal-peoples-documents%2Fcalls_to_action_english2.pdf&data=04%7C01%7C%7C34bc29d4ea88464fc8c608d9836e87c5%7C84df9e7fe9f640afb435aaaaaaaaaaaa%7C1%7C0%7C637685333014347124%7CUnknown%7CTWFpbGZsb3d8eyJWIjoiMC4wLjAwMDAiLCJQIjoiV2luMzIiLCJBTiI6Ik1haWwiLCJXVCI6Mn0%3D%7C1000&sdata=ErJi6l5AtS%2BXnV06MdGnW8iwR8e7Yf9e2%2FRZDQZHSyU%3D&reserved=0)
* Read the 231 calls to action in the Final Report of the National Inquiry into Missing and Murdered Indigenous Women and Girls [https://www.mmiwg-ffada.ca/final-report/](https://na01.safelinks.protection.outlook.com/?url=https%3A%2F%2Fwww.mmiwg-ffada.ca%2Ffinal-report%2F&data=04%7C01%7C%7C34bc29d4ea88464fc8c608d9836e87c5%7C84df9e7fe9f640afb435aaaaaaaaaaaa%7C1%7C0%7C637685333014347124%7CUnknown%7CTWFpbGZsb3d8eyJWIjoiMC4wLjAwMDAiLCJQIjoiV2luMzIiLCJBTiI6Ik1haWwiLCJXVCI6Mn0%3D%7C1000&sdata=VOmo95UaMf3aSWcBlN6wOZfqk3PghlZDfN3MMbuAtCo%3D&reserved=0)
* Read reports related to residential schools, the Truth and Reconciliation Commission, Aboriginal Healing Reports and more [Reports - NCTR](https://na01.safelinks.protection.outlook.com/?url=https%3A%2F%2Fnctr.ca%2Frecords%2Freports%2F&data=04%7C01%7C%7C34bc29d4ea88464fc8c608d9836e87c5%7C84df9e7fe9f640afb435aaaaaaaaaaaa%7C1%7C0%7C637685333014357114%7CUnknown%7CTWFpbGZsb3d8eyJWIjoiMC4wLjAwMDAiLCJQIjoiV2luMzIiLCJBTiI6Ik1haWwiLCJXVCI6Mn0%3D%7C1000&sdata=zVSwj%2FmLCu%2FpPhCkhejPAU7Duy7vdijeM53GUpzkyIM%3D&reserved=0)
* The National Centre for Truth and Reconciliation has developed a Residential School timeline [https://nctr.ca/exhibits/residential-school-timeline/](https://na01.safelinks.protection.outlook.com/?url=https%3A%2F%2Fnctr.ca%2Fexhibits%2Fresidential-school-timeline%2F&data=04%7C01%7C%7C34bc29d4ea88464fc8c608d9836e87c5%7C84df9e7fe9f640afb435aaaaaaaaaaaa%7C1%7C0%7C637685333014357114%7CUnknown%7CTWFpbGZsb3d8eyJWIjoiMC4wLjAwMDAiLCJQIjoiV2luMzIiLCJBTiI6Ik1haWwiLCJXVCI6Mn0%3D%7C1000&sdata=RNSsUFzU4r52JhjXwlhcA%2FQ0EXrNF1wEeCsvJXabq4E%3D&reserved=0)
* The CBC has created an interactive map that allows you to see how close you live or work to a former Residential School site. [Did you live near a residential school? (cbc.ca)](https://na01.safelinks.protection.outlook.com/?url=https%3A%2F%2Fwww.cbc.ca%2Fnews2%2Finteractives%2Fbeyond-94-residential-school-map%2F&data=04%7C01%7C%7C34bc29d4ea88464fc8c608d9836e87c5%7C84df9e7fe9f640afb435aaaaaaaaaaaa%7C1%7C0%7C637685333014367112%7CUnknown%7CTWFpbGZsb3d8eyJWIjoiMC4wLjAwMDAiLCJQIjoiV2luMzIiLCJBTiI6Ik1haWwiLCJXVCI6Mn0%3D%7C1000&sdata=IzC11ujbeoNLQa5gH5QTgNXPM26h1XIoVj8PcVSLMWw%3D&reserved=0)

Everyone will choose to reflect and mark this day in their own way, so please be respectful and considerate towards others.

Chacun choisira de réfléchir et de marquer cette journée à sa manière, alors soyez respectueux et prévenant envers les autres.

Merci / Thank you,

The [/r/Canada](https://www.reddit.com/r/Canada) Mod Team",canada,National Day for Truth and Reconciliation / Journée Nationale de la Vérité et de la Réconciliation,0.3,https://www.reddit.com/r/canada/comments/16w1ipw/national_day_for_truth_and_reconciliation_journée/
thisisjas9n,,1695916903,,False,16ujvsk,False,False,t3_16ujvsk,116,False,/r/canada/comments/16ujvsk/hyundai_kia_recall_over_600000_cars_in_canada/,354,,canada,"Hyundai, Kia recall over 600,000 cars in Canada, drivers told to park away from buildings due to fire risk",0.97,https://www.ctvnews.ca/autos/hyundai-kia-recall-over-600-000-cars-in-canada-drivers-told-to-park-away-from-buildings-due-to-fire-risk-1.6580238
Wagamaga,,1695400402,,False,16peurc,False,False,t3_16peurc,13,False,/r/canada/comments/16peurc/canadian_fire_chiefs_deliver_climate_change/,2,,canada,Canadian fire chiefs deliver climate change message to United Nations following devastating season,0.52,https://www.cbc.ca/news/canada/british-columbia/fire-chief-brolund-un-speech-1.6974427
OptimalNectarine6705,,1695309140,,False,16oighj,False,False,t3_16oighj,28,False,/r/canada/comments/16oighj/edmonton_police_lose_bid_to_appeal_ruling_that/,107,"
This cop stole money from a homicide scene he was supposed to protect, and only confessed when he figured he was on camera. They later ran sting operations to see if he would steal evidence and he did, stealing cash from a car he was supposed to search and money from a “lost” purse an undercover officer had brought him to test him.

He was later convicted of two criminal offenses. He was then fired, which he appealed and won, and will now be reinstated get backpay totaling almost half a million dollars for the years of leave without pay.
 

If you call the police in Edmonton, be careful, you might have a convicted thief show up and steal your belongings. 


Imagine being convicted of 2 crimes including theft, done on the job and keeping your job. 

[Here is a video where a lawyer obtained a copy of the police board decision through a freedom of information request](https://youtu.be/jKF_hH_kMuI?si=fwaSy-SvMrjPOVe7)",canada,Edmonton police lose bid to appeal ruling that kept constable on the job after theft convictions | CBC News,0.93,https://www.cbc.ca/news/canada/edmonton/david-ahlstrom-chief-police-appeal-1.6966086
NickyC75P,,1695240542,,False,16nv37v,False,False,t3_16nv37v,281,False,/r/canada/comments/16nv37v/poilievre_vows_to_fire_senior_bureaucrats_who/,469,,canada,Poilievre vows to fire senior bureaucrats who preside over sluggish housing programs,0.87,https://www.cbc.ca/news/politics/poilievre-housing-bill-fire-bureaucrats-1.6972911
clotim,,1694775990,,False,16ja8o2,False,False,t3_16ja8o2,28,False,/r/canada/comments/16ja8o2/over_17_million_hectares_of_forest_went_up_in/,36,,canada,Over 17 million hectares of forest went up in flames this year. Canada has never been hit by fires this intense before. But what does 17 million hectares even mean? You can see it on your city here.,0.76,https://ici.radio-canada.ca/info/2023/evolution-carte-incendies-feux-de-foret-canada-quebec/
ialo00130,Yukon :Yukon:,1694726300,,False,16iu9a4,False,False,t3_16iu9a4,12,False,/r/canada/comments/16iu9a4/medical_officer_warns_of_hazardous_smoke/,22,,canada,Medical officer warns of 'hazardous' smoke billowing over Saint John from scrapyard fire | CBC News,0.81,https://www.cbc.ca/news/canada/new-brunswick/aim-fire-saint-john-1.6966339
Stampyisthecutestdog,,1694198638,,False,16dikpl,False,False,t3_16dikpl,0,False,/r/canada/comments/16dikpl/in_photos_thousands_of_bc_residents_return_to/,6,,canada,iN PHOTOS: Thousands of BC residents return to communities scarred by fire,0.67,https://infotel.ca/newsitem/thousands-of-north-shuswap-residents-return-to-communities-scarred-by-fire/it100381
Sensitive-Drummer421,,1694184542,,False,16dclyg,False,False,t3_16dclyg,13,False,/r/canada/comments/16dclyg/bc_hasnt_followed_recommendations_to_mandate/,51,,canada,B.C. hasn't followed recommendations to mandate fire-resistant building materials in hazard zones,0.87,https://vancouversun.com/news/local-news/b-c-has-not-followed-recommendations-to-mandate-building-requirements-in-wildfire-hazard-zones-in-past-20-years
Xylss,New Brunswick :NB:,1694120924,,False,16cqjot,False,False,t3_16cqjot,161,False,/r/canada/comments/16cqjot/nelson_housing_crisis_finally_puts_trudeaus_feet/,266,,canada,Nelson: Housing crisis finally puts Trudeau's feet to fire,0.84,https://calgaryherald.com/opinion/columnists/nelson-housing-crisis-trudeau
TorontoJueBlays,,1694115687,,False,16co6zs,False,False,t3_16co6zs,57,False,/r/canada/comments/16co6zs/pierre_poilievre_and_canadas_conservatives/,0,,canada,Pierre Poilievre and Canada’s Conservatives recruit Brexiteer and ‘canceled’ ex-general to fire up grassroots,0.49,https://www.politico.com/news/2023/09/07/canada-conservatives-poilievre-grassroots-00114542
Monomette,,1693262747,,False,1640ogq,False,False,t3_1640ogq,12,False,/r/canada/comments/1640ogq/yellowknife_fire_now_being_held_city_to_recall/,22,,canada,"Yellowknife fire now ‘being held,’ city to recall some critical staff",0.92,https://cabinradio.ca/147479/news/yellowknife/yellowknife-fire-now-being-held-city-to-recall-some-critical-staff/
morenewsat11,,1693151901,,False,162u5l9,False,False,t3_162u5l9,3,False,/r/canada/comments/162u5l9/nwt_under_heat_warnings_as_fire_nears_hay_river/,8,,canada,N.W.T. under heat warnings as fire nears Hay River community,0.66,https://www.ctvnews.ca/climate-and-environment/n-w-t-under-heat-warnings-as-fire-nears-hay-river-community-1.6536849
CapableSecretary420,,1693080270,,False,16254wv,False,False,t3_16254wv,16,False,/r/canada/comments/16254wv/climate_skeptics_misrepresent_footage_of/,0,,canada,Climate skeptics misrepresent footage of Northwest Territories fire suppression effort,0.45,https://factcheck.afp.com/doc.afp.com.33T39PR
altbekannt,,1693065589,,False,161yz3l,False,False,t3_161yz3l,48,False,/r/canada/comments/161yz3l/extreme_fire_weather_fueled_by_climate_change/,0,,canada,"Extreme fire weather fueled by climate change played significant role in Canada's wildfires, new report says",0.44,https://www.cbsnews.com/news/canadian-wildfires-climate-change-extreme-fire-weather-world-weather-attribution-report/
CapableSecretary420,,1692986629,,False,1616hnw,False,False,t3_1616hnw,3,False,/r/canada/comments/1616hnw/crews_in_nwt_expect_extreme_fire_activity_on/,26,,canada,"Crews in N.W.T. expect ""extreme"" fire activity on Friday",0.91,https://www.cbc.ca/news/canada/north/extreme-fire-conditions-nwt-1.6947647
einstein_bern,,1692919624,,False,160hztd,False,False,t3_160hztd,16,False,/r/canada/comments/160hztd/yellowknife_strip_club_owner_from_ns_driving/,13,,canada,Yellowknife strip club owner from N.S. driving water truck around fire-besieged city,0.67,https://www.saltwire.com/atlantic-canada/news/yellowknife-strip-club-owner-from-ns-driving-water-truck-around-fire-besieged-city-100884679/
lovelyb1ch66,,1692875770,,False,15zz1pv,False,False,t3_15zz1pv,63,False,/r/canada/comments/15zz1pv/bc_urges_cooperation_in_shuswap_as_fire_crews_say/,31,,canada,B.C. urges co-operation in Shuswap as fire crews say they are facing 'threats and abuse' from defiant locals,0.75,https://bc.ctvnews.ca/b-c-urges-co-operation-in-shuswap-as-fire-crews-say-they-are-facing-threats-and-abuse-from-defiant-locals-1.6532176
Stampyisthecutestdog,,1692817936,,False,15zdfuc,False,False,t3_15zdfuc,1,False,/r/canada/comments/15zdfuc/in_video_fire_tornado_whirls_during_wildfire_near/,13,,canada,iN VIDEO: Fire tornado whirls during wildfire near Lillooet,0.84,https://infotel.ca/newsitem/in-video-fire-tornado-whirls-during-wildfire-near-lillooet/it100101
The_Eternal_Void,Alberta :Alberta:,1692746595,,False,15ym9hr,False,False,t3_15ym9hr,72,False,/r/canada/comments/15ym9hr/climate_change_made_weather_conditions_that/,0,,canada,"Climate change made weather conditions that powered Quebec fires twice as likely, scientists say",0.35,https://www.cbc.ca/news/climate/quebec-climate-change-wildfires-research-1.6943502
einstein_bern,,1692661305,,False,15xoa3n,False,False,t3_15xoa3n,28,False,/r/canada/comments/15xoa3n/yellowknife_and_kelowna_fires_are_previews_of_our/,0,,canada,Yellowknife and Kelowna Fires Are Previews of Our Grim Future,0.27,https://thetyee.ca/Analysis/2023/08/21/Yellowknife-Kelowna-Fires-Previews-Grim-Future/
Lixidermi,,1692636481,,False,15xd0sc,False,False,t3_15xd0sc,689,False,/r/canada/comments/15xd0sc/cbc_trudeau_denounces_metas_news_block_as_fires/,507,,canada,[CBC] Trudeau denounces Meta's news block as fires force evacuations,0.81,https://www.cbc.ca/news/politics/trudeau-meta-wildfires-news-1.6942458
khanak,,1692628559,,False,15x9h51,False,False,t3_15x9h51,3,False,/r/canada/comments/15x9h51/yellowknife_veterinarian_helps_pets_flee_fires/,44,,canada,"Yellowknife veterinarian helps pets flee fires, supports animals left behind",0.96,https://globalnews.ca/news/9907344/yellowknife-wildfires-pets-veterinarian/
CapableSecretary420,,1692558670,,False,15wk09e,False,False,t3_15wk09e,184,False,/r/canada/comments/15wk09e/canada_to_deploy_armed_forces_in_british_columbia/,287,,canada,Canada to deploy armed forces in British Columbia to tackle fast-spreading fires,0.94,https://www.reuters.com/world/americas/fires-rage-british-columbia-more-residents-prepare-evacuations-2023-08-20/
HighFlight51,,1692545982,,False,15wemvq,False,True,t3_15wemvq,195,False,/r/canada/comments/15wemvq/how_to_increase_enlistment_in_volunteer_fire/,0," As  a former member of the military, and a former volunteer firefighter after that, and now a longstanding volunteer with various community groups,  I  just don't get it.  Why are so few young Canadians attracted to the idea  of service above self, and the prospect of doing exciting, demanding,  and immensely rewarding jobs?  Do they need to be asked to step up?

This  past week various news outlets have reported on multiple recruitment  crises in front-line agencies. Volunteer fire departments are down some  30,000 volunteers from a previous high.  The RCMP and other police  services across the country are struggling to meet recruitment targets.   And the military is vastly under-strength (by 16,000 members) and is  not attracting anywhere near the numbers needed to meet the needs of its  various missions.

[https://www.cbc.ca/news/canada/new-brunswick/volunteer-firefighter-shortage-new-brunswick-1.6865721](https://www.cbc.ca/news/canada/new-brunswick/volunteer-firefighter-shortage-new-brunswick-1.6865721)

[https://ottawa.ctvnews.ca/canadian-armed-forces-facing-member-shortage-crisis-1.6344761](https://ottawa.ctvnews.ca/canadian-armed-forces-facing-member-shortage-crisis-1.6344761)

[https://www.cbc.ca/news/politics/rcmp-duheme-recruitment-1.6937969](https://www.cbc.ca/news/politics/rcmp-duheme-recruitment-1.6937969)

It's  commonplace for the news media to cast blame for these problems on poor  working conditions, scandals and under-funding, but are those  explanations adequate?  Recruitment campaigns all seem to take the  approach of appealing to the selfish gene: join us: here is what we  offer you!  No-one these days is appealing to the notion of service  above self.  No-one is asking the younger generation to step up,  shoulder some of the burden, or do their duty.   We just NEVER hear that  kind of thing anymore.

What gives, Canada?  What needs to change?

0 comments ",canada,"How to increase enlistment in Volunteer Fire Dept's, Police & the Military?",0.47,https://www.reddit.com/r/canada/comments/15wemvq/how_to_increase_enlistment_in_volunteer_fire/
BurstYourBubbles,Canada,1692491511,,False,15vwj08,False,False,t3_15vwj08,42,False,/r/canada/comments/15vwj08/mapping_100_years_of_forest_fires_in_canada/,48,,canada,Mapping 100 years of forest fires in Canada,0.83,https://canadiangeographic.ca/articles/mapping-100-years-of-forest-fires-in-canada/
Cornefeelingsad,,1692405076,,False,15v1bur,False,False,t3_15v1bur,113,False,/r/canada/comments/15v1bur/fighting_100_years_worth_of_fires_in_one_night/,259,,canada,"'Fighting 100 years worth of fires in one night': Kelowna, B.C. residents share views as wildfires burn homes to the ground",0.93,https://ca.news.yahoo.com/kelowna-wildfires-british-columbia-photos-video-234035707.html
le_noirlife,,1692389200,,False,15uuth6,False,False,t3_15uuth6,803,False,/r/canada/comments/15uuth6/ottawa_demands_meta_lift_reckless_ban_on_news_to/,803,,canada,Ottawa demands Meta lift ‘reckless’ ban on news to allow fires info to be shared,0.83,https://www.theglobeandmail.com/canada/article-canada-demands-meta-lift-reckless-ban-on-news-to-allow-fires-info-to/
Hrmbee,Canada :Canada:,1692378699,,False,15uqcv9,False,False,t3_15uqcv9,1,False,/r/canada/comments/15uqcv9/thousands_ordered_to_evacuate_in_bcs_okanagan_as/,47,,canada,"Thousands ordered to evacuate in B.C.'s Okanagan as fast-moving wildfire threatens Kelowna, West Kelowna | States of emergency declared in both cities and First Nation due to 'unpredictable' McDougall Creek fire",0.87,https://www.cbc.ca/news/canada/british-columbia/what-you-need-to-know-about-bc-wildfires-aug-18-2023-1.6940311
YourLowIQ,,1692310165,,False,15u1g7u,False,False,t3_15u1g7u,4,False,/r/canada/comments/15u1g7u/yellowknife_evacuation_finally_in_the_path_of/,22,,canada,"Yellowknife evacuation: Finally in the path of fire, one of Canada’s northernmost cities is on the move",0.74,https://www.thestar.com/news/canada/yellowknife-evacuation-finally-in-the-path-of-fire-one-of-canada-s-northernmost-cities-is/article_6a563dbb-2a63-57a4-80df-5ae7ef3e909d.html
love010hate,,1692301091,,False,15txd7k,False,False,t3_15txd7k,21,False,/r/canada/comments/15txd7k/smoke_from_northwest_territories_fires_likely_to/,71,,canada,Smoke from Northwest Territories fires likely to spread to eastern Canada this weekend,0.85,https://www.ctvnews.ca/canada/smoke-from-northwest-territories-fires-likely-to-spread-to-eastern-canada-this-weekend-1.6523309
notlikelyevil,,1692284534,,False,15tq328,False,False,t3_15tq328,144,False,/r/canada/comments/15tq328/i_thought_id_put_up_this_photo_of_yellowknife_so/,613,,canada,"I thought I'd put up this photo of Yellowknife, so people can better understand the tree/fire situation.",0.94,https://www.century21yk.ca/blog/wp-content/uploads/2015/12/DSC_7619-1024x681.jpg
Wagamaga,,1692282529,,False,15tp7b9,False,False,t3_15tp7b9,4,False,/r/canada/comments/15tp7b9/bc_officials_warn_of_extreme_fire_behaviour_due/,22,,canada,"B.C. officials warn of 'extreme' fire behaviour due to heat wave, dry winds",0.77,https://bc.ctvnews.ca/heat-wave-and-dry-winds-causing-extreme-fire-behaviour-bc-wildfire-service-1.6523075
TorontoJueBlays,,1692144769,,False,15s9sf9,False,False,t3_15s9sf9,33,False,/r/canada/comments/15s9sf9/doug_ford_wont_fire_the_man_blamed_in_the/,126,,canada,Doug Ford won’t fire the man blamed in the Greenbelt scandal. But who’s he really protecting?,0.86,https://www.thestar.com/politics/political-opinion/doug-ford-won-t-fire-the-man-blamed-in-the-greenbelt-scandal-but-who-s/article_8146792e-15bc-54b1-8c05-e786c47a1de7.html
FancyNewMe,,1691948657,,False,15q57vl,False,False,t3_15q57vl,554,False,/r/canada/comments/15q57vl/justin_trudeau_is_under_fire_for_ottawas/,1375,,canada,Justin Trudeau is under fire for Ottawa’s lacklustre response to the housing crisis. Here is what’s going so wrong,0.91,https://www.thestar.com/politics/federal/justin-trudeau-is-under-fire-for-ottawa-s-lacklustre-response-to-the-housing-crisis-here/article_2f73d0c6-7fed-5390-9505-77f3a94103d9.html
CapableSecretary420,,1691786907,,False,15ok8zx,False,False,t3_15ok8zx,7,False,/r/canada/comments/15ok8zx/fire_hazard_sparks_recall_of_nearly_11000_kia/,38,,canada,"Fire hazard sparks recall of nearly 11,000 KIA cars in Canada",0.91,https://www.tricitynews.com/highlights/fire-hazard-sparks-recall-of-nearly-11000-kia-cars-in-canada-7397247
Sensitive-Drummer421,,1691685710,,False,15nhh0o,False,False,t3_15nhh0o,0,False,/r/canada/comments/15nhh0o/bc_court_denies_classaction_suit_for_damages_in/,7,,canada,"B.C. court denies class-action suit for damages in Lytton fire, but amended case could move forward",0.73,https://vancouversun.com/news/local-news/b-c-court-denies-class-action-suit-for-damages-in-lytton-fire-but-amended-case-could-move-forward
YourLowIQ,,1691522581,,False,15lrmta,False,False,t3_15lrmta,6,False,/r/canada/comments/15lrmta/canada_generations_old_and_new_scramble_to/,0,,canada,Canada: generations old and new scramble to contain fires burning at record pace | Wildfires,0.47,https://www.theguardian.com/world/2023/aug/08/canadian-wildfire-fighters-scramble-amid-nightmare-season
love010hate,,1691015906,,False,15gmc72,False,False,t3_15gmc72,8,False,/r/canada/comments/15gmc72/multiple_injuries_reported_at_world_police_and/,11,,canada,Multiple injuries reported at World Police and Fire Games event: Shared Health,0.72,https://winnipeg.ctvnews.ca/multiple-injuries-reported-at-world-police-and-fire-games-event-shared-health-1.6504376
mustafar0111,,1690926318,,False,15fpuk3,False,False,t3_15fpuk3,467,False,/r/canada/comments/15fpuk3/poilievre_fires_back_at_trudeau_says_housing_is_a/,587,,canada,"Poilievre fires back at Trudeau, says housing is a federal responsibility",0.86,https://www.cbc.ca/news/politics/poilievre-trudeau-housing-federal-responsibility-1.6924672
BeShifty,,1690908199,,False,15fhrvv,False,False,t3_15fhrvv,33,False,/r/canada/comments/15fhrvv/as_unprecedented_fire_year_rages_on_experts_warn/,0,,canada,"As unprecedented fire year rages on, experts warn of longer, more destructive seasons",0.44,https://www.cbc.ca/news/canada/calgary/longer-fire-seasons-alberta-western-canada-1.6908230
RockNRoll1979,,1690867024,,False,15f300o,False,False,t3_15f300o,72,False,/r/canada/comments/15f300o/quebec_trucking_company_ordered_to_reinstate/,82,,canada,Quebec trucking company ordered to reinstate driver fired for drinking and driving | Globalnews.ca,0.86,https://globalnews.ca/news/9867680/quebec-truck-company-drinking-driving-alcoholism/
YourLowIQ,,1690794370,,False,15eau2z,False,False,t3_15eau2z,1,False,/r/canada/comments/15eau2z/wildfire_fighter_in_bc_dies_on_front_lines_of/,49,,canada,Wildfire fighter in B.C. dies on front lines of largest fire in province's history,0.9,https://www.cbc.ca/news/canada/british-columbia/bc-wildfire-fighter-dies-1.6922372
cyclinginvancouver,,1690664570,,False,15d2u92,False,False,t3_15d2u92,4,False,/r/canada/comments/15d2u92/firefighter_killed_in_line_of_duty_in_prince/,48,,canada,Firefighter killed in line of duty in Prince George Fire Centre region: BC Wildfire Service | Globalnews.ca,0.91,https://globalnews.ca/news/9865476/bc-firefighter-killed-prince-george-fire-centre
