author,author_flair_text,created_utc,distiguished,edited,id,is_original_content,is_self,name,num_comments,over_18,permalink,score,selftext,subreddit,title,upvote_ratio,url
Mariyyaax,,1592246272,,False,h9m24i,False,True,t3_h9m24i,6,False,/r/canadatravel/comments/h9m24i/travel_restrictions_canada/,2,"Hi everyone, I was wondering whether anyone has had any luck contacting Travel Canada or the Canadian govt to find out about travel restrictions? I understand that they are not allowing any travel unless it's essential. I'm supposed to be flying to Canada (from Scotland) this summer to get married to my fiance who is Canadian (our wedding is still on -we have checked), and I've been trying to figure out whether they would constitute that as essential travel as everyone I have emailed is replying with an automated email, and I can't get through to any phone number. Does anyone have any suggestions of who I should contact? TIA x",canadatravel,Travel restrictions Canada,1.0,https://www.reddit.com/r/canadatravel/comments/h9m24i/travel_restrictions_canada/
masonandco,,1591368941,,False,gx633j,False,True,t3_gx633j,5,False,/r/canadatravel/comments/gx633j/toronto_to_halifax_road_trip/,1,"My husband and I are (optimistically) planning a Toronto to Halifax road trip in the late summer/fall (assuming restrictions are lifted). We're hoping to hike, sightsee and visit historical sites. Has anyone done this drive? Any places you suggest seeing? We're more interested in the final location than the drive but are open to all options!",canadatravel,Toronto to Halifax Road Trip,1.0,https://www.reddit.com/r/canadatravel/comments/gx633j/toronto_to_halifax_road_trip/
rainontent,,1591208079,,False,gvz77p,False,True,t3_gvz77p,0,False,/r/canadatravel/comments/gvz77p/domestic_flight_with_swoop/,1,"Hey guys!
Has anyone had luck getting credits from a domestic flight with Swoop?

My family has flights to New Brunswick booked next month to visit my brother (booked long before the pandemic) and, as I’m sure most of us are aware, NB is prohibiting visitors and sending them away if they arrive. 

Swoop says I can’t cancel and receive credits because “there are no travel restrictions in the country”.  I’m hoping not to simply reschedule since you are only able to do so once and within a short time frame and I don’t think we’ll be traveling this year.

Just wondering if anyone has had luck with them! I’ve sent links and screenshots from the NB tourism site showing that they are not allowing visitors and am waiting to hear back from them again.",canadatravel,Domestic flight with Swoop,1.0,https://www.reddit.com/r/canadatravel/comments/gvz77p/domestic_flight_with_swoop/
HippieCJ,,1588951850,,False,gfv9hu,False,True,t3_gfv9hu,0,False,/r/canadatravel/comments/gfv9hu/swoop_airlines_being_shady_covid_refund/,1,"Myself along with 2 others had flights booked to Mexico for the end of April.  2 emails were sent to me stating I had to option to change my flight dates due to Covid at no charge.  I then was sent a flight cancellation notice on March 23rd stating

 ""One or more of your flights has been cancelled **Due to Coronavirus (COVID-19) outbreak:**

Travel restrictions have been imposed for all flights entering Canada. As such, Swoop is suspending all international and transborder flights until May 31, 2020.

Your reservation qualifies for a Swoop credit\* for the full value of your original purchase, including Extras (bags, seats, etc.).""

I ended up opting for the credit thinking it was my only option.  

However, I just went to Swoop's FAQ and there I found these:

### Will Swoop cancel all of its flights amid COVID-19?

We have not yet cancelled a flight because of the coronavirus, and we are continuing to fly to all of our destinations. We will continue to closely monitor the situation and change and update our schedule accordingly.

### I’d like a refund. Why can’t I get a refund?

With respect to requests for refunds to original form of payment, more information will be provided at a later date. The Canadian Transportation Agency has also recently provided guidance on this, and you can find their statement here: [https://otc-cta.gc.ca/eng/statement-vouchers ](https://otc-cta.gc.ca/eng/statement-vouchers).

We are currently offering travel credit for transborder and international flights; more information can be found here: [https://www.flyswoop.com/making-changes-to-your-flight/](https://www.flyswoop.com/making-changes-to-your-flight/) .

&#x200B;

They literally say they have not cancelled flights due to Covid, yet I have an email from them saying my flight is cancelled due to Covid.   

&#x200B;

Do I have grounds to request my Swoop credit be given back to me as a refund?",canadatravel,Swoop Airlines being Shady (Covid refund),1.0,https://www.reddit.com/r/canadatravel/comments/gfv9hu/swoop_airlines_being_shady_covid_refund/
KeekyPep,,1686703654,,False,148uabr,False,True,t3_148uabr,14,False,/r/canadatravel/comments/148uabr/dui/,3,"My sister and brother-in-law were scheduled to go on a cruise to Canada later this year. They just learned that having a DUI prohibits a non-citizen from visiting Canada for 10 years.  BIL got a DUI about a year or so ago.  (He has since addressed all of the legal issues and has quit drinking).  Most likely they will cancel the cruise but I was wondering if anyone had experience with this issue?  Does Immigration in Canada “check” this and, if so, how?",canadatravel,DUI,0.71,https://www.reddit.com/r/canadatravel/comments/148uabr/dui/
imnotofuckingk2023,,1684965448,,False,13qz3ey,False,True,t3_13qz3ey,25,False,/r/canadatravel/comments/13qz3ey/us_citizen_travel_to_canada_without_passport/,8,"I have a friend's wedding coming up in Canada in a week. I just realized my passport is expired (I'm from the US). I've called the government passport office for expediting but they have no appointments available. I've also tried paying a ridiculous amount for FedEx's expediting service, but it took 3 days of calling customer support while their phone lines were busy, just to find out that they cannot guarantee my passport in time. Lastly, I looked into the Nexus card but that wait list is at 1 month+.  
  
Is there any way I can legally get from Chicago to Calgary? I've considered driving straight up to the border and then taking a domestic flight within Canada, however my state does not issue the ""Enhanced Drivers License"" so I'm afraid I will be prohibited from plane travel altogether up there.  
  
Am I screwed or are they ANY other options? (Unfortunately driving the entire 1.5 day-long route from Chicago to Calgary is not an option.)",canadatravel,"US citizen, travel to Canada without passport?",0.83,https://www.reddit.com/r/canadatravel/comments/13qz3ey/us_citizen_travel_to_canada_without_passport/
Coming_In_Hot_916,,1684274317,,False,13jikg4,False,True,t3_13jikg4,4,False,/r/canadatravel/comments/13jikg4/can_i_enter_canada_from_the_us_if_i_had_a_dui/,2,"I have a business trip coming up where I need to go to Toronto.   
I've heard that I can not enter if I have **ever** had a DUI.    
I got a DUI 22 years ago in 2001. Will this prohibit me from traveling to Canada?",canadatravel,Can I enter Canada from the US if I had a DUI?,0.75,https://www.reddit.com/r/canadatravel/comments/13jikg4/can_i_enter_canada_from_the_us_if_i_had_a_dui/
