author,author_flair_text,created_utc,distiguished,edited,id,is_original_content,is_self,name,num_comments,over_18,permalink,score,selftext,subreddit,title,upvote_ratio,url
ilikelegoandcrackers,,1583860833,,1585102026.0,fghd23,False,True,t3_fghd23,809,False,/r/canada/comments/fghd23/psa_regarding_covid19_a_warning/,8573,"[NEW: As requested, a [downloadable PDF](https://docdro.id/30e3nnc) version of this document is now available to email to relatives]

If you just want to learn how to reduce your risk of catching COVID-19, scroll down to the ""Risk Reduction"" section. However, to appreciate the full scope of the challenge ahead, you are encouraged to carefully read this entire document, which will be updated regularly as long as it stays on the front page of your sub.

The aim of this document is simple: it's best to walk into something knowing what you're about to face. It also aims to reduce anxiety, panic, and misinformation by arming you with key sourced information, all without downplaying the risks of COVID-19.

The document has gone through hundreds of iterations thanks to global community feedback, including from places such as Seattle, LA, Australia, and Canada. Although all facts are meticulously sourced from experts in their fields, you are responsible for your own health and your own research. 

Further, contextualization of information remains an ongoing challenge, as does keeping up with a fluid situation. Final word will always belong to the health authorities, as well as the mods of this subreddit.

Now brace yourself, because this is going to suck a little bit.

#**CONTEXT:**

A recent in-depth [study](https://arxiv.org/ftp/arxiv/papers/2002/2002.03268.pdf) has shown just how incredibly infectious COVID-19 is. Unfortunately, its spread [has not slowed](https://old.reddit.com/r/datascience/comments/fe4uza/how_would_you_visualize_the_evolution_of/), and the virus has only been halted through stringent physical distancing measures.

In other words, and as the Director of the WHO himself has [said](https://twitter.com/DrTedros/status/1235635005415739393), this is not a drill.

**The bad news:** There are currently over [420,000](https://gisanddata.maps.arcgis.com/apps/opsdashboard/index.html#/bda7594740fd40299423467b48e9ecf6) global confirmed cases of COVID-19, and the WHO has classified it as a pandemic. Now it seems that it has arrived upon your doorstep, which means there is likely exponential and silent human-to-human transmission in the community.

**The good news:** knowledge is a weapon that defeats these things. It worked in 1918 against the Spanish Flu, when we essentially stopped the medieval practice of blood-letting (you know when they drained you of blood because they thought that would cure whatever ailed you? Or leeching?). And it worked against many other outbreaks since: Smallpox, MERS, SARS, Ebola, etc. The WHO's tackling of Smallpox alone was nothing short of scientific heroism.

And so, a hundred years after 1918, here we are again, facing perhaps the [greatest test of our generation](https://twitter.com/Channel4News/status/1235994748005085186).

The problem is that these days we're inundated with so much information that, when a real threat comes along, it's buried under a mountain of clutter. And although this document is not all-encompasing by any means, hopefully it will help you see through some of that clutter, as well as give those new to the threat an opportunity to hit the ground running.

So go ahead and meet [your foe](https://i.imgur.com/okCsxd1.jpg). Do not underestimate it. 

Now prepare to go to war.

#**IMPORTANT:**

* **The main mode of transmission is via respiratory droplets: coughing, sneezing, and breathing.** But you can also get it through shaking hands, kissing somebody who is sick, or touching a contaminated surface (droplet dispersion; think of a cough plume settling). This can include handrails, doorknobs, elevator buttons, and surfaces prone to a droplet dispersion cloud. ""Cough dispersion"" basically means anytime a sick person coughs, they're dispering a plume of droplets over a given area. The viral particles within those droplets then settle on ordinary surfaces. People touch those surfaces then touch their phones or their faces, which in turn lead to contact with their eyes, mouth, or nose, inducing infection. Therefore it is best to keep a 6 ft ""coughing distance"" from people, and treat everything you touch in public as if it's been contaminated (see the ""Risk Reduction"" section below). **[Here's](https://www.youtube.com/watch?v=2bI5pQGXl2o&feature=youtu.be) an excellent short video on the topic.** Read a little more on the subject [here](https://www.npr.org/sections/goatsandsoda/2020/03/05/812570693/how-coronavirus-spreads-a-cough-in-your-face-or-a-kiss-on-your-cheek).

* **[AWAITING PEER REVIEW, BUT IS GAINING [ACCEPTANCE](https://www.nytimes.com/2020/03/02/health/coronavirus-how-it-spreads.html?0p19G=2870) IN THE SCIENTIFIC COMMUNITY]** There now appears to be evidence the virus can spread through breathing. Michael Osterholm, PhD, MPH, director of the Center for Infectious Disease Research and Policy at the University of Minnesota: **""The findings [of the study] confirm that COVID-19 is spread simply through breathing, even without coughing. Don't forget about hand washing, but at the same time we've got to get people to understand that if you don't want to get infected, you can't be in crowds. Social distancing is the most effective tool we have right now.""** [Source.](http://www.cidrap.umn.edu/news-perspective/2020/03/study-highlights-ease-spread-covid-19-viruses) (Crucial to understand: the research specifies patients who are symptomatic, and makes no claims about asymptomatic transfer.) **UPDATE:** [Dr. Osterholm just went on the Joe Rogan show to explain the situation](https://www.youtube.com/watch?v=E3URhJx0NSw). Although the show itself has been known to be controversial, the Doctor's [credentials](https://en.wikipedia.org/wiki/Michael_Osterholm) speak for themselves.

* **[AWAITING PEER REVIEW]** A new study indicates COVID-19 can survive in the air for up to 3 hours, and several days on surfaces, depending on the surface (up to 3 days on plastic, up to 2 days on metal, up to 1 day on cardboard). ([Article](https://thehill.com/policy/healthcare/487110-tests-indicate-coronavirus-can-survive-in-the-air) | [Study](https://www.medrxiv.org/content/10.1101/2020.03.09.20033217v1.full.pdf)). [Here's a shadowgraph imaging](https://media.wired.com/clips/5e6a65157c07c90008d05257/360p/pass/PLoS-video-V3.mp4) of people breathing ([source](https://www.wired.com/story/they-say-coronavirus-isnt-airborne-but-its-definitely-borne-by-air/)). Unfortunately it is a bit misleading as it does not show drop dispersion, but gets the point across.

* **[AWAITING PEER REVIEW]** New analysis seems to indicate infected people without symptoms might be driving the spread of coronavirus more than we realized (CNN [link](https://www.cnn.com/2020/03/14/health/coronavirus-asymptomatic-spread/index.html), with links to multiple studies in the article). This is corroborated by Dr. Norman Swan on March 14th, via ABC Australia, who says ""you *are* infectious *before* the symptoms come out, there's no question about that."" The WHO says you are infectious for about 48 hours prior to showing first symptoms. (Source 1: Dr. Swan: see minute mark 4:02 in [this health alert video](https://www.abc.net.au/news/2020-03-15/dr-norman-swan-recommends-proactive-national-lockdown/12057956)), ([Source 2](https://www.sciencenews.org/article/coronavirus-most-contagious-before-during-first-week-symptoms)). **ALERT: It is now generally believed that this is the reason the virus is taking so many communities by surprise: it spreads during that crucial asymptomatic/low-symptom stage.** 

* **WARNING:** March 16th Article, based on fresh research: ""80% of COVID-19 spreads from people who don't know they are sick"" ( [Article](https://www.upi.com/Health_News/2020/03/16/80-of-COVID-19-spreads-from-people-who-dont-know-they-are-sick/7771584372104/?ds=5) | [Study](https://science.sciencemag.org/content/early/2020/03/13/science.abb3221) | [Discussion 1](https://www.reddit.com/r/COVID19/comments/fjntyc/substantial_undocumented_infection_facilitates/) | [Discussion 2](https://www.reddit.com/r/Coronavirus/comments/fjre8d/80_of_covid19_spreads_from_people_who_dont_know/) )

* **WARNING: We are past containment. It is now vital to [flatten the curve](https://www.livescience.com/coronavirus-flatten-the-curve.html) and implement physical distancing measures. [A short GIF](https://i.imgur.com/KpJWSm4.gif) on how we stop the virus from spreading.** 

* **Up to 1 in 5 infected people may require hospitalization** [source 1](https://www.who.int/docs/default-source/coronaviruse/who-china-joint-mission-on-covid-19-final-report.pdf), [source 2](https://medium.com/@amwren/forget-about-the-death-rate-this-is-why-you-should-be-worried-about-the-coronavirus-890fbf9c4de6). But this is an oversimplification as the metric skews toward the elderly and those with comorbidities (see the Mortality/Comorbidities section below). Plus the metrics differ based on [region and testing capacity](https://www.statnews.com/2020/03/10/simple-math-alarming-answers-covid-19/). [Excellent short video](https://www.youtube.com/watch?v=OOJqHPfG7pA&feature=youtu.be) on the topic.

* Here's a breakdown of the above: Approximately 80% of laboratory confirmed patients have had mild to moderate disease, which includes non-pneumonia and pneumonia cases. 13.8% have had severe disease requiring hospitalization, and 6.1% were critical, requiring the ICU (respiratory failure, septic shock, and/or multiple organ dysfunction/failure). (These numbers are as of Feb 20, 2020, based on 55,924 laboratory confirmed cases in China, from the [WHO report](https://www.who.int/docs/default-source/coronaviruse/who-china-joint-mission-on-covid-19-final-report.pdf).)
 **Update:** European Society of Intensive Care Medicine is reporting a 10% ICU rate, and has [issued a word of warning](https://twitter.com/marcelsalathe/status/1235662457261023232).

* Due to the highly infectious nature of COVID-19, **the danger is not just the mortality rate for the vulnerable, but the possibility of overwhelming the health infrastructure, which in turn causes unnecessary fatalities.** 

* As it stands, it wouldn't take much to overwhelm hospitals, hence why it's important to start taking preventative measures now (outlined in the Risk Reduction section below)—especially because hospitals are already burdened with a heavy flu season (in the Northern hemisphere, that is). For example, if only 10 out of every 1000 people required a bed, we'd already be coming up short, as in the USA there are only [2.77](https://en.wikipedia.org/wiki/List_of_OECD_countries_by_hospital_beds) beds for every 1000 people, and [2.58](https://en.wikipedia.org/wiki/List_of_OECD_countries_by_hospital_beds) in Canada. Why is this important? **In South Korea, 4 in 22 deaths happened while waiting to be hospitalized** ([source](https://n.news.naver.com/article/005/0001294063) in Korean, as well as a [discussion](https://www.reddit.com/r/Coronavirus/comments/fbxm0s/south_korea_4_in_22_deaths_happened_while_waiting/) about it), and that's from South Korea, who is #2 in the world bedcount-wise with [12.27](https://en.wikipedia.org/wiki/List_of_OECD_countries_by_hospital_beds) beds per 1000 people. And of course many beds will already be occupied for regular patients. [Toronto Star soberly warns hospitals can’t cope if coronavirus outbreak worsens in Canada: March 6th.](https://www.thestar.com/politics/federal/2020/03/06/hospitals-warn-they-cant-cope-if-coronavirus-outbreak-worsens-in-canada.html)

* A surgeon working in the heart of Italy's outbreak gives a harrowing testimony and urges everyone to heed the warning that it can easily overwhelm hospitals ([translation](https://www.reddit.com/r/Coronavirus/comments/ffa2tf/testimony_of_a_surgeon_working_in_bergamo_in_the/fjx5tc8/) / [Original](https://bergamo.corriere.it/notizie/cronaca/20_marzo_07/coronavirus-bergamo-medico-humanitas-facebook-situazione-drammatica-altro-che-normale-influenza-4fdf6866-6088-11ea-8d61-438e0a276fc4.shtml)).

* This is a ""novel"" virus, which means the immune system has never been exposed to it and therefore everyone is susceptible. There is no vaccine, nor do authorities expect one for some time.

* A [superb short video](https://www.youtube.com/watch?time_continue=491&v=BtN-goy9VOY&feature=emb_logo) by Kurzgesagt on how the virus works, among other thigns of note.

* People are thought to be most contagious when they are most symptomatic (the sickest). (Source: [CDC](https://www.cdc.gov/coronavirus/2019-ncov/about/transmission.html))

* **Update:** March 18th: Young people are getting extremely sick from coronavirus, according to new evidence ( [article](https://fortune.com/2020/03/18/coronavirus-young-people-getting-sick-covid-19-us-italy-france/) | [discussion](https://www.reddit.com/r/Coronavirus/comments/fl4ztb/young_people_are_getting_extremely_sick_according/) ). A young person's [dire warning](https://twitter.com/bradleyziffer/status/1240676575168921600?s=21).

* **Update:** March 17th: ""Prepare to see COVID-19 cases rising. That doesn't mean social distancing has failed: Impacts won't be apparent for at least two weeks and probably longer, experts say"" ([source](https://www.cbc.ca/news/health/corona-virus-covid-19-1.5499872))

* **Update:** ""Coronavirus: Why You Must Act Now | Politicians, Community Leaders and Business Leaders: What Should You Do and When?"" ([link](https://medium.com/@tomaspueyo/coronavirus-act-today-or-people-will-die-f4d3d9cd99ca))

* **Update:** Excellent quick read on how normalcy lulls and how quickly this thing can hit, by The Washington Post: ""When a danger is growing exponentially, everything looks fine until it doesn’t"" ([link](https://www.washingtonpost.com/opinions/2020/03/10/coronavirus-what-matters-isnt-what-you-can-see-what-you-cant/) | [archive link](https://archive.fo/XOSq0))

* **Update:** CNN: ""Take this seriously. Coronavirus is about to change your life for a while"" ([link](https://www.cnn.com/2020/03/11/politics/what-matters-coronavirus-is-about-to-change-your-life/index.html))

* **Update:** WHO director: ""We are deeply concerned both by the alarming levels of spread and severity, and by the alarming levels of inaction."" ([link](https://abcnews.go.com/US/coronavirus-cases-surpass-1000-us-tsa-agents-test/story?id=69525688&cid=social_twitter_abcn))

* **Update:** ""Any country that looks at the experience of other countries with large epidemics and thinks that it won’t happen to us is making a deadly mistake,"" [warned the WHO](https://twitter.com/reuters/status/1238560462524035073?s=21).

* **Update:** ""People infected with #COVID19 can still infect others after they stop feeling sick, so these measures should continue for at least 2 weeks after symptoms disappear. Visitors should not be allowed until the end of this period. There are more details in WHO’s guidance"" ([Source: WHO](https://twitter.com/WHO/status/1239582223810072576))

* **Update:** March 17th: [Short video of the situation in a hospital in Bergamo, Italy.](https://twitter.com/Laethageal/status/1239699270577553409) 

* **Update:** March 20th: ""Not sure we've communicated well enough that social distancing interventions will pay dividends in 1-3 weeks. Anything that happens in the next 10 days was already baked in prior to that. A surge in cases now would NOT mean that social distancing isn't working."" —[Kate Allen](https://twitter.com/katecallen/status/1241002377148276736), Science reported for Toronto Star

* **Update:** Viewer discretion is advised: [A heartbreaking look](https://news.sky.com/story/coronavirus-everyone-dies-alone-heartbreak-at-italian-hospital-on-brink-of-collapse-11961130) into the frontlines of an Italian hospital. Do not underestimate this virus.

#**PSYCHOLOGY:**

* Do not panic, but give yourself permission to feel fear. [Fear gets you prepared](http://www.psandman.com/col/teachable.htm). As for panic, all one has to do is look at the crowded halls of Wuhan hospitals during the early phases of the outbreak to understand how panic worsens problems. A jolt of fear is all right, as it gets you moving in the right direction. After that point, however, you must turn to thinking clearly, level-headedly, and listen to your local health authorities. As for what you can do, follow the steps in the ""Risk Reduction"" section below.

* Ignoring this threat will only make it worse, as it preys on your underestimation of it. That underestimation may cost you your life, or the life of a loved one.

* Upon first learning about the extent of the threat, you may become anxious and hyper aware and start taking extra pecautions. This is normal, what psychologists call an *adjustment reaction*. [A short guide on how to cope](http://www.psandman.com/col/teachable.htm).

* [Normalcy bias](https://en.wikipedia.org/wiki/Normalcy_bias) plays a factor. So does denial. You may hear things like ""it's just a flu, nothing to worry about."" It is [dangerously inaccurate](https://www.propublica.org/article/this-coronavirus-is-unlike-anything-in-our-lifetime-and-we-have-to-stop-comparing-it-to-the-flu) to compare COVID-19 to the flu. Facing the threat will help you prepare for it while denial puts you and your loved ones at risk. People in denial may take foolish risks like attend crowded events during an active outbreak, or fail to take precautionary measures, thereby accidentally passing the virus on to others. Denial also slows community response.

* [Here is an excellent Harvard piece](https://nieman.harvard.edu/wp-content/uploads/pod-assets/microsites/NiemanGuideToCoveringPandemicFlu/CrisisCommunication/HowDoPeopleReactInAPandemic.aspx.html) on reactions and overreactions, denial versus panic, and the five principle bulwarks against denial. It is short and absolutely worth your time.

* For officials, [crisis management teaches us](http://www.psandman.com/col/fear.htm) that it is important not to downplay a threat, otherwise you may lose the public's trust. Do not fear inducing a panic (see the aforementioned paper). The public needs you to be clear, informative, competent, and proactive. Studies such as [this one](https://jamanetwork.com/journals/jama/fullarticle/208354) about the 1918 pandemic have shown just how effective a proactive approach can be on the part of leadership. But [look what can happen](https://www.smithsonianmag.com/history/philadelphia-threw-wwi-parade-gave-thousands-onlookers-flu-180970372/) on the other end of the spectrum. Update: [A warning for leadership](https://medium.com/@tomaspueyo/coronavirus-act-today-or-people-will-die-f4d3d9cd99ca). Update: [Speed trumps perfection](https://twitter.com/ConallMcD/status/1238865202868883461).

* [Astronaut Chris Hadfield provides useful steps to productive self-isolation](https://www.youtube.com/watch?time_continue=112&v=4uL5sqe5Uk8&feature=emb_logo)

* [Here's what mental health experts have to say on how to stay calm during the pandemic.](https://archive.fo/6eYoK#selection-887.0-887.79) Also, two pyschology doctors have published a [self-help guide](https://www.psychologytools.com/articles/free-guide-to-living-with-worry-and-anxiety-amidst-global-uncertainty/) on managing worry and anxiety during the coronavirus crisis.

* If you're still experiencing distress, please consider visiting COVID-19 [mental health support](https://www.reddit.com/r/COVID19_support/).

#**RISK REDUCTION:**

Think of those in your life who are vulnerable (see the Comorbidities section). If not for yourself, do it for them.

* **To reiterate, we are *past* containment. It is now vital to [flatten the curve](https://www.livescience.com/coronavirus-flatten-the-curve.html) and implement physical distancing measures.**

* Practice [physical distancing](https://globalnews.ca/news/6652654/social-distancing-coronavirus/). Here's [why it works](http://smaldino.com/wp/covid-19-modeling-the-flattening-of-the-curve/). An excellent [visual](https://www.washingtonpost.com/graphics/2020/world/corona-simulator/) example of why it works.

* Do not touch your face (practice this one at home, as [it's harder than you think](https://www.usatoday.com/story/news/health/2020/03/08/coronavirus-prevention-how-stop-touching-your-face/4965517002/)).

* After *every* outing, [wash your hands](https://www.reddit.com/r/Coronavirus/comments/fmjbsk/washing_your_hands_is_more_effective_than_hand/) and disinfect your phone (the virus can likely [live up to 96 hours on phone screens](https://qz.com/1810508/covid-19-can-likely-live-up-to-96-hours-on-your-phone/)). And you're probably washing your hands wrong. [Here's a short 1.5 minute tutorial](https://www.youtube.com/watch?v=3PmVJQUCm4E) by the WHO. 

* Carry disinfectant with you. But if you don't have any, know that soap works better than alcohol and disinfectants at destroying the structure of viruses ([source](https://www.marketwatch.com/story/deadly-viruses-are-no-match-for-plain-old-soap-heres-the-science-behind-it-2020-03-08?reflink=mw_share_facebook))

* Do not shake hands.

* While in public, try to keep a coughing distance from people, which is at least 6 feet.

* Treat everything you touch in public as a contaminated surface.

* If you use a travel mug, be sure to disinfect it after *every* outing.

* Disinfect doorknobs and often-touched places, especially keyboards and phones. Also disinfect reusable shopping bags, wallets, keys.

* Take initiative and disinfect doorknobs and elevator buttons in your building. Do not wait for management to do it for you.

* Keep disinfectant by every entrance to your house. 

* Avoid anyone who is coughing, and [stay away from poorly ventilated places](https://www3.nhk.or.jp/nhkworld/en/news/20200302_34/). 

* Stay away from crowds. 

* Wear a mask in public when possible ([study](https://www.ncbi.nlm.nih.gov/pmc/articles/PMC3323085/) | [discussion](https://www.reddit.com/r/COVID19/comments/fmla3q/sarscov1_frequent_mask_use_in_public_venues/) | [article](https://www.nytimes.com/2020/03/17/opinion/coronavirus-face-masks.html))

* Cough into your elbow, or preferably into a tissue that is disposed of into the trash.

* While in public, only touch things with your knuckle, a glove, or your sleeve. Touch elevator buttons with the tip of your key.

* Ask your boss to work from home as many transmissions happen at work.

* There is a global shortage of face masks. If you have extra, be prepared to donate some should the hospitals/care homes send a call out to the community.

* If you have extra bottles of hand-sanitizer, please consider sharing them with those who do not have any. This is about working together, and minimizing community spread helps everyone within the community, including you and your loved ones.

* [Take extra precautions when shopping for groceries, even when buying online.](https://www.consumerreports.org/food-shopping/how-to-protect-yourself-from-coronavirus-when-grocery-shopping/?EXTKEY=EE032IBAC&utm_source=acxiom)

* Have 14 days of food in your home in case you are ordered under quarantine. There's nothing wrong with preparatory shopping in case of quarantine, but be careful not to do this once an outbreak has been declared in your city, as you may be lining up alongside sick people. At that point, it is better to shop at night/off hours, and after taking careful precautions. Or consider ordering your groceries online.

* Don't share a cup. Don't share eating utensils. Don't share a toothbrush. In fact, don't share anything that comes in direct contact with your mouth or nose.

* Keep air circulating. Dispersing droplets can keep you from getting a hefty, infectious dose. Open a window; turn on a fan. ([source](https://www.npr.org/sections/goatsandsoda/2020/03/05/812570693/how-coronavirus-spreads-a-cough-in-your-face-or-a-kiss-on-your-cheek))

* Use a humidifier. Keeping the humidity up will [keep the protective membranes in your nose from drying out](https://www.ncbi.nlm.nih.gov/pmc/articles/PMC3583861/), which makes them less effective as they try to keep pathogens out. Mid-range humidity also appears to cause some viruses to decay faster.

* Besides practicing physical distancing, always remember the top three: disinfect your phone, don't touch that ugly face of yours, and wash your filthy hands. After *every* outing. Seriously, if there's *one* thing you take away from this, do these three things. They may just save your life, or the life of a loved one.

* A [nifty GIF](https://thespinoff.co.nz/wp-content/uploads/2020/03/Covid-19-curves-graphic-social-v3.gif) to show the importance of taking precautions now.

* Be proactive. How can *you* help?

#**INCUBATION PERIOD:**

* People generally develop signs and symptoms, including mild respiratory symptoms and fever, on an average of 5.1 days after intial infection.

* 97.5% develop symptoms within 11.5 days. 

* ""Current 14 day quarantine recommendation is 'reasonable' as only 1% will develop symptoms after release from 14 day quarantine.""

* [Source](https://annals.org/aim/fullarticle/2762808/incubation-period-coronavirus-disease-2019-covid-19-from-publicly-reported) / [Discussion](https://www.reddit.com/r/science/comments/fg4a74/covid19_median_incubation_period_is_51_days/) with regards to this section.

#**TYPICAL SYMPTOMS:**

(All direct from [WHO report](https://www.who.int/docs/default-source/coronaviruse/who-china-joint-mission-on-covid-19-final-report.pdf) based on 55,924 laboratory confirmed cases in China.)

* Fever (87.9%)

* Dry cough (67.7%)

* Fatigue (38.1%)

* Sputum production (33.4%) (a mixture of saliva and mucus coughed up from the respiratory tract)

* Shortness of breath (18.6%)

* Sore throat (13.9%)

* Headache (13.6%)

* Joint pain (14.8%)

* Chills (11.4%)

* Nausea or vomiting (5.0%)

* Nasal congestion (4.8%)

* Diarrhea (3.7%)

* Hemoptysis (0.9%) (coughing up of blood or blood-stained mucus from the bronchi, larynx, trachea, or lungs)

* Conjunctival congestion (0.8%) 

* [NEW] Unexplained loss of sense of smell/taste (As per [doctor's group discovery](https://www.nytimes.com/2020/03/22/health/coronavirus-symptoms-smell-taste.html?action=click&module=Top%20Stories&pgtype=Homepage)) (30%, [source](https://www.sciencealert.com/mild-covid-19-might-cause-a-lost-of-smell-or-taste))

[Here is what those symptoms look like on a visual timeline, in Fahrenheit](https://i.imgur.com/BBOfWA5.jpg). 

[Here it is in Celsius](https://wwwnc.cdc.gov/eid/article/26/6/20-0452-f1). 

A new chart with an excellent [timeline of symptoms on the right](https://pbs.twimg.com/media/ETfTxfaU0AE4zOR?format=jpg&name=4096x4096)

Health Canada: [What to do if you're ill.](https://www.canada.ca/en/public-health/services/diseases/2019-novel-coronavirus-infection/symptoms.html#i)

[CDC: What to do in your home if someone is sick](https://www.cdc.gov/coronavirus/2019-ncov/community/home/index.html?CDC_AA_refVal=https%3A%2F%2Fwww.cdc.gov%2Fcoronavirus%2F2019-ncov%2Fcommunity%2Fget-your-household-ready-for-COVID-19.html)

Want to know the difference between a flu, a cold, and Covid-19? [Here's a nifty visual](https://i.imgur.com/mkQzAJV.jpg).

What Happens When You Get Coronavirus, and when should you go to the hospital? [An excellent short official Canadian Public Health video](https://www.youtube.com/watch?v=MyQj1HtWTEo)

What does it feel like to be sick? [The New York Times spoke to six people with the virus](https://www.nytimes.com/2020/03/04/us/coronavirus-recovery.html).

#**COMORBIDITIES:**

Underlying medical conditions that may increase the risk of serious COVID-19 for individuals of any age:

* People 60 years of age and older

* Diabetes (more [here](https://www.diabetes.org/diabetes/treatment-care/planning-sick-days/coronavirus))

* Hypertension

* Cardiovascular disease

* Chronic respiratory disease

* Heart or kidney disease 

* Cancer

* Those with weakened immune systems

* Obesity ([source](https://youtu.be/E3URhJx0NSw?t=283) / [credentials](https://en.wikipedia.org/wiki/Michael_Osterholm) of source)

* People with weakened respiratory system due to [smoking](https://twitter.com/kr3at/status/1240296333354950658?s=19)/vaping ([source 1](https://www.reuters.com/article/us-health-coronavirus-usa-vaping/smoking-or-vaping-increases-vulnerability-to-coronavirus-says-nyc-mayor-idUSKBN20V0Z0)), ([source 2](https://journals.lww.com/cmj/Abstract/publishahead/Analysis_of_factors_associated_with_disease.99363.aspx)). Quitting now [can save your life](https://coronawiki.org/page/covid-19-the-role-of-smoking-cessation-during-respiratory-virus-epidemics).

* Lung disease, including asthma or chronic obstructive pulmonary disease (chronic bronchitis or emphysema) or other chronic conditions associated with impaired lung function or that require home oxygen (Source: [CDC](https://www.cdc.gov/coronavirus/2019-ncov/downloads/community-mitigation-strategy.pdf), last page)

* **UPDATE:** March 18th: ""99% of Those Who Died From Virus Had Other Illness, Italy Says"" ([article](https://www.bloomberg.com/news/articles/2020-03-18/99-of-those-who-died-from-virus-had-other-illness-italy-says) | [discussion](https://www.reddit.com/r/Coronavirus/comments/fkq6vz/99_of_those_who_died_from_virus_had_other_illness/))

* **UPDATE:** March 20th: [Comorbidities in Italy published](https://www.covidgraph.com/p/coronavirus.html#comorbidities). 48.6% of deceased had 3+ comorbidities.

* **UPDATE:** March 22nd: [Study Calculates Just How Much Age, Medical Conditions Raise Odds Of Severe COVID-19](https://www.npr.org/sections/coronavirus-live-updates/2020/03/22/819846180/study-calculates-just-how-much-age-medical-conditions-raise-odds-of-severe-covid?utm_medium=RSS&utm_campaign=health)

**If you fall into any of the above categories, the CDC says ""it is especially important for you to take actions to reduce your risk of exposure.""**

UPDATE: The [New York Times detailed](https://www.nytimes.com/2020/03/12/health/coronavirus-midlife-conditions.html) how 40% of Americans have chronic conditions and should immediately start taking extra precautions.

Sources for comorbidities: [WHO report](https://www.who.int/docs/default-source/coronaviruse/who-china-joint-mission-on-covid-19-final-report.pdf) / [CDC](https://www.cdc.gov/coronavirus/2019-ncov/specific-groups/high-risk-complications.html), more from [CDC](https://www.cdc.gov/coronavirus/2019-ncov/downloads/community-mitigation-strategy.pdf). A CDC guide titled [People at Higher Risk for COVID-19 Complications](https://www.cdc.gov/coronavirus/2019-ncov/specific-groups/high-risk-complications.html) expounds on the point.

#**MORTALITY RATE:**

(As of 20 February 2020 and based on 55,924 laboratory-confirmed cases in China as per the [WHO report](https://www.who.int/docs/default-source/coronaviruse/who-china-joint-mission-on-covid-19-final-report.pdf). Please note mortality will differ from region to region based on regional comorbidities, as well as a host of other variables such as healthcare infrastructure, response measures taken, etc.)

Age | [% of population](https://www.populationpyramid.net/china/2019/) | [% of infected](http://rs.yiigle.com/yufabiao/1181998.htm) | [Fatality](http://rs.yiigle.com/yufabiao/1181998.htm) 
:- | - | - | -:
0-9 | 12.0% | 0.9% | 0
10-19| 11.6% | 1.2% | 0.1%
20-29 | 13.5% | 8.1% | 0.2%
30-39 | 15.6% | 17.0% |  0.2%
40-49 | 15.6% | 19.2% | 0.4%
50-59 | 15.0% | 22.4% | 1.3%
60-69 | 10.4% | 19.2% | **3.6%**
70-79 | 4.7% | 8.8% | **8.0%**
80+ | 1.8% | 3.2% | **14.8%**

#**ADDITIONALS:**

* The Average time from first symptoms to death is estimated to be 18 days ([source paper](https://institutefordiseasemodeling.github.io/nCoV-public/analyses/first_adjusted_mortality_estimates_and_risk_assessment/2019-nCoV-preliminary_age_and_time_adjusted_mortality_rates_and_pandemic_risk_assessment.html)). Again, the metrics skew toward comorbidities.

* But even as a young person you want to avoid COVID-19, and not only because you could pass it on to vulnerable others, but because experts don't know what the longterm side effects are. And then there's the potential of suffering. The following is an example of a healthy 25-year-old nonsmoker who felt like he was going to suffocate [from the virus](https://news.sky.com/story/fighting-coronavirus-one-of-the-first-british-sufferers-describes-his-ordeal-11950631). A fit Olympic swimmer said it was [""by far the worst virus I ever had.""](https://www.newsweek.com/olympic-champion-swimmer-diagnosed-coronavirus-calls-it-worse-virus-i-have-ever-endured-1493664). Take precautions, or [this can happen to you](https://nymag.com/intelligencer/2020/03/the-story-of-a-coronavirus-infection.html?__twitter_impression=true).

* The virus is of zoonotic origin. March 17th update: The proximal origin of SARS-CoV-2: ""Our analyses clearly show that SARS-CoV-2 is not a laboratory construct or a purposefully manipulated virus."" (Source [study](https://www.nature.com/articles/s41591-020-0820-9)). A genome analysis published March 20th suggests two viruses may have combined ([source](https://www.weforum.org/agenda/2020/03/coronavirus-origins-genome-analysis-covid19-data-science-bats-pangolins/)).

#**LANGUAGE TRANSLATIONS OF THIS DOCUMENT**

* [English PDF version](https://docdro.id/30e3nnc) of this document for emailing purposes

* [Portuguese](https://www.reddit.com/r/brasil/comments/fh0v56/utilidade_p%C3%BAblica_sobre_o_covid19_um_alerta/)

* [Spanish](https://www.reddit.com/r/es/comments/fjbtdj/megahilo_de_info_recursos_sobre_el_covid19/)

* [Greek](https://www.reddit.com/r/greece/comments/fjjiyh/covid19_m%CE%AF%CE%B1_%CF%80%CF%81%CE%BF%CE%B5%CE%B9%CE%B4%CE%BF%CF%80%CE%BF%CE%AF%CE%B7%CF%83%CE%B7/)

You are invited to translate this document into your native language and post it to your native country sub. Please message me with the link so I can post it into this PSA. Thank you.

#**GET INVOLVED:**

* Can you sew? Hospitals need your help [making masks from home](https://myemail.constantcontact.com/Million-Mask-Challenge--Hospitals-have-called-on-us-sewers--Are-you-able-to-help-.html?soid=1105979720101&aid=4kcHrXQHqbE). [How household materials](https://twitter.com/CMichaelGibson/status/1239718351573843973) stack up.

* Have a 3D printer? Consider [making face shields](https://budmen.com/) for frontline health workers.

* 3D printing, programming, modeling, organizing, or doing anything else to help out? Want to chip in somehow and looking for a project? ([discussion](https://www.reddit.com/r/COVIDProjects/))

* If you have a relevant skillset, consider joining the Ultimate Medical Hackathon: How Fast Can We Design And Deploy An Open Source Ventilator? ( [source](https://hackaday.com/2020/03/12/ultimate-medical-hackathon-how-fast-can-we-design-and-deploy-an-open-source-ventilator/) | [discussion](https://www.reddit.com/r/Coronavirus/comments/fkhgu3/12_million_member_we_can_do_this_guys_open_source/) )

* A reminder: If, in the coming months, you find yourself in need of a particular mechanical object that has run out (e.g. nasal cannulas), there are tens of thousands of redditors capable of producing replacements under short notice, often needing little more than a picture and rough dimensions. ([discussion](https://www.reddit.com/r/medicine/comments/fkrw2p/a_reminder_if_in_the_coming_months_you_find/))

#**A CURATED SET OF LINKS WORTHY OF YOUR TIME:**

* [Global COVID-19 metrics](https://coronawiki.org/) / [Live numbers of global infections](https://gisanddata.maps.arcgis.com/apps/opsdashboard/index.html#/bda7594740fd40299423467b48e9ecf6)

* [A scientist answers why South Korea's response is the best so far](https://www.reddit.com/r/Coronavirus/comments/fi14db/we_are_four_swiss_scientists_studying/fkepbz0/)

* [Coronaviruses: How long can they survive on surfaces?](https://www.medicalnewstoday.com/articles/coronaviruses-how-long-can-they-survive-on-surfaces)

* [A Guide: How To Prepare Your Home For Coronavirus](https://www.npr.org/sections/goatsandsoda/2020/02/26/809650625/a-guide-how-to-prepare-your-home-for-coronavirus)

* [Nursing 101: Caring for your loved ones at home](https://www.reddit.com/r/Coronavirus/comments/f513zm/nursing_101_caring_for_your_loved_ones_at_home/)

**FOR HEALTH WORKERS/HOSPITALS**

* Handbook of Covid-19 Prevention and Treatment from Hospital with 0% fatality after treating 104 patients, funded and translated by Jack Ma & Alibaba ( [Handbook](https://video-intl.alicdn.com/Handbook%20of%20COVID-19%20Prevention%20and%20Treatment.pdf) | [Discussion](https://www.reddit.com/r/Coronavirus/comments/fl3f67/handbook_of_covid19_prevention_and_treatment_from/) )

* [How to Triple Ventilator Capacity in 10 Minutes](https://www.saasceo.com/ventilator-capacity/)

* [What US Hospitals Should Do Now to Prepare for a COVID-19 Pandemic](http://www.centerforhealthsecurity.org/cbn/2020/cbnreport-02272020.html)

**OFFICIAL NATIONAL/INTERNATIONAL**

* [Health Canada's COVID-19 Resource Centre](https://www.canada.ca/en/public-health/services/diseases/2019-novel-coronavirus-infection.html)

* [CDC's COVID-19 page](https://www.cdc.gov/coronavirus/2019-ncov/index.html)

* [Latest on the virus direct from Harvard](https://www.hsph.harvard.edu/news/hsph-in-the-news/the-latest-on-the-coronavirus/)

* [World Health Organization's rolling updates on coronavirus disease for COVID-19](https://www.who.int/emergencies/diseases/novel-coronavirus-2019/events-as-they-happen)

* [Google COVID-19 resource page](https://www.google.com/covid19/)

Why I created this post:

I've done the best job I could giving the sources context. I've asked the public and some medical professionals to weigh in, and have adjusted the document based on what they have said. Nonetheless, to reiterate, you are responsible for your own health and your own research. I'm just a volunteer who's put countless hours into this as I have a very particular communicative and collative skillset that I suspected could be of benefit in this ordeal—that and I've been following COVID-19 closely since mid-January. I hummed and hawed whether to even to start this document, yet after seeing how much it benefited people even in its crude early form, I decided to give it all of my focus.

And now the beast is upon my doorstep, and I too have susceptible loved ones around me.

The aim of this document was to inform, without minimizing risk. Accurate information reduces panic and anxiety, and helps people make the right decisions in a difficult time. I hope it succeeded in that regard, and that you found it useful. 

Yet there's always room for improvement, so feel free to constructively suggest changes (but if you're going to be a jerk about it, you will simply be blocked and ignored, and that's that). If you have a trustworthy more up-to-date source on an old metric of mine, please leave it in the comments. Also you are welcome to suggest alternative word/sentence choice changes. 

As I mentioned in the intro, this document went through many versions. Thank you to those from all around the world who had constructively weighed in to make it a more robust and useful PSA. 

Other communities are invited to post a link to the source doc in the [Canada sub](https://www.reddit.com/r/canada/comments/fghd23/psa_regarding_covid19_a_warning/), which will be kept up to date (as will any PSA I posted myself, as long as it's still on the main page of your sub).

My very best wishes from Victoria, BC, Canada, and good luck to us all.

P.S. Feel free to share this post without attribution to me. This was never about credit.

P.P.S. ""Everything we do before a pandemic will seem alarmist. Everything we do after will seem inadequate."" —Michael Leavitt

P.P.P.S. [A touching note to the world.](https://i.imgur.com/FlYIXTr.jpg)",canada,PSA Regarding COVID-19: A Warning,0.95,https://www.reddit.com/r/canada/comments/fghd23/psa_regarding_covid19_a_warning/
