author,author_flair_text,created_utc,distiguished,edited,id,is_original_content,is_self,name,num_comments,over_18,permalink,score,selftext,subreddit,title,upvote_ratio,url
threeohsix,,1626047367,,False,oifjri,False,False,t3_oifjri,31,False,/r/canada/comments/oifjri/provincewide_covid19_restrictions_lifted_in_sask/,210,,canada,Provincewide COVID-19 restrictions lifted in Sask.,0.92,https://www.cbc.ca/news/canada/saskatchewan/sask-drops-pandemic-restrictions-july-11-1.6093719
viva_la_vinyl,,1625918003,,False,ohhbr7,False,False,t3_ohhbr7,131,False,/r/canada/comments/ohhbr7/majority_of_canadians_think_covid19_us_border/,105,,canada,Majority of Canadians think COVID-19 U.S. border restrictions should lift this year: Nanos,0.81,https://www.ctvnews.ca/politics/majority-of-canadians-think-covid-19-u-s-border-restrictions-should-lift-this-year-nanos-1.5504112
StatCanada,:Canada: OFFICIEL/OFFICIAL CANADA :Canada:,1625837316,,False,ogvk37,False,True,t3_ogvk37,5,False,/r/canada/comments/ogvk37/employment_in_canada_increased_in_june_as_public/,8,"We just released our new Labour Force Survey data, which reflect Canada’s labour market conditions for the week of June 13 to 19, 2021.

Here are a few highlights:

* Employment rose by 231,000 (+1.2%) in June, following a cumulative decline of 275,000 over the previous two months.
* Employment gains brought the accommodation and food services industry to within 21.6% (-263,000) of its pre-COVID-19 employment level, the smallest gap since November 2020.
* Employment among youth aged 15 to 24 rose by 164,000 (+7.1%) in June, the largest single-month increase for this age group since July 2020.

For more on these results, [check out our latest article.](https://www150.statcan.gc.ca/n1/daily-quotidien/210709/dq210709a-eng.htm?HPA=1?utm_source=rddt&utm_medium=smo&utm_campaign=statcan-lfs-21-22)

*\[We are Canada’s national statistical agency. We are here to engage with Canadians and provide them with high-quality statistical information that matters! Publishing in a subreddit does not imply we endorse the content posted by other redditors.\]*

\*

Nous venons tout juste de publier les nouvelles données de l’Enquête sur la population active qui rendent compte de la situation du marché du travail pour la semaine allant du 13 au 19 juin 2021.

Voici quelques points saillants :

* L’emploi a augmenté de 231 000 (+1,2 %) en juin, après avoir enregistré une baisse cumulative de 275 000 au cours des deux mois précédents.
* La hausse de l’emploi de juin a porté le secteur des services d’hébergement et de restauration à 21,6 % (-263 000) de son niveau d’emploi observé avant la COVID-19, ce qui représente l’écart le plus faible depuis novembre 2020.
* L’emploi chez les jeunes âgés de 15 à 24 ans a augmenté de 164 000 (+7,1 %) en juin. Il s’agit de la plus forte croissance en un seul mois pour ce groupe d’âge depuis juillet 2020.

Pour en savoir plus sur ces résultats, [consultez notre nouveau communiqué.](https://www150.statcan.gc.ca/n1/daily-quotidien/210709/dq210709a-fra.htm?HPA=1?HPA=1?utm_source=rddt&utm_medium=smo&utm_campaign=statcan-lfs-21-22)

*\[Nous sommes l’organisme national de statistique du Canada. Nous sommes ici pour discuter avec les Canadiens et les Canadiennes et leur fournir des renseignements statistiques de grande qualité qui comptent! Le fait de publier dans un sous-reddit ne signifie pas que nous approuvons le contenu affiché par d'autres utilisateurs de Reddit.\]*",canada,Employment in Canada increased in June as public health restrictions were eased / L’emploi a augmenté en juin par suite de l’assouplissement des restrictions de santé publique,0.62,https://www.reddit.com/r/canada/comments/ogvk37/employment_in_canada_increased_in_june_as_public/
Darrylp796,,1625777381,,False,ogg5bt,False,False,t3_ogg5bt,2,False,/r/canada/comments/ogg5bt/wait_for_border_restrictions_to_drop_frustrates/,14,,canada,Wait for border restrictions to drop frustrates on both sides of US-Canada boundary,0.68,https://www.nny360.com/news/nationandworld/wait-for-border-restrictions-to-drop-frustrates-on-both-sides-of-us-canada-boundary/article_f90b6cd5-6a4d-52ff-b9e4-14b688ec4863.html
ChaZz182,,1625758158,,False,og9jyo,False,False,t3_og9jyo,10,False,/r/canada/comments/og9jyo/restrictions_are_ending_but_covid_is_not_premier/,10,,canada,Restrictions are ending but COVID is not: Premier (Saskatchewan),0.71,https://www.ckom.com/2021/07/07/restrictions-are-ending-but-covid-is-not-premier/
Seaeend,,1625693378,,False,ofskhf,False,False,t3_ofskhf,2,False,/r/canada/comments/ofskhf/one_mothers_humanrights_victory_over_hardline/,10,,canada,One mother's human-rights victory over hardline COVID restrictions,0.62,https://www.macleans.ca/society/one-mothers-human-rights-victory-over-hardline-covid-restrictions/
constructional_HK,Nunavut :Nunavut:,1625455455,,False,odyto8,False,False,t3_odyto8,33,False,/r/canada/comments/odyto8/border_restrictions_to_begin_easing_slowly_for/,20,,canada,Border restrictions to begin easing slowly for fully vaccinated Canadian travellers Monday,0.75,https://www.cbc.ca/news/politics/border-restrictions-easing-monday-1.6089599
viva_la_vinyl,,1625410027,,False,odlvyb,False,False,t3_odlvyb,21,False,/r/canada/comments/odlvyb/border_restrictions_to_begin_easing_slowly_for/,85,,canada,"Border restrictions to begin easing, slowly, for fully vaccinated Canadian travellers",0.86,https://www.ctvnews.ca/health/coronavirus/border-restrictions-to-begin-easing-slowly-for-fully-vaccinated-canadian-travellers-1.5495964
viva_la_vinyl,,1625247901,,False,ocf8ax,False,False,t3_ocf8ax,6,False,/r/canada/comments/ocf8ax/travel_restrictions_still_remain_despite_some/,13,,canada,"Travel restrictions still remain, despite some being relaxed on July 5, CBSA warns",0.73,https://globalnews.ca/news/7998304/canada-borders-easing-travel-restrictions/
feb914,Ontario :Ontario:,1625234806,,False,ocat48,False,False,t3_ocat48,4,False,/r/canada/comments/ocat48/federal_court_giving_ottawa_advance_permission_to/,22,,canada,Federal Court giving Ottawa advance permission to tighten COVID restrictions called 'dangerous',0.68,https://nationalpost.com/news/canada/federal-court-giving-ottawa-advance-permission-to-tighten-covid-restrictions-called-dangerous
90skid91,,1625189399,,False,obzyg0,False,False,t3_obzyg0,2,False,/r/canada/comments/obzyg0/eu_recommends_travel_restrictions_be_lifted_for/,11,,canada,"EU recommends travel restrictions be lifted for Canada, 9 other countries",0.7,https://globalnews.ca/news/7995990/covid-coronavirus-travel-restrictions-europe-canadians-canada/
morenewsat11,,1625052156,,False,oav91a,False,False,t3_oav91a,6,False,/r/canada/comments/oav91a/new_eu_vaccine_rules_could_restrict_travel_by/,12,,canada,New EU vaccine rules could restrict travel by many Africans and Canadians,0.83,https://www.theglobeandmail.com/world/article-new-eu-vaccine-rules-could-restrict-travel-by-many-africans-and/
Optimal-Plate-966,,1624916434,,False,o9u3d6,False,False,t3_o9u3d6,22,False,/r/canada/comments/o9u3d6/doug_ford_tells_ontarians_to_just_hang_in_there/,21,,canada,Doug Ford tells Ontarians to ‘just hang in there’ as pressure mounts to ease COVID-19 restrictions,0.67,https://www.thestar.com/politics/provincial/2021/06/28/doug-ford-tells-ontarians-to-just-hang-in-there-as-pressure-mounts-to-ease-covid-19-restrictions.html
c0viD00M,,1624889260,,False,o9kz4v,False,False,t3_o9kz4v,123,False,/r/canada/comments/o9kz4v/nearly_30_per_cent_broke_covid19_restrictions/,171,,canada,"Nearly 30 per cent broke COVID-19 restrictions, felt justified: Canada-wide survey",0.88,https://www.ctvnews.ca/health/coronavirus/nearly-30-per-cent-broke-covid-19-restrictions-felt-justified-canada-wide-survey-1.5488104
viva_la_vinyl,,1624876960,,False,o9hpnf,False,False,t3_o9hpnf,79,False,/r/canada/comments/o9hpnf/nearly_30_per_cent_of_respondents_broke_covid19/,96,,canada,Nearly 30 per cent of respondents broke COVID-19 restrictions: Canada-wide survey,0.87,https://www.thestar.com/news/canada/2021/06/28/nearly-30-per-cent-of-respondents-broke-covid-19-restrictions-canada-wide-survey.html
Darrylp796,,1624746673,,False,o8kkza,False,False,t3_o8kkza,17,False,/r/canada/comments/o8kkza/with_travel_restrictions_barely_easing_uscanada/,35,,canada,"With travel restrictions barely easing, U.S.-Canada border towns stuck in economic limbo",0.72,https://www.seattletimes.com/business/international-trade/with-travel-restrictions-barely-easing-u-s-canada-border-towns-stuck-in-economic-limbo/
Darrylp796,,1624739153,,False,o8idrm,False,False,t3_o8idrm,38,False,/r/canada/comments/o8idrm/four_signs_that_point_to_a_july_21_easing_of/,59,,canada,Four signs that point to a July 21 easing of U.S.-Canada border restrictions,0.82,https://www.politico.com/news/2021/06/25/july-21-us-canada-border-496415
FancyNewMe,,1624493488,,False,o6pebi,False,False,t3_o6pebi,40,False,/r/canada/comments/o6pebi/confusion_frustration_as_canadians_react_to/,46,,canada,"Confusion, frustration as Canadians react to COVID-19 travel restrictions for unvaccinated children",0.8,https://www.ctvnews.ca/health/coronavirus/confusion-frustration-as-canadians-react-to-covid-19-travel-restrictions-for-unvaccinated-children-1.5483221
KanataCitizen,Ontario :Ontario:,1624456044,,False,o6d5lt,False,False,t3_o6d5lt,48,False,/r/canada/comments/o6d5lt/why_is_ottawa_moving_so_slowly_on_travel/,20,,canada,"Why is Ottawa moving so slowly on travel restrictions? Because ‘things can change quickly,’ insiders say",0.62,https://www.thestar.com/politics/federal/2021/06/21/why-is-ottawa-moving-so-slowly-on-travel-restrictions-because-things-can-change-quickly-insiders-say.html
cyclinginvancouver,,1624381422,,False,o5rwlr,False,False,t3_o5rwlr,80,False,/r/canada/comments/o5rwlr/trudeau_says_border_restrictions_will_be_further/,87,,canada,Trudeau says border restrictions will be further relaxed 'in the coming weeks' if all goes well | CBC News,0.85,https://www.cbc.ca/news/politics/trudeau-border-restrictions-coming-weeks-1.6075398
cyclinginvancouver,,1624284851,,False,o4w22r,False,False,t3_o4w22r,1610,False,/r/canada/comments/o4w22r/canada_lifting_restrictions_for_fully_vaccinated/,9728,,canada,Canada lifting restrictions for fully vaccinated travellers starting July 5,0.95,https://www.ctvnews.ca/health/coronavirus/canada-lifting-restrictions-for-fully-vaccinated-travellers-starting-july-5-1.5478703
HazelWyatt,,1624264852,,False,o4qo8b,False,False,t3_o4qo8b,12,False,/r/canada/comments/o4qo8b/us_extends_covid19_travel_restrictions_with/,6,,canada,US extends Covid-19 travel restrictions with Canada and Mexico,0.64,https://www.cnn.com/travel/article/us-canada-mexico-covid-travel-restrictions-extended/index.html
morenewsat11,,1624070177,,False,o369qt,False,False,t3_o369qt,148,False,/r/canada/comments/o369qt/alberta_set_to_be_first_province_to_lift_nearly/,245,,canada,Alberta set to be first province to lift nearly all COVID-19 public-health restrictions on July 1,0.91,https://www.theglobeandmail.com/canada/alberta/article-alberta-set-to-be-first-province-to-lift-nearly-all-covid-19-public/
tmleafsfan,,1624065719,,False,o352w2,False,False,t3_o352w2,58,False,/r/canada/comments/o352w2/us_politicians_fume_over_canadas_extended_border/,34,,canada,U.S. politicians fume over Canada's extended border restrictions | CBC News,0.69,https://www.cbc.ca/news/world/us-canada-border-closed-reaction-1.6071737?__vfz=medium%3Dsharebar
ValentinoSaprano,,1624055978,,False,o32496,False,False,t3_o32496,92,False,/r/canada/comments/o32496/alberta_1st_province_in_canada_to_lift_all/,121,,canada,Alberta 1st province in Canada to lift all COVID-19 public health restrictions,0.9,https://www.agassizharrisonobserver.com/news/alberta-1st-province-in-canada-to-lift-all-covid-19-public-health-restrictions/
cyclinginvancouver,,1624026014,,False,o2q6ys,False,False,t3_o2q6ys,775,False,/r/canada/comments/o2q6ys/canada_extending_us_border_restrictions_to_july_21/,487,,canada,Canada extending U.S. border restrictions to July 21,0.9,https://www.bnnbloomberg.ca/canada-extending-u-s-border-restrictions-to-july-21-1.1618748
morenewsat11,,1623927761,,False,o1uk0i,False,False,t3_o1uk0i,36,False,/r/canada/comments/o1uk0i/economist_says_travel_restrictions_continue_to/,24,,canada,"Economist says travel restrictions continue to take toll on border cities, plans need to be made",0.81,https://www.cbc.ca/news/canada/windsor/pressure-government-loosen-border-restrictions-1.6068543
getalladvice,,1623911825,,False,o1qkg5,False,False,t3_o1qkg5,4,False,/r/canada/comments/o1qkg5/canada_tourism_restrictions_reopening_2021_latest/,0,,canada,Canada Tourism Restrictions & Reopening 2021 Latest Updates,0.42,https://www.getalladvice.com/canada-tourism-restrictions-till-21-june-latest-updates/
coexistwiththechill,Québec :Quebec:,1623868505,,False,o1bx9k,False,False,t3_o1bx9k,27,False,/r/canada/comments/o1bx9k/border_restrictions_could_be_eased_in_late_july/,24,,canada,"Border restrictions could be eased in late July or August, top Canadian official says",0.75,https://buffalonews.com/news/local/border-restrictions-could-be-eased-in-late-july-or-august-top-canadian-official-says/article_50700cc4-cdea-11eb-b002-1fe100b23545.html
FancyNewMe,,1623860677,,False,o18se9,False,False,t3_o18se9,299,False,/r/canada/comments/o18se9/fullyvaccinated_americans_have_had_looser/,162,,canada,Fully-vaccinated Americans have had looser restrictions for months. Why don't Canadians?,0.73,https://www.ctvnews.ca/health/coronavirus/fully-vaccinated-americans-have-had-looser-restrictions-for-months-why-don-t-canadians-1.5472633
YYZ-Donut-Shop,,1623793461,,False,o0ped9,False,False,t3_o0ped9,25,False,/r/canada/comments/o0ped9/canadians_can_expect_an_announcement_on_easing/,39,,canada,Canadians can expect an announcement on easing travel restrictions by Monday: LeBlanc,0.82,https://www.castanet.net/news/Canada/337082/LeBlanc-signals-some-cautious-easing-of-pandemic-travel-restrictions-coming-soon
cyclinginvancouver,,1623719527,,False,o020k9,False,False,t3_o020k9,37,False,/r/canada/comments/o020k9/us_canada_set_to_discuss_lifting_of_border/,27,,canada,"U.S., Canada set to discuss lifting of border restrictions -sources",0.84,https://www.reuters.com/article/health-coronavirus-usa-borders/us-canada-set-to-discuss-lifting-of-border-restrictions-sources-idUSL2N2NX003
smitcolin,Ontario :Ontario:,1623690155,,False,nzrhlh,False,False,t3_nzrhlh,12,False,/r/canada/comments/nzrhlh/ontarioquebec_border_restrictions_to_end_wednesday/,91,,canada,Ontario-Quebec border restrictions to end Wednesday,0.91,https://www.cbc.ca/news/canada/ottawa/ottawa-gatineau-border-to-reopen-1.6064760
experimentalaircraft,,1623486218,,False,ny1z1f,False,False,t3_ny1z1f,38,False,/r/canada/comments/ny1z1f/unacceptable_environmental_effects_new_federal/,56,,canada,'Unacceptable environmental effects': New federal policy restricts thermal coal,0.84,https://www.cbc.ca/news/canada/edmonton/unacceptable-environmental-effects-new-federal-policy-restricts-thermal-coal-1.6062173
morenewsat11,,1623316934,,False,nwjack,False,False,t3_nwjack,45,False,/r/canada/comments/nwjack/canada_still_lacks_national_guidance_for_fully/,118,,canada,Canada still lacks national guidance for fully vaccinated Canadians as travel restrictions ease,0.87,https://www.cbc.ca/news/health/canada-vaccine-guidelines-travel-quarantine-1.6059623
fan_22,British Columbia,1623285309,,False,nwanxr,False,False,t3_nwanxr,27,False,/r/canada/comments/nwanxr/ppcs_bernier_endorses_controversial_vancouver/,33,,canada,PPC's Bernier endorses controversial Vancouver restaurant that defied COVID-19 restrictions (PHOTOS),0.69,https://www.vancouverisawesome.com/vancouver-news/ppcs-bernier-endorses-controversial-vancouver-restaurant-that-defied-covid-19-restrictions-photos-3858617
Mighty_L_LORT,,1623256401,,False,nw03a4,False,False,t3_nw03a4,19,False,/r/canada/comments/nw03a4/us_loosens_travel_restrictions_for_many_nations/,68,,canada,U.S. loosens travel restrictions for many nations including Canada as pandemic eases,0.86,https://nationalpost.com/news/world/u-s-loosens-travel-restrictions-for-many-nations-as-pandemic-eases
lockdownssuck,,1623176075,,False,nvajqp,False,False,t3_nvajqp,145,False,/r/canada/comments/nvajqp/doug_ford_says_london_can_ease_restrictions_to/,180,,canada,Doug Ford says London can ease restrictions to allow gathering at vigil for London attack,0.84,https://globalnews.ca/news/7930493/premier-doug-ford-london-attack-statement/
Ashamed-Grape7792,,1686487152,,False,146sxcg,False,False,t3_146sxcg,43,False,/r/canada/comments/146sxcg/canadians_celebrate_summer_with_nationwide/,821,,canada,Canadians celebrate summer with nationwide campfire,0.93,https://www.thebeaverton.com/2023/06/canadians-celebrate-summer-with-nationwide-campfire/
toronto34,,1565297749,,False,cnrw1y,False,False,t3_cnrw1y,33,False,/r/canada/comments/cnrw1y/crews_extinguished_32_abandoned_campfires_over/,126,,canada,Crews extinguished 32 abandoned campfires over long weekend,0.98,https://bc.ctvnews.ca/crews-extinguished-32-abandoned-campfires-over-long-weekend-1.4540374
plagueapple,,1563054576,,False,ccuz5f,False,True,t3_ccuz5f,20,False,/r/canada/comments/ccuz5f/campfires_and_log_cabins/,0,Is it allowed to make campfires and small log cabins in the candian wilderness,canada,Campfires and log cabins,0.36,https://www.reddit.com/r/canada/comments/ccuz5f/campfires_and_log_cabins/
GeraldtonSteve,,1535858216,,False,9c933v,False,False,t3_9c933v,5,False,/r/canada/comments/9c933v/happy_labour_day_weekend_fellow_canucks_may_the/,44,,canada,"Happy Labour Day weekend, fellow canucks. May the campfires be warm and the beers cold.",0.74,https://i.redd.it/keynomahtqj11.jpg
canuck_11,Alberta,1503537117,,False,6vni31,False,False,t3_6vni31,39,False,/r/canada/comments/6vni31/firefighters_fined_1150_for_campfire_in_bc/,64,,canada,"Firefighters fined $1,150 for campfire in B.C. Interior during burning ban",0.9,http://www.cbc.ca/beta/news/canada/british-columbia/campfire-ban-firefighters-photos-wildfire-1.4259787
jesusporkchop,New Brunswick,1500136135,,False,6ngtkb,False,False,t3_6ngtkb,3,False,/r/canada/comments/6ngtkb/justin_trudeau_suffers_third_degree_burns_from/,0,,canada,Justin Trudeau suffers third degree burns from failed attempt to jump over campfire,0.41,https://www.thebeaverton.com/2017/07/justin-trudeau-suffers-third-degree-burns-failed-attempt-jump-campfire/
Caoimhi,,1448335084,,False,3u149x,False,True,t3_3u149x,13,False,/r/canada/comments/3u149x/winter_campfire/,2,"My Dad is from Canada and despite having never been to Canada myself I'm a dual citizen US and Canada.  My Dad us always going on about how beautiful Canada is and how I need to take a trip up there.  One of my favorite things is to go camping in winter.  I'm from Texas so winter is really mild compared to your guy's winter.  The coldest camping trip I've ever done was 14f with no snow.  I would love to take a camping trip in Canada during the winter with all the snow, but how do you keep a fire lit?  Doesn't the snow melt and ruin your fire?  It wouldn't be nearly as much fun if I can't have a fire.  I'm thinking about planning a trip in the next few months and I want to visit some family but I would like to go camping for at least part of the trip but I'm scared of not being able to have a fire, also of not being ready and freezing to death, but I can always just leave in the car if I get scared.",canada,Winter campfire,0.67,https://www.reddit.com/r/canada/comments/3u149x/winter_campfire/
adriantpa,,1430349651,,False,34c2ur,False,True,t3_34c2ur,24,False,/r/canada/comments/34c2ur/going_on_a_camping_trip_in_2_weeks_and_visiting/,3,"Hello fellow canadian redditors, 

my girlfriend and me will be visiting canada for the first time. We rented a Motorhome C19 with Fraserway and will be starting our tour in Calgary.  
So far we do not have a plan except visiting some national parks nearby (Jasper/Banff), Athabasca Falls might be in as well. 

I have a ton of questions which I didn´t find any satisfying answers to, so I´ll just ask right away.

1. Am I allowed to park the RV wherever I want overnight or do we have to be on a campsite?

2. What is the typical cost on groceries and whatnot per week in canada (we´re going to bring around 1500 CAD for 14 days)

3. How long will the battery usually supply us with power if we happen to not find a nearby campsite with power hook ups?

4. Any advice on super cool attractions? We are a lot into nature sights and its beauty! 

5. Where can we set up a campfire and more importantly where not? 

6. What are some have-to-see sights/places in alberta that are not particularly mentioned in the standard guides? 

7. Any other advice, for some 24year old europeans that could help? 
",canada,Going on a Camping Trip in 2 Weeks and visiting Canada for the first time. Any Advice?,0.72,https://www.reddit.com/r/canada/comments/34c2ur/going_on_a_camping_trip_in_2_weeks_and_visiting/
WildFireca,British Columbia,1345153323,,False,ycbzv,False,False,t3_ycbzv,1,False,/r/canada/comments/ycbzv/bc_woman_charged_after_dead_dog_found_burning_in/,0,,canada," 
 
 
B.C. woman charged after dead dog found burning in campfire; 2nd dog missing and presumed dead

",0.5,http://www.vancouversun.com/life/Woman+charged+after+kennel+found+campfire/7096818/story.html
ubcstaffer123,,1694729745,,False,16ivq4k,False,False,t3_16ivq4k,10,False,/r/canada/comments/16ivq4k/alcohol_prohibition_not_the_solution_in_nunavik/,16,,canada,"Alcohol prohibition ‘not the solution in Nunavik,’ police chief says",0.79,https://ca.news.yahoo.com/alcohol-prohibition-not-solution-nunavik-121600598.html
sleipnir45,,1693578222,,False,1678k8m,False,False,t3_1678k8m,392,False,/r/canada/comments/1678k8m/buyback_program_for_prohibited_guns_facing_public/,444,,canada,Buyback program for prohibited guns facing public resistance: Report,0.87,https://torontosun.com/news/national/buyback-program-for-prohibited-guns-facing-public-resistance-report
zlixOS,,1685474253,,False,13vzbj5,False,False,t3_13vzbj5,315,False,/r/canada/comments/13vzbj5/parliament_attempting_to_prohibit_the_possession/,174,,canada,Parliament attempting to prohibit the possession of gun-related CAD files,0.82,https://www.parl.ca/DocumentViewer/en/44-1/bill/C-21/third-reading
FancyNewMe,,1682466350,,False,12z04o2,False,False,t3_12z04o2,224,False,/r/canada/comments/12z04o2/feds_working_toward_clear_consistent_definition/,83,,canada,"Feds working toward 'clear, consistent' definition of prohibited assault-style guns",0.72,https://ca.news.yahoo.com/missing-action-gun-control-groups-080000500.html
DonSalaam,,1667101830,,False,yh3sxk,False,False,t3_yh3sxk,295,False,/r/canada/comments/yh3sxk/alberta_government_to_try_to_prohibit_covid19/,320,,canada,"Alberta government to try to prohibit COVID-19 mask mandates in schools, Smith says",0.89,https://www.cbc.ca/news/canada/edmonton/alberta-government-to-try-to-prohibit-covid-19-mask-mandates-in-schools-smith-says-1.6634314
bcbuddy,,1664249773,,False,xp5bre,False,False,t3_xp5bre,648,False,/r/canada/comments/xp5bre/alberta_to_fight_federal_efforts_to_seize/,311,,canada,Alberta to fight federal efforts to seize prohibited 'assault-style' weapons: justice minister | National Post,0.84,https://nationalpost.com/news/politics/shandro-alberta-will-not-participate-in-federal-efforts-to-seize-prohibited-weapons
Defiant_Race_7544,,1663708310,,False,xjkqld,False,False,t3_xjkqld,23,False,/r/canada/comments/xjkqld/opinion_illegal_cannabis_services_prospering_due/,25,,canada,OPINION: Illegal cannabis services prospering due to local prohibitions,0.81,https://www.newmarkettoday.ca/columns/opinion/opinion-illegal-cannabis-services-prospering-due-to-local-prohibitions-5846062
Smashysmash2,,1659998188,,False,wjmdvy,False,False,t3_wjmdvy,253,False,/r/canada/comments/wjmdvy/opinion_should_taxpayers_pay_for_banned/,0,,canada,"Opinion | Should taxpayers pay for banned assault-style rifles, or can we prohibit the guns without compensating owners?",0.37,https://www.thestar.com/opinion/contributors/2021/07/14/should-taxpayers-pay-for-banned-assault-style-rifles-or-can-we-prohibit-the-guns-without-compensating-owners.html?rf
BurstYourBubbles,Canada,1649429658,,False,tz5c7h,False,False,t3_tz5c7h,43,False,/r/canada/comments/tz5c7h/prohibiting_demos_will_stamp_out_social_justice/,0,,canada,Prohibiting demos will stamp out social justice activism,0.4,https://torontosun.com/opinion/columnists/opinion-prohibiting-demonstrations-will-stamp-out-social-justice-activism
FancyNewMe,,1648852121,,False,tu3f75,False,False,t3_tu3f75,42,False,/r/canada/comments/tu3f75/minimum_sentence_for_prohibited_firearm/,0,,canada,"Minimum sentence for prohibited firearm possession costing $98M per year, PBO says",0.46,https://nationalpost.com/news/canada/minimum-sentence-for-prohibited-firearm-possession-costing-98m-per-year-pbo-says
cyclinginvancouver,,1646154757,,False,t4cw0s,False,False,t3_t4cw0s,39,False,/r/canada/comments/t4cw0s/government_of_canada_prohibits_russian_ships_and/,419,,canada,Government of Canada prohibits Russian ships and fishing vessels from entering Canadian ports and internal waters,0.95,https://www.canada.ca/en/transport-canada/news/2022/03/government-of-canada-prohibits-russian-ships-and-fishing-vessels-from-entering-canadian-ports-and-internal-waters.html
viva_la_vinyl,,1644980674,,False,stl9da,False,False,t3_stl9da,3316,False,/r/canada/comments/stl9da/emergencies_act_prohibits_bringing_children_food/,8585,,canada,"Emergencies Act prohibits bringing children, food or fuel to 'illegal' blockades",0.87,https://www.cp24.com/news/emergencies-act-prohibits-bringing-children-food-or-fuel-to-illegal-blockades-1.5782453
